General POS,Detailed POS
DT.* DT.* NN.* LM VB.* CC.* PR.* NN.* CC.* NN.* NN.*_PM.*,DTC DTCP NNC LM VBOF CCT PRI_CCP NNC CCB NNP NNP_PMC
CD.*_PM.*,CDB_PMP
PR.* DT.* VB.*_PM.*,PRI DTC VBAF_PMC
DT.* NN.* CC.* NN.* LM VB.* JJ.* JJ.* JJ.* CC.* NN.* CC.* CD.* NN.* CD.* PM.* NN.*_PM.*,DTC NNC CCB NNC LM VBTR_CCP JJCC JJD JJC CCT NNC CCB CDB NNPA CDB PMS NNPA_PMP
CC.* JJ.* CC.* NN.* CC.* NN.* CC.* NN.* NN.*_PM.*,CCT JJD CCB NNPA CCP NNC CCB NNP NNP_PMC
VB.* VB.* CC.* FW FW DT.* NN.* CC.* NN.* CC.* VB.* CC.* CD.* PM.* CC.* NN.* CC.* NN.* CC.* VB.* DT.* PR.* NN.* CC.* CD.* CC.* NN.*_PM.*,VBS VBW CCB FW FW DTC NNC CCB NNC CCT VBAF CCB CDB PMS CCB NNC CCB NNC CCB VBW DTC PRI_CCP NNC CCT CDB CCP NNC_PMC
CC.* NN.*_PM.*,CCB NNC_PMP
DT.* NN.* CC.* JJ.* NN.* NN.* LM VB.* CC.* NN.* RB.* VB.* DT.* NN.* VB.* VB.* DT.* PR.* CC.* NN.* RB.* CC.*,DTC NNC CCB JJN_CCP NNC NNC LM VBTF CCT NNP RBW VBTR_VBAF DTC NNC VBTR_CCP VBW DTC PRI CCB NNC RBW CCT
CD.* NN.*,CDB NNPA
CD.* NN.* NN.*_PM.*,CDB NNPA NNPA_PMP
DT.* JJ.* CC.* NN.* LM VB.* VB.* CC.* NN.*_PM.*,DTC JJD CCP NNC LM VBTR_CCP VBW CCT NNP_PMC
JJ.* PM.* CD.* CC.* NN.* CD.*_PM.*,JJN PMS CDB CCB NNP CDB_PMC
CC.* NN.* CC.* NN.* NN.* NN.* CD.* NN.* NN.* NN.*_PM.*,CCT NNC CCB NNP NNP NNP CDB NNP NNP NNP_PMP
DT.* JJ.* JJ.* NN.* LM VB.* CC.* NN.* PR.* NN.* RB.* VB.*_PM.*,DTC JJN_CCP JJD_CCP NNC LM VBAF CCT NNC PRI_CCP NNC RBW VBAF_PMP
VB.* CC.* PR.* NN.* VB.* JJ.* CC.* NN.* DT.* DT.* NN.* CC.* VB.* RB.* VB.* CC.* JJ.* NN.* DT.* DT.* NN.*_PM.*,VBTS CCB PRI_CCP NNC_CCP VBH JJD CCP NNC DTC DTCP NNC CCP VBAF RBW VBTR CCB JJN_CCP NNC DTC DTCP NNC_PMP
DT.* JJ.* CC.* DT.* NN.* LM VB.* CC.* CD.* NN.* NN.* NN.* PR.* PR.*_PM.*,DTC JJN CCP DTCP NNC LM VBTR CCB CDB NNC_CCP NNPA NNC PRI PRI_PMP
VB.* CC.* JJ.* VB.* DT.* VB.* CC.* DT.* NN.* CC.* JJ.* NN.* CC.* CC.* NN.* CC.* DT.* NN.*_PM.*,VBTS CCP JJD VBOB DTC VBTS CCP DTCP NNC CCT JJD_CCP NNC CCR CCT NNC CCB DTCP NNC_PMP
VB.* NN.* CD.* NN.* NN.* NN.* CC.* CC.* JJ.* NN.*_PM.*,VBH_CCP NNC_CCP CDB NNC_CCP NNPA NNC CCT CCT JJD_CCP NNC_PMP
DT.* DT.* NN.*_PM.*,DTC DTCP NNC_PMC
CC.* RB.* RB.* VB.*_PM.*,CCP RBF RBI VBTS_PMC
LM VB.* DT.* DT.* NN.* RB.* NN.* RB.* CC.*,LM VBTS DTC DTCP NNC RBW_CCP NNP RBW CCT
NN.*_,NNPA_
NN.* NN.*_PM.*,NNP NNP_PMC
DT.* PR.* CC.* DT.* JJ.* JJ.* NN.* CC.* NN.* CC.* CC.* NN.* CC.* CD.*_PM.*,DTC PRI CCT DTCP JJCS_JJD_CCP JJD_CCP NNC CCT NNP CCT CCT NNP CCA CDB_PMC
VB.* CC.* NN.*_PM.*,VBTS CCB NNC_PMP
PR.* DT.* JJ.* VB.* CC.* FW CC.* NN.* CC.* NN.* CC.* PR.* CC.* DT.* JJ.* RB.* CC.* NN.*_PM.*,PRO DTC JJCS_JJD_CCP VBTS CCB FW CCT NNC CCB NNP CCA PRI CCT DTCP JJCS_JJD RBW CCT NNP_PMC
VB.* DT.* NN.* NN.*_PM.*,VBTS DTP NNP NNP_PMC
DT.* NN.* CC.* CC.* NN.* CC.* NN.*_PM.*,DTC NNC CCT CCT NNC CCB NNP_PMP
VB.* PR.* PR.* CC.* NN.* RB.* CD.* CC.* NN.* NN.* DT.* NN.* NN.* CC.* NN.* RB.* CC.* NN.* NN.* CC.* NN.*_PM.*,VBTS PRS PRO CCT NNC RBW_CCP CDB CCB NNP NNP DTP NNP NNP CCA NNP RBL CCT NNP NNP CCT NNP_PMP
RB.* PR.* NN.*_PM.*,RBW_CCP PRI_CCP NNC_PMC
VB.* CC.* NN.* NN.* CC.* JJ.* NN.* NN.* CC.* DT.* NN.* DT.* VB.* RB.* CC.* NN.* CC.* NN.* JJ.* CC.* NN.*_PM.*,VBTS CCB NNP NNC CCP JJN_CCP NNP NNP CCP DTCP NNC DTC VBTS RBL CCT NNP CCP NNC JJD CCT NNP_PMP
DT.* DT.* NN.* LM RB.* CC.* VB.* CC.* NN.* RB.* NN.* CC.* VB.* CC.* PR.* CC.* VB.* PR.*_PM.*,DTC DTCP NNC LM RBD CCP VBTR CCT NNP RBW_CCP NNP CCP VBAF CCT PRI CCB VBTR PRP_PMP
DT.* DT.* VB.* LM JJ.* CD.* RB.* CC.* JJ.* NN.* CC.* NN.* CC.* NN.* CC.* CC.* NN.* FW CD.* CC.* CD.* CC.* DT.* NN.* RB.* CC.* NN.*_PM.*,DTC DTCP VBTS LM JJD CDB RBR CCT JJD_CCP NNC CCB NNP CCP NNP CCA CCT NNP FW CDB CCA CDB CCP DTCP NNC RBR CCT NNC_PMP
DT.* JJ.* NN.*_PM.*,DTC JJD_CCP NNP_PMC
DT.* VB.* CC.* NN.*_PM.*,DTC VBTR_VBRF CCB NNP_PMC
LM VB.* RB.* CC.* VB.* CC.* DT.* NN.* CC.* JJ.* DT.* NN.*_PM.*,LM VBTS RBI CCT VBOF CCB DTCP NNC CCP JJD DTC NNC_PMP
DT.* JJ.* NN.* CC.* NN.* LM VB.* CC.* JJ.* NN.* CC.* RB.* VB.* DT.* NN.* CC.* JJ.* NN.*_PM.*,DTC JJD_CCP NNC CCB NNP LM VBTS CCT JJD_CCP NNC CCT RBF VBTS DTC NNC CCB JJD_CCP NNC_PMP
DT.* NN.* CC.* NN.* LM VB.* PM.* NN.* CC.* PM.* CD.* NN.* NN.* CC.* CC.* PR.* VB.* CC.* NN.* VB.* CC.* NN.* CC.* NN.*_PM.*,DTC NNP CCB NNP LM VBTS PMS NNC CCB PMS CDB NNC_CCP NNC CCT CCT PRI_CCP VBW CCB NNC_CCP VBTF_VBAF CCT NNC CCB NNC_PMP
DT.* DT.* NN.* RB.* LM VB.* CC.* NN.* CC.* CD.* NN.* CC.* NN.* CC.* NN.* CC.* NN.* NN.*_PM.*,DTC DTCP NNC RBW LM VBTR CCB NNC CCB CDB NNC CCP NNC CCT NNC CCT NNP NNP_PMC
JJ.* CC.* JJ.* NN.*_PM.*,JJD CCT JJD NNP_PMC
CC.* NN.* NN.*_PM.*,CCT NNP NNP_PMP
JJ.* CC.* JJ.* NN.* CC.* NN.* LM VB.* RB.* VB.*_PM.*,JJN CCP JJD_CCP NNC CCB NNC LM VBTS RBW VBTS_PMC
CC.* DT.* RB.* VB.* CC.* PR.* NN.* CC.* NN.*_PM.*,CCB DTC RBF VBTF CCT PRI_CCP NNC CCP NNC_PMP
JJ.* CC.* CD.* PR.* NN.* DT.* VB.* RB.* JJ.* DT.* DT.* NN.* CC.* NN.* VB.* CC.* CD.* NN.* CC.* VB.* CC.* VB.*_PM.*,JJCC CCP CDB PRS NNC DTC VBTR RBW JJD DTC DTCP NNC CCT NNC VBW CCB CDB NNC CCP VBW CCB VBW_PMP
PR.* NN.* CC.* NN.* DT.* VB.* CC.* DT.* VB.* CC.* DT.* NN.* RB.* CC.* NN.* NN.*_PM.*,PRQ_CCP NNC CCA NNC DTC VBTS CCT DTCP VBTS CCP DTCP NNC RBL CCT NNP NNP_PMC
CC.* NN.* VB.* VB.* RB.* PR.* NN.*_PM.*,CCT NNC_CCP VBTR_CCP VBAF RBW PRQ_CCP NNC_PMP
DT.* DT.* NN.* CC.* NN.* NN.* NN.* NN.* NN.* FW NN.* DT.* NN.* NN.* NN.* NN.* NN.* LM VB.* CC.* RB.* VB.* RB.* DT.* DT.* NN.*_PM.*,DTC DTCP NNC CCB NNP NNP NNP NNP NNP FW NNP DTC NNP NNP NNPA NNPA NNPA LM VBTS CCP RBM VBW RBW DTC DTCP NNC_PMP
DT.* PR.* NN.* CC.* NN.*_PM.*,DTC PRI_CCP NNC CCB NNPA_PMC
CC.* DT.* NN.* NN.*_PM.*,CCP DTP NNP NNP_PMC
LM VB.* CC.* NN.* NN.* CC.* FW PM.* NN.* PR.* DT.* NN.* CC.* NN.* CC.* NN.* LM VB.* CC.* RB.* VB.* DT.* DT.* NN.* CC.* PR.* RB.*_PM.*,LM VBTS CCT NNPA NNP CCP FW PMS NNC_CCP PRSP_CCP DTCP NNC CCA NNC CCT NNC LM VBAF CCT RBF VBW DTC DTCP NNC CCT PRI_CCP RBW_PMP
PM.*_ DT.* NN.* LM VB.* CC.* PR.* CC.* VB.* CC.* PR.* DT.* NN.* JJ.*_PM.*,PMS_ DTC NNC LM VBAF CCT PRI CCA VBTS CCB PRQ_CCP DTCP NNC JJD_PMC
CC.* JJ.* NN.* RB.* VB.*_PM.*_PM.*,CCT JJD_CCP NNC RBW VBTF_PMC_PMS
VB.* PR.* CC.* JJ.* NN.* CC.* NN.*_PM.*,VBTS PRS CCT JJD_CCP NNC CCB NNP_PMP
PM.*_ CC.* NN.* PR.* DT.* NN.* LM VB.* RB.* DT.* NN.* PR.* NN.* RB.* NN.* CC.* VB.* CC.* DT.* NN.* CC.* VB.* PR.* RB.* PR.* VB.* NN.* CC.* NN.*_PM.*_PM.*,PMS_ CCT NNC PRS DTC NNC LM VBTF RBW DTC NNC PRL NNPA RBW NNPA CCA VBTF CCB DTCP NNC CCB VBOF PRP RBW PRP VBAF NNC CCT NNC_PMP_PMS
DT.* JJ.* NN.* CC.* NN.* CC.* NN.* CC.* CC.* NN.* DT.* JJ.* FW FW FW CC.* CC.* RB.* JJ.* DT.* PR.* NN.* CC.* JJ.* NN.* CC.* PR.* VB.*_PM.*,DTC JJN_CCP NNC CCT NNP CCB NNP CCT CCT NNP DTC JJD_CCP FW FW FW CCR CCT RBF JJD DTC PRSP_CCP NNC CCA JJD_CCP NNC CCP PRSP_CCP VBTR_PMP
JJ.* CC.* NN.* CC.* FW CC.* VB.* CC.* NN.* FW NN.* NN.* FW NN.* NN.* NN.* NN.* NN.*_PM.*,JJD CCT NNC CCT FW CCP VBOF CCB NNP FW NNP NNP FW NNP NNP NNP NNP NNP_PMC
RB.* NN.*_PM.*,RBW_CCP NNP_PMC
NN.* CD.*_PM.*,NNP CDB_PMC
VB.* DT.* NN.* NN.* NN.* CC.* NN.* FW NN.* CC.* DT.* NN.* NN.* CC.* NN.*_PM.*,VBTS DTC NNP NNP NNP CCA NNP FW NNP CCP DTP NNP NNP CCT NNPA_PMP
PM.*_ CD.* PM.* NN.* CC.* NN.* NN.* CC.* VB.* DT.* NN.* NN.*_PM.*,PMS_ CDB PMS NNC CCB NNP NNP CCP VBTS DTC NNC_CCP NNC_PMC
RB.* RB.* JJ.* CC.* RB.* VB.* CC.* JJ.* VB.* CC.* JJ.* NN.* CC.* NN.* CC.* CC.* NN.*_PM.*_PM.*,RBF RBF JJD CCA RBF VBTR CCT JJD_CCP VBTR CCA JJD_CCP NNC CCB NNP CCT CCT NNP_PMC_PMS
VB.* CC.* NN.* NN.* NN.* CC.* JJ.* CC.* NN.* VB.* CC.*,VBTR CCB NNP NNP NNP CCT JJD CCP NNC_CCP VBTS CCT
PM.*_ RB.* PR.* CC.* PR.* CC.* DT.* NN.* CC.* PR.* NN.* DT.* VB.* VB.* VB.* DT.* NN.* CC.* NN.*_PM.*_PM.*,PMS_ RBD_CCP PRS CCP PRI CCT DTCP NNC CCT PRSP_CCP NNC DTC VBW VBW VBAF DTC NNP CCT NNPA_PMC_PMS
VB.* DT.* NN.* NN.* CC.* NN.* CC.* NN.*_PM.*,VBTS DTP NNP NNP CCP NNP CCB NNP_PMC
PM.*_ CC.* DT.* NN.* CC.* NN.* CC.* NN.* LM RB.* VB.*_PM.*_PM.*,PMS_ CCT DTC NNC CCB NNP CCA NNP LM RBF VBTS_PMP_PMS
PM.*_ PR.* CC.* NN.* LM JJ.* VB.* NN.* CC.* RB.* PR.* NN.* PM.* VB.* CC.* NN.*_PM.*_PM.*,PMS_ PRI CCB NNC LM JJCS VBN_CCP NNC CCP RBF PRP NNC PMS VBS CCT NNC_PMP_PMS
NN.* NN.* NN.* NN.* NN.* FW NN.* NN.* NN.* NN.* NN.*_PM.*,NNP NNP NNP NNP NNP FW NNP NNP NNPA NNP NNPA_PMC
DT.* PR.* NN.* JJ.* CC.* VB.* CC.* VB.* CC.* DT.* DT.* NN.* RB.* NN.* CC.* DT.* NN.* CC.* NN.* NN.*_PM.*,DTC PRI_CCP NNC_CCP JJD CCP VBTS CCT VBAF CCB DTCP DTCP NNC RBI_CCP NNC CCP DTCP NNC CCT NNC_CCP NNC_PMC
LM VB.* RB.* CC.* JJ.* NN.* JJ.* CC.* NN.* CC.* NN.* RB.* DT.* NN.* PM.* FW NN.*_PM.*,LM VBTS RBR CCT JJD_CCP NNC_CCP JJD CCB NNC CCP NNC RBW DTP NNP PMS FW NNP_PMC
DT.* NN.* CC.* NN.* CC.* NN.*_PM.*,DTC NNP CCB NNP CCB NNP_PMC
LM VB.* CC.* NN.* CC.* PR.* CC.* JJ.* PM.* CD.* CC.* NN.* CC.* CD.* NN.* NN.* NN.* NN.* RB.* NN.* CD.* NN.*_PM.*,LM VBAF CCT NNC CCP PRO CCT JJN PMS CDB CCP NNC CCB CDB NNP NNP NNP NNPA RBW_CCP NNP CDB NNPA_PMP
PM.*_ DT.* DT.* NN.* NN.* CC.* NN.* LM RB.* JJ.* CC.* NN.*_PM.*,PMS_ DTC DTCP NNC_CCP NNC CCB NNP LM RBF JJD CCT NNP_PMQ
DT.* DT.* NN.* JJ.* NN.* LM VB.* NN.* RB.* CC.* NN.* CC.* NN.* CC.* NN.*_PM.*_PM.*,DTC DTCP NNC_CCP JJD NNC LM VBN_CCP NNC RBR CCT NNC CCA NNC CCB NNC_PMS_PMS
JJ.* CC.* VB.* DT.* NN.* PM.* NN.* NN.*_PM.*,JJD CCP VBTS DTP NNP PMS NNCA NNP_PMC
DT.* NN.* CC.* NN.* CC.* NN.* CC.* NN.*_PM.*,DTC NNC CCB NNPA CCT NNC CCB NNC_PMP
DT.* VB.* CC.* NN.* CC.* FW CC.* NN.* LM RB.* CC.* JJ.* JJ.* JJ.* JJ.* NN.* CC.* CC.* PM.* NN.* CC.* DT.* NN.* CC.* FW_PM.*,DTC VBW CCT NNC CCB FW CCP NNC LM RBD CCP JJCC JJD JJC JJD_CCP NNC CCT CCR PMS NNC CCB DTCP NNC CCT FW_PMC
RB.* CC.* NN.* NN.* NN.*_PM.*,RBR CCT NNP NNP NNP_PMP
CC.* NN.*_PM.*,CCT NNC_PMC
JJ.* CC.* VB.* CC.* NN.* DT.* NN.* CC.* DT.* VB.* CC.* VB.* DT.* NN.* CC.* DT.* NN.* NN.* CC.* CC.* NN.* JJ.* CC.* JJ.*_PM.*,JJD CCP VBTS CCB NNPA DTC NNC CCA DTCP VBTS CCP VBOF DTC NNC CCB DTCP NNC_CCP NNC CCT CCT NNC_CCP JJD CCA JJD_PMP
CC.* NN.* CC.* NN.*_PM.*,CCT NNC CCB NNC_PMC
RB.* RB.* DT.* NN.* JJ.*_PM.*,RBF RBI DTC NNC_CCP JJD_PMC
CC.* CC.* DT.* DT.* NN.* CC.* NN.* LM RB.* VB.* PM.* RB.* CC.* NN.* CC.* NN.*_PM.*,CCA CCP DTC DTCP NNC CCT NNC LM RBF VBAF PMS RBR CCT NNC CCB NNP_PMP
CC.*_PM.*,CCB_PMC
DT.* JJ.* NN.* JJ.* CC.* NN.* NN.* LM VB.* CC.* NN.* CC.* CC.* PR.* CC.* NN.* CC.* VB.* JJ.* NN.* CC.* VB.* CC.* JJ.* CD.* NN.* CC.* NN.*_PM.*,DTC JJD_CCP NNC_CCP JJD CCB NNP NNP LM VBTR CCB NNC CCT CCT PRI CCB NNC CCP VBH JJD_CCP NNC CCP VBTR CCB JJD CDB NNC CCP NNC_PMP
RB.* CC.* NN.* NN.* NN.* DT.* NN.* CC.* DT.* NN.* VB.* JJ.* NN.* LM VB.* DT.* RB.* JJ.* NN.* DT.* NN.* CC.* NN.* JJ.* CC.* NN.* RB.* CD.* PM.* CC.* NN.* NN.* CC.* NN.* NN.*_PM.*,RBR CCT NNP NNP NNP DTC NNC CCB DTCP NNC_CCP VBH JJD_CCP NNC LM VBTS DTC RBN JJN_CCP NNC DTC NNC CCB NNC_CCP JJD CCB NNPA RBW CDB PMS CCT NNP NNC CCB NNP NNP_PMP
VB.* CC.* NN.* NN.* NN.* CC.* DT.* NN.* NN.*_PM.*,VBOF CCB NNP NNP NNP CCP DTC NNP NNP_PMC
CC.* CC.* CC.* NN.* PM.* NN.* NN.* RB.* CC.* PR.* NN.*_PM.*,CCT CCT CCT NNC PMS NNC_CCP NNC RBL CCT PRI_CCP NNC_PMC
LM RB.* RB.* VB.* DT.* NN.* CC.* NN.* CC.* DT.* NN.* RB.* JJ.* CC.* DT.* CD.* PM.* CC.* NN.* CC.* NN.* CC.* NN.* NN.* LM RB.* CC.* PR.* DT.* NN.* CC.* RB.* PM.* JJ.* NN.*_PM.*,LM RBF RBI VBTR_VBAF DTC NNC CCB NNC CCB DTCP NNC RBW JJD CCA DTC CDB PMS CCB NNC CCB NNC CCB NNP NNP LM RBL CCT PRI_CCP DTCP NNC CCA RBF PMS JJD_CCP NNC_PMP
RB.* RB.* CD.* DT.* NN.* LM VB.* CC.* PM.* CD.* NN.* NN.* CC.* DT.* NN.* CC.* NN.* CC.* VB.* CC.* NN.* LM JJ.* JJ.* CC.* NN.*_PM.*,RBW RBW_CCP CDB DTC NNC LM VBTS CCB PMS CDB NNC_CCP NNC CCT DTC NNC CCB NNC CCB VBTR CCP NNC LM JJD JJCS_JJD CCT NNC_PMC
JJ.* JJ.* CC.* NN.* CC.* JJ.* JJ.* CC.* NN.*_PM.*,JJCC JJD CCT NNP CCT JJCC JJD CCT NNP_PMP
VB.* RB.* CC.* NN.* CC.* VB.* CC.* NN.* NN.* CC.* DT.* CD.* CC.* CD.* CC.* NN.* NN.* NN.* LM VB.* CC.* NN.*_PM.*,VBTS RBI CCB NNC CCP VBTR CCB NNP NNP CCP DTC CDB CCT CDB CCP NNP NNP_CCP NNC LM VBTR CCT NNC_PMC
CC.* VB.* CC.* CD.* CC.*,CCP VBTR CCT CDB CCT
CD.* CC.* NN.* NN.* CC.* DT.* NN.* CC.* NN.* CC.* NN.* NN.* LM CD.* CC.* NN.* RB.* RB.* DT.* NN.* CC.* NN.* CC.* NN.* LM VB.* CC.* CD.* CC.* NN.*_PM.*,CDB CCT NNP NNP CCA DTC NNC CCB NNC CCT NNP NNP LM CDB CCP NNC RBI RBW DTC NNC CCB NNC CCT NNP LM VBTR_VBAF CCT CDB CCP NNC_PMP
DT.* NN.* CC.* NN.* NN.* LM VB.* CC.* PR.* NN.* CC.* VB.* DT.* DT.* NN.* CC.* NN.* CC.* CC.* DT.* NN.* CC.* DT.* NN.* CC.* DT.* JJ.* NN.* CC.* CC.* JJ.* JJ.* NN.* CC.* NN.* CC.* NN.* CC.* NN.* CC.* NN.* CC.* NN.*_PM.*,DTC NNC CCB NNP NNP LM VBTS CCB PRSP_CCP NNC CCB VBOF DTC DTCP NNC CCB NNC CCT CCT DTCP NNC CCA DTCP NNC CCB DTC JJD_CCP NNC CCT CCT JJCC JJD_CCP NNC CCB NNC CCB NNC CCT NNP CCB NNP CCA NNP_PMC
CC.* VB.* CC.* NN.* RB.* NN.* CD.* CC.* CD.*_PM.*,CCP VBTS CCT NNP RBW_CCP NNP CDB CCA CDB_PMP
PM.*_ DT.* NN.* CC.* NN.* NN.* LM VB.* CC.* NN.* DT.* PR.* NN.* VB.* PM.* RB.* DT.* NN.* CC.* VB.*_PM.*,PMS_ DTC NNC CCB NNP NNP LM VBTS CCB NNC DTC PRSP_CCP NNC_CCP VBOF PMS RBW DTC NNC CCB VBTR_VBAF_PMC
DT.* NN.* CC.* NN.* CC.* PR.* DT.* NN.* LM VB.* CC.* VB.*_PM.*_PM.*,DTC NNC CCB NNPA CCA PRI_CCP DTCP NNC LM VBTS CCP VBTF_PMC_PMS
VB.* DT.* NN.* NN.*_PM.*,VBTS DTP NNP NNP_PMC
NN.* CC.* NN.* CC.* NN.* CC.* NN.* CC.* NN.* NN.* NN.*_PM.*,NNC CCT NNC CCA NNC CCP NNC CCB NNP NNP NNP_PMP
PM.*_ DT.* JJ.* RB.* LM DT.* NN.* NN.* LM RB.* CC.* VB.* CC.* VB.* NN.* CC.* JJ.* NN.* CC.* VB.* PR.* NN.*_PM.*_PM.*,PMS_ DTC JJCS_JJD RBW LM DTC NNP NNP LM RBT CCP VBTR_VBAF CCB VBTR_CCP NNC CCA JJD_CCP NNC CCT VBW PRO_CCP NNC_PMP_PMS
PM.*_ NN.* CC.* CC.* DT.* DT.* NN.* LM VB.* CC.* JJ.* CC.* NN.*_PM.*_PM.*,PMS_ NNP CCP CCP DTC DTCP NNC LM VBTR CCB JJD CCP NNC_PMP_PMS
PM.*_ RB.* RB.*_PM.*,PMS_ RBK RBF_PMC
DT.* NN.* CC.* PR.* VB.* VB.* VB.* LM RB.* RB.* CC.* VB.* RB.* RB.* VB.* NN.* PM.* NN.*_PM.*_PM.*,DTC NNC CCP PRS_CCP VBS VBS_CCP VBW LM RBM RBD CCP VBW RBD RBF VBS NNC PMS NNC_PMP_PMS
DT.* NN.* LM VB.* PM.* NN.* CC.* DT.* NN.* NN.* NN.* LM VB.* RB.* CC.* VB.* DT.* PR.* JJ.* NN.* CC.* NN.* JJ.* CC.* PR.* JJ.* NN.* JJ.*_PM.*,DTC NNP LM VBTS PMS NNC CCP DTP NNC_CCP NNP NNP LM VBTR_VBAF RBI CCP VBOF DTC PRI_CCP JJD_CCP NNC CCT NNC JJD CCT PRSP_CCP JJD_CCP NNC_CCP JJD_PMP
RB.* VB.* CC.* NN.* CC.* VB.* DT.*_PM.* NN.* FW NN.*_PM.* DT.* NN.* NN.* NN.* CC.* VB.* CC.* JJ.* VB.* CC.* NN.* PM.* NN.* CC.* NN.* CC.* DT.* NN.* DT.* NN.* LM VB.* CC.* NN.* RB.* CC.* NN.* NN.*_PM.*,RBW VBOF CCB NNP CCP VBOF DTC_PMS NNP FW NNP_PMS DTP NNC_CCP NNP NNP CCA VBTS CCP JJCC VBAF CCB NNC PMS NNC CCT NNC CCB DTCP NNC DTC NNC LM VBTS CCB NNC RBL CCT NNP NNP_PMC
NN.*_PM.*,NNPA_PMC
NN.*_PM.*,NNPA_PMC
NN.* NN.*_PM.*,NNP NNP_PMC
NN.* CC.* NN.* NN.* NN.*_PM.*,NNPA CCA NNP NNP NNP_PMP
RB.* CC.* NN.* CC.* PM.* CD.* NN.* DT.* NN.* CC.* NN.* NN.* LM VB.* RB.* CC.* JJ.* PM.* CD.* NN.* LM RB.* VB.*_PM.*,RBW CCT NNC CCP PMS CDB NNC DTC NNC CCB NNP NNP LM VBTR_VBAF RBI CCT JJD PMS CDB NNC LM RBM VBOF_PMC
CC.* VB.* JJ.* CC.* DT.* NN.* NN.* CC.* NN.* CC.* NN.*_PM.*,CCP VBH JJD CCB DTCP NNC NNC CCT NNC CCB NNC_PMP
CC.* VB.* CC.* NN.* CC.* NN.* CC.* NN.* NN.* CC.* NN.* DT.* VB.* CC.* NN.* CC.* CC.* NN.* NN.*_PM.*,CCT VBW CCT NNP CCB NNP CCA NNP NNP CCT NNP DTC VBAF CCB NNP CCT CCT NNP NNP_PMC
CC.* DT.* NN.* NN.* NN.*_PM.*,CCP DTP NNP NNP NNP_PMC
LM VB.* CC.* RB.* NN.* CC.* NN.* CC.* DT.*,LM VBTS CCP RBS NNC CCT NNC CCB DTCP
CD.* NN.* VB.* CC.* NN.* CC.* NN.* NN.* CC.* NN.* NN.*_PM.*,CDB NNC_CCP VBTS CCB NNP CCB NNC_CCP NNP CCT NNP NNP_PMC
CC.* DT.* NN.* NN.* NN.* NN.*_PM.*,CCP DTP NNP NNP NNP NNP_PMC
CC.* RB.* CC.* VB.* DT.* NN.* CC.* NN.* PM.* NN.* NN.* RB.* JJ.* DT.* NN.*_PM.*,CCA RBR CCT VBTS_CCP DTCP NNC CCT NNPA PMS NNP NNP RBW_CCP JJD_CCP DTCP NNC_PMC
CC.* VB.* CC.* JJ.* CC.* PM.* CD.* NN.*_PM.*,CCP VBTR CCB JJCC CCP PMS CDB NNC_PMP
DT.* VB.* NN.* CC.* NN.* LM DT.* NN.* CC.* VB.* RB.* JJ.* DT.* NN.* CC.* NN.* CC.* CC.* NN.* CC.* VB.* CC.* CD.*_PM.*,DTC VBTR_CCP NNC CCB NNC LM DTC NNC CCP VBOF RBW JJD DTC NNC CCB NNC CCA CCB NNC CCP VBTR CCT CDB_PMC
CC.* VB.* DT.* PR.* JJ.* NN.* NN.*_PM.*,CCT VBOF DTC PRI_CCP JJD_CCP NNC_CCP NNC_PMC
CC.* VB.* DT.* NN.* CC.* CC.* VB.* DT.* DT.* NN.* CC.* NN.*_PM.*,CCT VBW DTC NNC CCA CCT VBOF DTC DTCP NNC CCT NNC_PMP
DT.* JJ.* CD.* CC.* NN.*_PM.*,DTC JJD CDB CCP NNC_PMC
CC.* DT.* NN.* NN.* NN.*_PM.*,CCT DTC NNP NNP NNP_PMC
LM VB.* CC.* PR.* JJ.* VB.* CC.* NN.* CC.* CC.* NN.* CC.* NN.* NN.*_PM.*,LM VBTR CCB PRI_CCP JJD_CCP VBW CCA NNC CCT CCT NNP CCT NNP NNP_PMP
DT.* NN.* CC.* VB.* LM VB.* CC.* VB.* CC.* PR.* NN.* NN.* CC.* DT.* NN.* CC.* VB.* DT.* NN.*_PM.* NN.* NN.* FW NN.* CC.*_PM.* FW FW_PM.* CC.* NN.* CC.* VB.* VB.* DT.* NN.* CC.* NN.*_PM.*,DTC NNC CCB VBW LM VBTR_VBAF CCP VBTF CCB PRI_CCP NNC_CCP NNC CCT DTCP NNC CCT VBOF DTC NNP_PMS NNCA NNP FW NNP CCT_PMS FW FW_PMS CCP NNC CCP VBTR_CCP VBOF DTC NNC CCB NNP_PMP
DT.* NN.*_PM.*,DTC NNC_PMC
CC.* VB.*_PM.* CD.* NN.* FW NN.* FW NN.*_PM.*_PM.*,CCP VBTS_CCP_PMS CDB NNP FW NNP FW NNP_PMS_PMC
LM VB.* CC.* JJ.* PR.*_PM.* NN.* PR.* DT.* NN.*_PM.*,LM VBTF CCT JJN_CCP PRI_PMS NNCA PRI_CCP DTCP NNC_PMC
CC.* VB.* CC.* JJ.* JJ.* CC.* NN.* CC.* NN.* CC.* NN.* CC.* NN.* NN.*_PM.*,CCP VBTR CCT JJD JJD CCT NNP CCB NNP CCT NNC CCB NNP NNP_PMP
PM.*_ NN.* CC.* NN.* DT.* RB.* NN.* CC.* NN.*_PM.*_PM.*,PMS_ NNP CCA NNC DTC RBT_CCP NNC CCB NNC_PMC_PMS
VB.* DT.* NN.* NN.*_PM.*,VBTS DTP NNP NNP_PMC
DT.* NN.* CC.* NN.* NN.* NN.*_PM.*,DTC NNC CCB NNP NNP NNP_PMP
VB.* DT.* NN.* RB.* NN.* CC.* PR.* LM VB.* CC.* NN.* PM.* NN.*_PM.*,VBTS DTP NNP RBW_CCP NNP CCP PRS LM VBTF CCT NNC PMS NNC_PMC
CC.* RB.* PR.* VB.* RB.* RB.* NN.* CC.* NN.* PR.* VB.*_PM.*,CCT RBF PRS VBOF RBK RBQ NNC CCB NNC PRS VBTF_PMP
DT.* NN.* CC.* NN.* CC.* DT.* NN.* NN.* PM.* NN.* LM VB.* RB.* NN.* CC.* PR.* LM VB.* RB.* CC.* NN.* CC.* DT.* PR.* NN.*_PM.*,DTC NNP CCB NNP CCP DTP NNP NNP PMS NNP LM VBTS RBW_CCP NNP CCP PRS LM VBTF RBI CCT NNC CCB DTC PRSP_CCP NNC_PMP
PM.*_ RB.* RB.* PR.* VB.* CC.* RB.* VB.* CC.* JJ.* CC.* NN.*_PM.*,PMS_ RBF RBT PRS_CCP VBW CCA RBF VBTF CCT JJN CCB NNP_PMP
VB.* PR.* DT.* PR.* PR.* NN.* CC.* VB.* PR.* CC.* NN.* PM.* NN.* CC.* NN.* CC.* NN.* CC.* VB.* CC.* VB.* CC.* CC.* DT.* NN.* CC.* NN.*_PM.*_PM.*,VBTF PRS DTC PRSP_CCP PRI_CCP NNC CCT VBAF PRL CCT NNC_CCP PMS NNC CCP NNC CCT NNC CCT VBW CCA VBAF_CCP CCB CCB DTCP NNC CCB NNP_PMC_PMS
VB.* DT.* NN.*_PM.*,VBTS DTP NNP_PMP
VB.* RB.* DT.* NN.* CC.*_PM.* VB.* PR.* DT.* JJ.* CC.* JJ.* CC.* DT.* NN.* CC.* NN.*_PM.*_PM.*,VBTS RBI DTP NNP CCP_PMS VBTS PRS DTC JJD CCA JJD CCB DTCP NNC CCB NNP_PMP_PMS
DT.* PR.* NN.* CC.* NN.* LM VB.* CC.* DT.* NN.* LM RB.* VB.*_PM.* VB.* RB.*_PM.* CC.* NN.* JJ.* RB.* NN.*_PM.*,DTC PRI_CCP NNP CCP NNC LM VBTR CCP DTC NNC LM RBM VBW_PMS VBOF RBI_PMS CCB NNC_CCP JJD RBW_CCP NNP_PMP
PM.*_ DT.* DT.* NN.* CC.* NN.* LM VB.* VB.* DT.* NN.* CC.* NN.* CC.* VB.* DT.* PR.* NN.*_PM.*_PM.*,PMS_ DTC DTCP NNC CCB NNC LM VBTS VBOF DTC NNC CCB NNC CCB VBOF DTC PRSP_CCP NNC_PMP_PMS
PM.*_ DT.* DT.* NN.* CC.* PR.* LM VB.* CC.* NN.*_PM.*_PM.*,PMS_ DTC DTCP NNC CCP PRO LM VBTS CCT NNC_PMC_PMS
VB.* DT.* NN.* NN.*_PM.*,VBTS DTP NNP NNP_PMC
DT.* NN.* CC.* NN.*_PM.* NN.* NN.* FW NN.*_PM.*,DTC NNC CCT NNP_PMS NNCA NNP FW NNP_PMP
VB.* PR.* CC.* DT.* NN.* CC.* NN.* LM_PM.* RB.* VB.* CC.* PR.*_PM.* DT.* NN.* CC.* NN.* PM.* NN.*_PM.*,VBTS PRS CCP DTC NNC CCB NNC LM_PMS RBD_CCP VBW CCT PRI_PMS DTC NNC CCP NNC PMS NNC_PMP
DT.* NN.* NN.* NN.* NN.* CC.* NN.* LM VB.* CC.* CD.* CC.* NN.* CC.* VB.* DT.* NN.* CC.* NN.* PM.* NN.* RB.* DT.* DT.* NN.* PR.* RB.* CC.* VB.* CC.* NN.*_PM.*,DTC NNC NNP NNP NNP CCT NNPA LM VBTR CCB CDB CCP NNC CCB VBOF DTC NNC CCA NNC PMS NNC RBW DTC DTCP NNC PRL RBR CCT VBTR CCP NNC_PMC
CC.* RB.* RB.* JJ.* NN.* CC.* VB.* NN.* CC.* VB.* CC.* NN.* CC.* JJ.* PM.* JJ.* NN.* CC.* NN.*_PM.*,CCA RBW RBI_CCP JJD_CCP NNC CCP VBH NNC CCP VBTR CCB NNC CCT JJD_CCP PMS JJD_CCP NNC CCB NNC_PMP
VB.* DT.* NN.* DT.* NN.* PM.* PR.* CC.* DT.* NN.*_PM.*,VBTS DTP NNP DTC NNC PMS PRI CCB DTCP NNC_PMC
CC.* DT.* NN.* CC.* NN.* CC.* NN.* CC.* VB.* NN.* DT.* PR.* NN.* CC.* NN.* NN.* CC.* CC.* RB.* RB.* VB.* PR.* PR.* CC.* JJ.* NN.*_PM.*,CCT DTC NNC CCT NNC CCB NNC CCP VBH NNC DTC PRI_CCP NNC CCB NNP NNP CCR CCT RBK RBQ_CCP VBTR PRS PRL CCT JJD_CCP NNC_PMP
VB.* RB.* PR.* RB.* CC.* NN.* CC.* VB.* JJ.* CC.* DT.* NN.*_PM.*,VBTS RBI PRS RBR CCT NNC CCB VBTR JJD CCB DTCP NNP_PMC
RB.* RB.* VB.* DT.* DT.* NN.* RB.* RB.* PR.* LM VB.* RB.* CD.* RB.* CC.* RB.* CD.* NN.* NN.*_PM.*,RBK RBQ VBTS DTC DTCP NNC RBW RBW_CCP PRS LM VBTS RBW_CCP CDB RBW CCT RBW_CCP CDB NNP NNP_PMP
VB.* DT.* NN.* RB.* RB.* DT.* NN.* LM VB.* RB.* CC.* PR.* JJ.* NN.* CC.* NN.*_PM.*,VBTS DTP NNP RBK RBQ DTC NNC LM VBTS RBW CCT PRSP_CCP JJN_CCP NNC CCT NNC_PMC
CC.* DT.* NN.* CC.* NN.* CC.* NN.* CC.* NN.* NN.* CC.* RB.*_PM.*,CCA DTCP NNC CCT NNP CCT NNC CCB NNP NNP CCT RBW_PMP
RB.* NN.* DT.* NN.* LM VB.* CC.* NN.* NN.* NN.* FW NN.* CC.* PR.* NN.* CC.* NN.*_PM.*,RBW_CCP NNC DTP NNP LM VBTS CCT NNP NNP NNP FW NNP CCT PRI_CCP NNC CCT NNP_PMP
CC.* JJ.* NN.* RB.* CD.* NN.* NN.*_PM.*,CCT JJD_CCP NNC RBW_CCP CDB NNP NNP_PMC
CC.* PR.* LM VB.* RB.*_PM.*,CCR PRS LM VBTF RBW_PMC
VB.* PR.* LM VB.* CC.* JJ.* CC.* NN.*_PM.*,VBS_CCP PRS LM VBTF CCT JJD CCP NNP_PMP
PR.* LM RB.* VB.* CC.* CC.* NN.* NN.* NN.* FW NN.* NN.*_PM.*,PRS LM RBW_CCP VBTR CCT CCT NNP NNP NNP FW NNP NNP_PMC
VB.* CC.* VB.* CC.* DT.* NN.* CC.* VB.* DT.* NN.* CC.* DT.* NN.*_PM.*,VBTR_VBAF CCT VBW CCB DTCP NNC CCP VBOF DTC NNC CCT DTCP NNC_PMP
CC.* JJ.* CC.*,CCT JJD CCB
CD.* NN.* NN.* CC.* NN.* NN.* CC.*,CDB NNPA NNC CCB NNC NNPA CCA
CD.* CC.* NN.* NN.* NN.* CC.* NN.* NN.* LM RB.* CC.* DT.* NN.* CC.* NN.*_PM.*,CDB CCP NNC NNPA NNC CCB NNC NNPA LM RBD CCT DTCP NNC CCT NNP_PMC
NN.* RB.*_PM.*,NNP RBW_PMC
VB.* DT.* NN.* NN.* CC.* NN.* CC.* CC.* PM.* NN.* CC.* DT.* NN.* CC.* NN.*_PM.*,VBTR DTC NNC_CCP NNC CCB NNC CCT CCR PMS NNC CCT DTCP NNC CCB NNP_PMP
RB.* JJ.* PM.* CD.* CC.* RB.* NN.* NN.* CD.* NN.* NN.* DT.* DT.* NN.*_PM.*,RBW JJN PMS CDB CCB RBW NNPA NNPA CDB NNPA NNPA DTC DTCP NNC_PMC
FW CC.* DT.* JJ.* NN.* LM VB.* CC.* PR.* NN.* CC.* NN.*_PM.*,FW CCA DTCP JJD_CCP NNC LM VBTS CCT PRI_CCP NNC CCB NNP_PMC
JJ.* CC.* JJ.* NN.* CC.* NN.*_PM.*,JJD CCB JJD_CCP NNC CCB NNC_PMC
CC.* JJ.* NN.* CC.* VB.* CC.* NN.* CC.* DT.* NN.*_PM.*,CCT JJCS_JJD_CCP NNC CCP VBTS CCB NNC CCT DTCP NNC_PMP
VB.* PR.* DT.* NN.* CC.* NN.* CC.* NN.* CC.* NN.*_PM.*,VBOF PRP DTC NNC CCB NNP CCA NNC CCB NNC_PMP
RB.* JJ.* PM.* CD.* RB.* JJ.* PM.* CD.* CC.* RB.*_PM.*,RBW JJN PMS CDB RBW JJN PMS CDB CCB RBW_PMC
RB.* VB.* CC.* CD.* NN.* RB.* DT.* VB.* DT.* NN.* NN.*_PM.*,RBF VBTF CCT CDB NNC RBI DTC VBTS DTC NNP NNP_PMC
DT.* JJ.* NN.* CC.* NN.* CC.* NN.*_PM.*,DTC JJCS_JJD_CCP NNC CCT NNC CCB NNC_PMC
CC.* VB.* CC.* PR.* CC.* NN.* CC.* DT.* JJ.* NN.* CC.* NN.* CC.* NN.*_PM.*,CCP VBTS CCT PRI CCT NNC CCB DTCP JJD_CCP NNC CCA NNC CCT NNC_PMP
DT.* PR.* CC.* NN.* LM VB.* VB.* CC.* VB.* CC.* NN.* CC.* PR.* NN.* CC.* VB.* DT.* NN.* CC.* NN.* CC.* NN.*_PM.*,DTC PRI CCB NNC LM VBTS VBW CCP VBOF CCB NNC CCB PRQ_CCP NNC CCP VBTF DTC NNC CCT NNC CCB NNC_PMP
DT.* DT.* NN.* CC.* DT.* VB.* PM.* NN.* RB.* CC.* PR.* CC.* DT.* NN.* CC.* NN.* LM VB.* CC.* CC.* NN.* PM.* JJ.* NN.* CC.* NN.*_PM.*,DTC DTCP NNC CCB DTCP VBW PMS NNC RBL CCT PRI CCB DTCP NNC CCB NNP LM VBTS CCT CCT NNC PMS JJD_CCP NNC CCT NNP_PMP
CC.* NN.*_PM.*,CCT NNP_PMC
DT.* NN.* CC.* NN.* CC.* NN.* LM RB.* CC.* VB.* CC.* PR.* NN.* CC.* RB.* VB.* CC.* PR.* CC.* RB.* VB.* CC.* VB.* PM.* FW CC.* VB.* CC.* NN.* CC.* CD.* PM.* PR.* NN.*_PM.*,DTC NNC CCB NNC CCB NNP LM RBD CCP VBAF CCB PRI_CCP NNC CCP RBM VBOF CCB PRI CCB RBF VBTS CCP VBW PMS FW CCP VBAF CCB NNC CCP CDB PMS PRI NNC_PMSC
DT.* DT.* VB.* CC.* DT.* VB.* PM.* FW LM RB.* VB.* CC.* RB.*,DTC DTCP VBTS CCP DTCP VBW PMS FW LM RBM VBOF CCB RBW
CD.* PM.*_PM.*,CDB PMS_PMP
VB.* DT.* DT.* NN.* LM VB.* CC.* PR.* NN.* CC.* NN.* CC.* PR.* NN.* NN.* CC.* DT.* NN.*_PM.*,VBOF DTC DTCP NNP LM VBAF CCT PRI_CCP NNC CCT NNC CCB PRI_CCP NNC_CCP NNC CCB DTC NNP_PMP
VB.* CC.* NN.* NN.* NN.* CC.* DT.* DT.* JJ.* CC.* NN.* LM VB.* DT.* CD.* NN.* NN.* CC.* NN.* CC.* VB.* RB.* CC.* NN.* CC.* NN.*_PM.*,VBTR CCB NNP NNP NNP CCP DTC DTCP JJD CCP NNC LM VBOF DTC CDB NNC_CCP NNC CCT NNC CCP VBTS RBD CCT NNC CCB NNP_PMP
DT.* DT.* NN.* CC.* PR.* NN.* LM VB.* DT.* NN.*_PM.*,DTC DTCP NNC CCT PRI NNC LM VBRF DTC NNC_PMC
VB.* CC.* PR.* DT.* NN.*_PM.*,VBTR CCT PRI DTCP NNC_PMP
CC.* NN.* DT.* NN.* JJ.* NN.* DT.* NN.* NN.* NN.* NN.* NN.* LM VB.* CC.* NN.* CC.* CC.* NN.* CC.* CC.* VB.* DT.* NN.* JJ.*_PM.*,CCT NNP DTC NNC_CCP JJD_CCP NNC DTC NNP NNP NNP NNP NNP LM VBTS CCP NNC CCT CCT NNC CCT CCR VBOF DTC NNC_CCP JJD_PMP
PM.*_ DT.* NN.* CC.* NN.* CC.* NN.* CC.* NN.* LM DT.* NN.* CC.* JJ.* NN.*_PM.*,PMS_ DTC NNC CCB NNC CCT NNC CCT NNP LM DTC NNC CCB JJD_CCP NNC_PMC
NN.* CC.* NN.* CC.* PR.* NN.*_PM.*_PM.*,NNC CCA NNC CCB PRI NNC_PMC_PMS
VB.* DT.* NN.*_PM.*,VBS DTP NNP_PMP
PM.*_ CC.* PR.* LM VB.*_PM.*,PMS_ CCR PRO LM VBTS_PMC
PR.* LM RB.* RB.* RB.* RB.* JJ.* PR.* CC.* DT.* PR.* NN.* LM VB.* CC.* VB.* DT.* PR.* RB.* NN.* RB.*_PM.*,PRO LM RBF RBT RBK RBQ JJD PRS CCT DTC PRSP_CCP NNC LM VBTF CCP VBOF DTC PRI RBI_CCP NNC RBI_PMC
CC.* NN.* PR.*_PM.*,CCT NNC PRS_PMC
LM RB.* VB.* JJ.*_PM.*_PM.*,LM RBF VBTF JJD_PMP_PMS
VB.* CC.* NN.* NN.* NN.* CC.* VB.* CC.*,VBTS CCB NNP NNP NNP CCP VBW CCB
CD.* NN.* CC.* DT.* NN.* LM VB.*_PM.*,CDB NNC CCB DTCP NNC LM VBTS_PMC
CD.* CC.* NN.* DT.* VB.* CC.* CC.* NN.* CC.*,CDB CCP NNC DTC VBAF CCT CCT NNC CCA
CD.* DT.* NN.* PR.*_PM.*,CDB DTC NNC PRL_PMP
PR.* LM JJ.* CC.* CC.* VB.*,PRO LM JJD CCT CCT VBTR_CCP
CD.* CC.* DT.* NN.*_PM.*,CDB CCP DTCP NNC_PMC
VB.* CC.* DT.* DT.* NN.* CC.* VB.* CC.* PR.* NN.*_PM.*,VBTS CCB DTCP DTCP NNP CCP VBTS CCT PRI_CCP NNC_PMC
CC.* VB.* DT.* NN.*_PM.*,CCP VBOF DTC NNC_PMP
DT.* NN.* LM VB.* CC.* NN.* CC.* NN.* CC.* NN.*_PM.*,DTC NNP LM VBTS CCT NNC CCB NNP CCA NNP_PMC
RB.* RB.* DT.* NN.* LM CC.* DT.* NN.* CC.* NN.* CC.* NN.* CC.* NN.* NN.* CC.* DT.* JJ.* CC.* NN.* FW NN.* CC.* NN.* NN.*_PM.*,RBK RBQ DTC NNC LM CCB DTC NNC CCT NNC CCB NNP CCT NNP NNP CCA DTC JJD CCP NNP FW NNP CCT NNP NNP_PMP
DT.* FW CC.* JJ.* NN.* JJ.* LM DT.* VB.* CC.* JJ.* NN.* CC.* DT.* NN.* JJ.* CC.* RB.* VB.* CC.* NN.* CC.* VB.* CC.* PR.* CC.* DT.* NN.* CC.* VB.* PR.* PR.*_PM.*,DTC FW CCB JJN_CCP NNC_CCP JJD LM DTC VBTF CCB JJD_CCP NNC CCA DTCP NNC_CCP JJD CCA RBM VBW CCT NNP CCP VBAF CCB PRQ CCT DTCP NNC CCP VBTR PRP_CCP PRSP_PMP
CC.* RB.*_PM.*,CCT RBW_PMC
