General POS,Detailed POS
VB.* CC.* CC.* PM.* JJ.* RB.* RB.* DT.* RB.* JJ.* NN.* CC.* RB.* RB.* JJ.* DT.* VB.* NN.* CC.* DT.* NN.* JJ.* CC.* VB.* NN.* CC.* JJ.* NN.*_PM.*,VBTS CCB CCR PMS JJD RBK RBQ DTC RBM JJD_CCP NNC CCT RBK RBQ JJCC DTC VBTR NNC CCB DTCP NNC JJC CCT VBTR NNC CCT JJD_CCP NNC_PMP
DT.* NN.* CC.* CC.* PM.* NN.* CC.* DT.* NN.* LM VB.* CC.* DT.* NN.* NN.* CC.* FW CC.* DT.* FW CC.* DT.* NN.* LM CD.* NN.* JJ.* JJ.* CC.* DT.* RB.* NN.* NN.* CC.* DT.* NN.* JJ.* CC.* DT.* RB.* NN.* NN.* CC.* DT.* NN.*_PM.*,DTC NNC CCT CCR PMS NNC CCB DTCP NNC LM VBTR CCP DTC NNC_CCP NNC CCB FW CCB DTCP FW CCB DTCP NNC LM CDB NNC_CCP JJCC JJD CCT DTCP RBI NNC_CCP NNC CCB DTCP NNC JJC CCT DTCP RBI NNC_CCP NNC CCB DTCP NNC_PMP
PR.* CC.* PM.* FW RB.* CD.* CC.* NN.* CC.* DT.* NN.* CC.* DT.* NN.* CC.* NN.* DT.* VB.* CC.* NN.* CC.* JJ.* NN.* CC.* FW CC.* NN.* CC.* NN.* CC.* NN.* CC.* DT.* NN.*_PM.*,PRI_CCP CCR PMS FW RBW_CCP CDB CCT NNC CCB DTCP NNC CCT DTCP NNC CCB NNPA DTC VBTS CCB NNC CCB JJC_CCP NNC CCB FW CCT NNC CCB NNC CCA NNC CCP DTCP NNC_PMP
DT.* DT.* NN.* CC.* NN.* LM VB.* CC.* NN.* PM.* NN.* CC.* DT.* JJ.* NN.* CC.* NN.* FW CC.* NN.* CC.* VB.* NN.* CC.* NN.* NN.* LM RB.* VB.* CC.* NN.* CC.* JJ.* CC.* NN.*_PM.*,DTC DTCP NNC CCB NNC LM VBTS CCB NNC PMS NNC CCP DTC JJD_CCP NNC CCB NNC_CCP FW CCT NNC CCB VBTR_VBAF_CCP NNC CCP NNC_CCP NNC LM RBM VBTS CCT NNC CCB JJD CCP NNC_PMC
CC.* VB.* CC.* VB.* NN.* NN.* CC.* DT.* NN.*_PM.*,CCP VBAF CCT VBTR NNC_CCP NNC CCB DTCP NNC_PMP
PM.*_ PR.* LM VB.* CC.* JJ.* NN.* CC.* NN.* CC.* DT.* NN.* LM VB.* JJ.* CC.* NN.*_PM.*_PM.*,PMS_ PRO LM VBTS CCB JJD_CCP NNC CCT NNC CCP DTC NNC LM VBH_CCP JJD CCP NNC_PMC_PMS
DT.* NN.* NN.*_PM.*,DTP NNP NNP_PMC
PR.* NN.* CC.* NN.* CC.* NN.*_PM.*,PRI_CCP NNC CCB NNC CCA NNC_PMC
LM VB.* CC.* PR.* NN.* CC.* DT.* NN.* NN.* PM.* NN.*_PM.*,LM VBTS CCT PRI_CCP NNC CCB DTC NNP NNP PMS NNP_PMP
DT.* NN.* NN.* LM VB.* RB.*_PM.*,DTP NNP NNP LM VBTR RBI_PMC
PM.*_ DT.* CC.* PM.* NN.* CC.* JJ.* CC.* NN.* CC.* DT.* NN.* CC.* NN.* CC.* CC.* PM.* FW LM RB.* VB.* CC.* VB.* DT.* JJ.* NN.* CC.* NN.* NN.* CC.* NN.* VB.* CC.* NN.* CC.* DT.* NN.* LM PR.* JJ.* NN.*_PM.*_PM.*,PMS_ DTC CCR PMS NNC CCT JJD CCP NNC CCA DTC NNC CCB NNC CCP CCR PMS FW LM RBM VBW CCP VBOF DTC JJD_CCP NNC CCB NNC NNPA CCA NNPA VBTS CCT NNC CCP DTC NNC LM PRI_CCP JJD_CCP NNC_PMP_PMS
PR.* CD.* CC.* NN.* PM.* NN.* CC.* NN.*_PM.*,PRI_CCP CDB CCP NNC_CCP PMS NNC CCP NNC_PMC
CC.* DT.* NN.* NN.*_PM.*,CCP DTP NNP NNP_PMC
CC.* NN.* NN.*_PM.*,CCB NNP NNP_PMC
NN.* LM VB.* CC.* NN.* NN.* VB.* PR.* VB.* CC.* DT.* NN.* CC.* PR.* NN.* CC.* NN.*_PM.*,NNP LM VBTS CCB NNPA NNP VBW PRS_CCP VBW CCB DTCP NNC CCT PRI_CCP NNC CCT NNC_PMP
DT.* NN.* CD.* CC.* NN.* NN.*_PM.*,DTC NNC CDB CCB NNP NNP_PMC
PR.* NN.* NN.* CD.*_PM.*,PRI_CCP NNP NNP CDB_PMC
RB.* CC.* NN.*_PM.*,RBW CCT NNP_PMC
NN.* LM VB.* CC.* JJ.* CC.* VB.* CC.* CC.* PR.* RB.* NN.* CC.* NN.* CC.* NN.* CC.* NN.* NN.*_PM.*,NNP LM VBTS CCB JJD CCA VBN_CCP CCT CCP PRQ RBI_CCP NNC CCT NNC CCB NNP CCT NNP NNP_PMP
VB.* PR.* RB.* NN.* DT.* VB.* RB.* CC.* VB.* CC.* DT.* NN.* NN.* DT.* DT.* NN.* CC.* NN.* CC.* NN.*_PM.*,VBN_CCP PRQ RBI_CCP NNC DTC VBAF RBW CCT VBTS CCB DTCP NNC_CCP NNC DTC DTCP NNC CCT NNC CCB NNC_PMP
DT.* DT.* NN.* LM RB.* VB.* NN.* CC.* DT.* NN.* CC.* NN.* CC.* NN.* NN.* CC.* DT.* NN.* CC.* NN.* NN.*_PM.*,DTC DTCP NNC LM RBW_CCP VBTR_CCP NNC CCB DTCP NNP CCB NNP CCT NNP NNP CCA DTCP NNC CCB NNP NNP_PMC
CC.* VB.* PM.* NN.* CC.* CC.* NN.* NN.*_PM.*,CCP VBH PMS NNC CCB CCB NNC_CCP NNP_PMP
DT.* NN.* LM VB.* PM.* NN.* CC.* FW CC.* VB.* CC.* JJ.* CC.* NN.*_PM.*,DTP NNP LM VBTS PMS NNC CCB FW CCT VBAF CCT JJD CCP NNC_PMP
DT.* DT.* NN.* LM VB.* CC.* DT.* NN.* NN.* CC.* DT.* DT.* NN.* CC.* VB.* PR.* CC.* NN.* LM VB.* CC.* NN.*,DTC DTCP NNC LM VBRF CCT DTCP NNC_CCP NNP CCA DTC DTCP NNC CCP VBTF PRO CCT NNC LM VBTF CCB NNC_CCP
CD.*_PM.*,CDB_PMP
DT.* NN.* PR.* LM VB.* VB.* DT.* PR.* NN.* RB.* JJ.* PM.* CD.* CC.* NN.* RB.* DT.* NN.* NN.* NN.*_PM.*,DTC NNC_CCP PRO LM VBAF VBW DTC PRI_CCP NNC RBW_CCP JJN PMS CDB CCB NNP RBW DTP NNP NNP NNP_PMC
PR.* NN.* NN.*_PM.*,PRI_CCP NNC NNP_PMC
CC.* RB.* VB.* CC.* PR.* NN.* CC.* NN.* CC.* DT.* JJ.* CC.* VB.* CC.* PR.* JJ.*_PM.*,CCP RBD_CCP VBW CCB PRI_CCP NNC CCT NNC CCB DTCP JJD CCP VBTS CCT PRSP_CCP JJD_PMP
DT.* DT.* NN.* PM.* PR.* NN.* CC.* NN.*_PM.*,DTC DTCP NNC PMS PRI_CCP NNC CCB NNC_PMC
CC.* DT.* NN.* NN.* NN.* CC.* NN.*_PM.*,CCB DTC NNP NNP NNP CCA NNPA_PMC
JJ.*_PM.*,JJD_PMC
LM VB.* CC.* NN.*_PM.*,LM VBTS CCB NNC_PMC
CC.* DT.* NN.* JJ.* CC.* DT.* NN.* NN.*_PM.*,CCP DTC NNC_CCP JJD CCT DTP NNP NNP_PMC
PR.* NN.* CC.* CC.* NN.* PM.* NN.*_PM.*,PRI_CCP NNC CCT CCT NNC PMS NNC_PMC
LM VB.* CC.* PR.*_PM.*,LM VBTF CCT PRSP_PMC
CC.* NN.* CC.* FW_PM.*,CCT NNC CCB FW_PMC
CD.* PM.* NN.* RB.* DT.* NN.* PM.* NN.* NN.* LM VB.* PM.* NN.*_PM.*,CDB PMS NNC RBW DTC NNC PMS NNC_CCP NNC LM VBW PMS NNC_PMP
DT.* NN.* LM VB.* PM.* NN.* CC.* JJ.* NN.* VB.* VB.* DT.* DT.* NN.* PR.*_PM.*,DTC NNP LM VBTS PMS NNC CCT JJD_CCP NNC VBW VBW DTC DTCP NNC_CCP PRO_PMP
DT.* VB.* CC.* VB.* CC.* DT.* NN.* CC.* NN.* LM JJ.* CC.* NN.* NN.*_PM.*,DTC VBTR_VBAF CCP VBTS CCB DTCP NNC CCT NNP LM JJD CCT NNP NNP_PMC
CC.* VB.* FW CC.* NN.* CC.* DT.* NN.* PR.* LM VB.* CC.* JJ.*,CCA VBTS FW CCB NNP CCP DTC NNC_CCP PRO LM VBOF CCB JJD_CCP
CD.* NN.* RB.* JJ.* PM.* CD.* CC.* NN.*_PM.*,CDB NNPA RBW_CCP JJN PMS CDB CCP NNP_PMP
VB.* RB.* DT.* JJ.* NN.*_PM.*,VBW RBI DTC JJN_CCP NNC_PMC
DT.* VB.* LM VB.* CC.* JJ.* JJ.* NN.* CC.* NN.*_PM.*,DTC VBTR_VBAF LM VBTS CCB JJCC JJD_CCP NNC CCT NNP_PMP
CC.* JJ.* NN.* PR.*_PM.*,CCT JJN_CCP NNC PRO_PMC
VB.* CC.* VB.* CC.* DT.* NN.*_PM.* RB.* VB.* CC.* PR.* RB.* PM.* NN.* CC.* NN.* CC.* PR.* JJ.* CC.* NN.* CC.* NN.*_PM.*,VBTS CCB VBTR_VBAF CCP DTP NNP_PMS RBD_CCP VBTS CCT PRI_CCP RBI_CCP PMS NNC CCB NNC CCT PRI_CCP JJD CCP NNC CCB NNC_PMC
RB.* VB.* RB.* CC.* PR.* RB.* PM.* JJ.* CC.* NN.* CC.* DT.* PR.* NN.* NN.*_PM.*,RBW VBTR RBI CCT PRI_CCP RBI_CCP PMS JJD CCP NNC CCB DTC PRSP_CCP NNC_CCP NNC_PMC
CC.* DT.* NN.*_PM.*,CCP DTP NNP_PMC
DT.* PR.* NN.* CC.* NN.*_PM.*_PM.*,DTC PRSP_CCP NNC CCT NNC_PMP_PMS
CC.* JJ.* NN.*_PM.*,CCT JJN_CCP NNC_PMC
DT.* NN.* CC.* DT.* PR.* NN.* LM VB.* CC.* DT.*_PM.* JJ.* CC.* JJ.* CC.* JJ.*_PM.*_PM.*,DTP NNP CCA DTC PRSP_CCP NNC LM VBOF CCT DTCP_PMS JJD CCP JJD CCT JJD_PMP_PMS
DT.* NN.* PR.* LM VB.* CC.*_PM.* DT.* NN.* CC.* DT.* PR.* NN.* LM RB.* FW CC.* FW FW CC.* RB.* NN.* CC.* VB.* CC.* DT.* NN.* RB.* VB.* CC.* NN.*_PM.*,DTC NNC_CCP PRO LM VBTS CCP_PMS DTP NNP CCA DTC PRSP_CCP NNC LM RBW_CCP FW CCB FW FW CCB RBD_CCP NNC CCB VBW CCB DTCP NNC RBW VBAF CCT NNC_PMC
CC.* DT.* PR.* NN.* LM RB.* CC.* VB.* CC.* CD.* PM.* NN.* CC.* CD.* PM.* NN.* NN.*_PM.*_PM.*,CCA DTC PRI_CCP NNC LM RBD CCP VBTR_VBAF CCB CDB PMS NNC CCA CDB PMS NNC_CCP NNC_PMP_PMS
DT.* PR.* PR.* JJ.* PM.* JJ.* LM VB.* DT.* NN.*_PM.* LM VB.* CC.* PR.* JJ.* NN.* CC.* CC.* VB.* CC.* DT.* NN.* CC.* JJ.* NN.* CC.* DT.* NN.* CC.* NN.* CC.* NN.* NN.*_PM.*_PM.*,DTCP PRQ_CCP PRI_CCP JJD PMS JJD LM VBTR_CCP DTP NNP_PMS LM VBTS CCT PRI_CCP JJD_CCP NNC CCR CCT VBW CCT DTCP NNC CCT JJD_CCP NNC CCB DTCP NNC CCB NNC CCB NNP NNP_PMS_PMC
PR.* LM VB.* CC.* PR.*_PM.* NN.* RB.* PM.* NN.* CC.* CC.* PR.* LM VB.* CC.* JJ.* NN.* CC.* PR.* FW PM.* NN.*_PM.*,PRS LM VBTS CCT PRI_CCP_PMS NNC_CCP RBI_CCP PMS NNC CCT CCP PRS LM VBTR CCT JJD_CCP NNC CCT PRSP_CCP FW PMS NNC_PMC
CC.* VB.* CC.* PR.* JJ.* CC.* JJ.* PM.* NN.* CC.* DT.* JJ.* NN.*_PM.*_PM.*,CCP VBTS CCT PRI_CCP JJD CCP JJD_CCP PMS NNC CCT DTCP JJD_CCP NNC_PMC_PMS
CC.* PR.* LM VB.* CC.* PR.*_PM.* NN.* CC.* VB.* CC.* PR.* CC.* PM.* NN.* CC.* NN.*_PM.*_PM.*,CCA PRS LM VBTS CCB PRI_CCP_PMS NNC CCP VBTF CCT PRSP_CCP CCR PMS NNC CCT NNC_PMP_PMS
VB.* NN.* RB.* CC.* JJ.* NN.* CC.*_PM.* DT.* NN.* LM VB.* CC.* RB.* NN.* CC.* NN.* PM.* NN.* CC.* NN.* NN.* CC.* DT.* NN.*_PM.*_PM.*,VBOF_CCP NNC RBI CCB JJD_CCP NNP CCP_PMS DTP NNP LM VBTR CCB RBI_CCP NNC CCP NNC PMS NNC CCT NNP_CCP NNP CCB DTCP NNP_PMP_PMS
VB.* RB.* CC.* NN.* CC.* DT.* PR.* NN.* CC.* NN.* PM.* NN.* LM VB.*_PM.* CC.* CC.* JJ.* DT.* NN.* PR.* CC.* DT.* NN.* CC.* NN.* CC.* CC.* CC.* VB.* PR.* CC.* PR.* JJ.* NN.*_PM.*_PM.*,VBTS RBI CCB NNC CCP DTC PRSP_CCP NNC CCT NNC PMS NNC LM VBAF_PMS CCT CCP JJD DTC NNC PRO CCT DTCP NNC CCB NNC CCA CCT CCP VBTR PRO CCB PRSP_CCP JJD_CCP NNC_PMP_PMS
DT.* PR.* RB.* CC.* DT.* JJ.* NN.* LM VB.* DT.* NN.* CC.*_PM.* DT.* NN.* LM RB.* VB.* DT.* NN.* CC.* NN.* NN.* CC.* PR.* VB.* JJ.* NN.* CC.* PR.* VB.* NN.* CC.* PM.* NN.*_PM.*_PM.*,DTC PRI RBI CCT DTCP JJD_CCP NNC LM VBTS DTC NNC CCP_PMS DTP NNP LM RBD_CCP VBTS DTC NNC CCT NNC_CCP NNP CCP PRS_CCP VBTS JJD_CCP NNC CCB PRI_CCP VBN_CCP NNC_CCP CCR PMS NNC_PMP_PMS
VB.* RB.* CC.* NN.* NN.* DT.* NN.* VB.*_PM.* DT.* DT.* NN.* NN.* CC.* NN.* NN.* CC.* DT.* JJ.* PM.* NN.* CC.* NN.* CC.* NN.* CC.* DT.* NN.* NN.*_PM.*,VBTS RBI CCB NNP NNP DTC NNC_CCP VBTR_CCP_PMS DTC DTCP NNC NNPA CCB NNP NNPA CCB DTC JJD PMS NNC CCB NNP CCB NNP CCP DTP NNP NNP_PMC
PR.* CC.* DT.* CC.* PR.* CC.* NN.* CC.* NN.* CC.* NN.*_PM.*_PM.*,PRI CCT DTCP CCB PRS CCT NNC CCB NNP CCA NNP_PMP_PMS
DT.* RB.* JJ.* NN.* CC.* NN.* CC.* PR.* LM VB.* CC.* DT.* NN.* CC.* DT.* PR.* NN.* JJ.* CC.* NN.*_PM.*,DTC RBF JJD_CCP NNC CCB NNC CCP PRO LM VBTS CCB DTCP NNC CCT DTCP PRI_CCP NNC JJD CCT NNP_PMP
PR.* CC.* DT.* NN.* CC.* PR.* LM DT.* NN.* NN.*_PM.*,PRI CCT DTCP NNC CCP PRO LM DTP NNP NNP_PMC
CC.* VB.* DT.* NN.* NN.* CC.*_PM.* DT.* PR.* CC.* PR.* DT.* NN.* LM RB.* VB.* CC.* NN.* CC.* PR.* NN.* CC.* VB.* CC.* JJ.* JJ.* CC.* NN.* CC.* NN.*_PM.*_PM.*,CCP VBTS DTP NNP NNP CCP_PMS DTC PRI CCT PRSP_CCP DTCP NNC LM RBM VBW CCT NNC CCT PRC_CCP NNC CCB VBAF CCT JJCC JJD CCP NNC CCB NNC_PMP_PMS
VB.* DT.* NN.* DT.* PR.* NN.* CC.* NN.* CC.* PR.* RB.* NN.* CC.* NN.* CC.* PR.* NN.* CC.* NN.*_PM.*,VBTS DTP NNP DTC PRSP_CCP NNC CCT NNC CCT PRI_CCP RBF NNC CCB NNC CCT PRI_CCP NNC CCB NNP_PMP
VB.* PR.* CC.*_PM.* PR.* LM JJ.* JJ.* CC.* PR.* CC.* DT.* NN.* LM JJ.* JJ.* CC.* NN.* CC.* DT.* NN.* LM VB.* CC.* RB.* PM.* JJ.* NN.* CC.* NN.* CC.* PR.* VB.* CC.* JJ.* NN.* CC.* NN.* CC.* PR.* VB.* PM.* VB.* CC.* NN.* CC.* NN.*_PM.*_PM.*,VBTS PRS CCP_PMS PRO LM JJCC JJD CCT PRSP CCP DTC NNC LM JJCS_CCP JJD CCT NNP CCA DTC NNC LM VBAF CCB RBI_CCP PMS JJD_CCP NNC CCP NNC CCP PRS_CCP VBAF CCB JJD_CCP NNC CCB NNC CCP PRI_CCP VBRF_CCP PMS VBOF CCT NNC CCB NNC_PMP_PMS
PM.*_ CC.* CC.* VB.* NN.*_PM.*,PMS_ CCR CCT VBTS_CCP NNC_PMC
VB.* CC.* NN.* CC.* VB.* DT.* NN.* CC.* RB.* VB.* CC.* NN.* CC.* DT.* NN.*_PM.*_PM.*,VBTS CCB NNC CCP VBOF DTC NNC CCB RBF VBW CCT NNC CCB DTCP NNC_PMP_PMS
VB.* PR.* NN.* CC.* VB.* DT.* NN.*_PM.*,VBW PRO_CCP NNC CCP VBTS DTP NNP_PMC
VB.* DT.* NN.* NN.* CC.*_PM.* VB.* PR.* CC.* PR.* LM VB.* CC.* CC.* NN.* CC.* NN.*_PM.*_PM.*,VBTS DTP NNP NNP CCP_PMS VBTR PRS CCP PRS LM VBTS CCT CCT NNC CCB NNP_PMP_PMS
DT.* VB.* CC.* LM VB.* CC.*_PM.* RB.* PR.* VB.* CC.* DT.* NN.* DT.* JJ.* RB.* VB.* PR.* DT.* DT.* NN.*_PM.*_PM.*,DTC VBAF CCB LM VBTS CCP_PMS RBF PRS VBS CCP DTP NNP DTC JJD RBW_CCP VBOF PRS DTC DTCP NNC_PMC_PMS
CC.*_PM.* VB.* VB.* PM.* NN.* CC.* PR.* CC.* VB.* DT.* DT.* NN.* PR.*_PM.*_PM.*,CCA_PMS VBN_CCP VBTS PMS NNC CCT PRSP CCP VBOF DTC DTCP NNC_CCP PRO_PMP_PMS
PM.*_ VB.* PR.* PR.* CC.* PR.* RB.*_PM.* CC.*_PM.* VB.* PR.* VB.* DT.* DT.* NN.* CC.* NN.*_PM.*_PM.*,PMS_ VBOF PRS PRO CCB PRS RBI_PMS CCR_PMS VBS PRS_CCP VBW DTC DTCP NNC CCT NNP_PMP_PMS
DT.* NN.* NN.* LM VB.* CC.* PR.* NN.* CC.* CD.* CC.* DT.* NN.* NN.* PR.* LM CC.* DT.* VB.* PM.* NN.* NN.* NN.* CC.* VB.* CC.* PR.* LM VB.* CC.* NN.* CC.* JJ.* CC.*,DTP NNP NNP LM VBAF CCB PRI_CCP NNC CCP CDB CCP DTCP NNC NNPA PRI LM CCT DTCP VBTR_VBRF PMS NNC_CCP NNC NNPA CCA VBTS CCP PRP LM VBAF CCT NNP CCT JJD CCP
CD.* NN.* CC.* NN.* CD.*_PM.*,CDB NNPA CCT NNP CDB_PMP
CC.* CC.* NN.* CC.* NN.* DT.* NN.* NN.*_PM.*,CCT CCT NNC CCB NNC DTP NNP NNP_PMC
DT.* VB.* LM VB.* RB.* CC.* PR.* RB.* JJ.* NN.* CC.* NN.* RB.* CC.* NN.* CC.* PR.* NN.* CC.* VB.* CC.* DT.* NN.* LM VB.* JJ.* CC.* NN.*_PM.*,DTC VBAF LM VBTS RBI CCT PRI_CCP RBF JJD_CCP NNC CCT NNP RBR CCT NNC CCB PRI_CCP NNC CCP VBTS CCP DTP NNP LM VBTS JJD CCB NNPA_PMC
RB.* DT.* JJ.* CC.* NN.*_PM.*,RBW DTC JJD CCP NNC_PMS
VB.* CC.* NN.* DT.* NN.* CC.* NN.* CC.* CC.* NN.* CC.* CC.* NN.* NN.* CC.* NN.*_PM.*,VBTS CCB NNP DTC NNC CCB NNP CCB CCB NNC CCT CCT NNC NNC CCT NNC_PMSC
CC.*_PM.*,CCA_PMC
CC.* NN.* CC.* NN.*_PM.*,CCT NNC CCB NNC_PMC
LM RB.* VB.* DT.* PR.* NN.*_PM.*,LM RBF VBTS DTP PRI_CCP NNC_PMP
DT.* VB.* CC.* JJ.* CC.* DT.* NN.* DT.* NN.* NN.* NN.* NN.* LM VB.* CC.* DT.* NN.* LM VB.* VB.* CC.* NN.* CC.* NN.*_PM.*,DTC VBAF CCP JJD CCP DTCP NNC DTP NNP NNP NNP NNP LM VBTS CCP DTC NNC LM VBS VBOF CCT NNC CCB NNC_PMC
VB.* PR.* DT.* PR.* NN.* CC.* NN.* CC.* NN.* CC.* NN.* NN.*_PM.*,VBOF PRS DTC PRSP_CCP NNC CCT NNC CCB NNC CCT NNP NNP_PMC
DT.* JJ.* NN.* CC.* NN.* CC.* NN.*_PM.*,DTC JJD_CCP NNC CCB NNPA CCT NNC_PMP
CC.* RB.* NN.* CC.* JJ.* NN.* CC.* NN.* NN.* VB.* DT.* NN.* NN.* NN.* NN.* CC.* DT.* NN.* LM RB.* VB.* VB.* PM.* NN.* RB.* RB.* PR.* VB.* CC.* NN.*_PM.*,CCT RBW_CCP NNC CCT JJD_CCP NNC CCB NNP NNP VBTS DTP NNP NNP NNP NNP CCP DTC NNC LM RBF VBS VBOB PMS NNC RBK RBF PRO VBAF CCT NNC_PMP
DT.* NN.* NN.*_PM.*,DTP NNP NNP_PMC
PR.* NN.* CC.* NN.* CC.* NN.* NN.*_PM.*,PRI_CCP NNC CCB NNC CCT NNP NNP_PMC
VB.* CC.* VB.* JJ.* NN.* CC.* DT.* VB.* PM.* FW CC.* VB.* DT.* NN.* RB.* CC.* NN.*_PM.*,VBTS CCR VBH JJD_CCP NNC CCB DTCP VBW PMS FW CCP VBH DTCP NNC RBR CCT NNC_PMC
PR.* LM RB.* CC.*_PM.* VB.* RB.*_PM.* CC.* NN.* CC.* DT.* PR.* NN.* CC.* NN.* CC.* NN.* LM RB.* VB.*_PM.*,PRP LM RBI CCP_PMS VBW RBL_PMS CCT NNC CCR DTC PRSP_CCP NNC CCA NNC CCT NNC LM RBF VBW_PMP
DT.* NN.* RB.* VB.* CC.* VB.*_PM.*,DTC NNC RBF VBTR CCP VBOF_PMC
VB.* PR.*_PM.*,VBS PRS_PMC
CC.* CC.* PR.* LM VB.*_PM.*,CCT CCR PRO LM VBTF_PMC
DT.* DT.* NN.* LM VB.* CC.* VB.* CC.* VB.* DT.* NN.* CC.* NN.*_PM.*,DTC DTCP NNC LM VBS CCP VBW CCP VBOF DTC NNC CCB NNC_PMP
VB.* RB.* PR.* CC.* DT.* DT.* VB.* PM.* FW LM VB.* VB.* CC.* RB.* PM.* NN.* CC.* NN.* PM.* CC.* RB.* RB.* VB.* CC.* PR.* NN.* PM.* NN.* RB.* CC.* RB.* RB.* VB.* DT.* DT.* NN.*_PM.*,VBTS RBI PRS CCP DTC DTCP VBW PMS FW LM VBS VBW CCB RBI_CCP PMS NNC CCP NNC PMS CCP RBF RBI VBTR CCB PRI_CCP NNC PMS NNC RBR CCT RBK RBQ VBAF DTC DTCP NNC_PMC
CC.* PR.* JJ.* NN.* CC.* VB.* CC.* DT.* NN.* CC.* VB.* CC.* DT.* VB.* CC.* NN.*_PM.*,CCT PRI_CCP JJD_CCP NNC CCP VBTR_VBAF CCT DTCP NNC CCP VBTR_VBAF CCT DTCP VBTF CCP NNC_PMP
DT.* NN.* FW NN.* LM VB.* PR.* CC.* VB.* CC.* DT.* NN.* LM VB.* VB.* CC.* DT.* NN.* CC.* NN.* CC.* JJ.* NN.*_PM.*,DTC NNP FW NNP LM VBTS PRS CCP VBTR CCP DTC NNP LM VBS VBOF CCT DTCP NNC CCB NNC CCT JJD_CCP NNC_PMP
PR.* LM VB.* PM.* NN.* CC.* PR.* NN.* CC.* NN.* RB.* CC.* NN.* CC.* VB.* CC.* JJ.* NN.* NN.* CC.* PR.* RB.* DT.* NN.* CC.* RB.* VB.* DT.* NN.*_PM.*,PRO LM VBTS PMS NNC CCB PRI_CCP NNC CCB NNC RBL CCT NNC CCP VBTR CCB JJN_CCP NNP NNP CCA PRI RBI_CCP DTCP NNC CCP RBD_CCP VBOF DTC NNC_PMC
CC.* RB.* DT.* NN.* CC.* NN.* CC.* NN.* CC.* NN.*_PM.*,CCA RBI DTC NNC CCB NNC CCT NNC CCB NNC_PMP
JJ.* CC.* NN.* NN.* VB.* CC.* PR.* NN.* CC.* DT.* PR.* NN.* DT.* NN.* NN.* LM VB.*_PM.* JJ.* CC.* JJ.* NN.*_PM.*_PM.*,JJD CCT NNP NNP VBTS CCT PRI_CCP NNC CCP DTC PRI_CCP NNC DTP NNP NNP LM VBTS_PMS JJD CCT JJD_CCP NNC_PMS_PMC
CC.* PR.* RB.* LM VB.* CC.* NN.* CC.* NN.*_PM.*,CCA PRO RBI LM VBTS CCT NNC CCB NNP_PMP
PM.*_ CC.* NN.*_PM.*,PMS_ CCT NNC_PMC
DT.* NN.* NN.* CC.* DT.* NN.* NN.* LM VB.* PM.* RB.* RB.*_PM.*,DTP NNP NNP CCA DTC NNP NNP LM VBAF PMS RBR RBI_PMC
CC.* NN.* CC.* DT.* NN.* CC.* NN.*_PM.*,CCT NNC CCB DTCP NNC CCB NNC_PMC
PR.* LM VB.* RB.* CC.* VB.* NN.* CC.* NN.*_PM.*_PM.*,PRS LM VBTF RBD CCT VBTR NNC CCB NNC_PMP_PMS
DT.* NN.* NN.* LM VB.* CC.* VB.* CC.*_PM.*,DTC NNP NNP LM VBTS CCT VBOF CCP_PMS
PM.*_ CC.*_PM.*,PMS_ CCB_PMC
CC.* DT.* PR.* NN.* LM VB.* CC.* NN.* CC.* NN.* CC.* NN.*_PM.*,CCR DTC PRI_CCP NNC LM VBTF CCB NNC CCT NNC CCB NNC_PMC
DT.* DT.* NN.* LM VB.* CC.* RB.* NN.* CC.* VB.* RB.* RB.* DT.* NN.* LM PR.* JJ.* CC.* NN.* RB.* PM.* NN.* CC.* RB.* RB.* DT.* NN.* LM RB.*_PM.*,DTC DTCP NNC LM VBS CCP RBL NNC CCT VBOF RBK RBQ DTC NNC LM PRI_CCP JJD CCP NNC_CCP RBI_CCP PMS NNC CCA RBK RBQ DTC NNC LM RBF_PMC
CC.* PR.* NN.*_PM.*,CCT PRI_CCP NNC_PMC
VB.*_PM.*_PM.*,VBW_PMP_PMS
DT.* NN.* NN.* CC.* NN.* NN.* CC.* CC.* NN.* CC.* NN.* CC.* DT.* NN.* NN.* LM VB.* CC.* DT.* NN.* NN.* LM VB.* VB.* DT.* NN.* NN.* CC.* VB.* DT.* NN.* CC.* PR.* CC.* CC.* JJ.* JJ.* NN.*_PM.*,DTC NNC_CCP NNC CCT NNP NNP CCT CCT NNP CCT NNP CCP DTP NNP NNP LM VBTS CCP DTC NNP NNP LM VBS VBAF DTP NNP NNP CCA VBOF DTC NNC CCP PRO CCT CCT JJD_CCP JJD_CCP NNC_PMP
PM.*_ PR.* LM RB.* CC.* JJ.* VB.*_PM.*,PMS_ PRS LM RBL CCT JJD VBW_PMC
CC.* DT.* PR.* VB.* CC.* PR.* VB.*_PM.*,CCA DTC PRSP_CCP VBTS CCP PRSP_CCP VBTS_PMC
CC.* PR.* LM VB.*_PM.*,CCB PRO LM VBTS_PMC
LM RB.* DT.* NN.* CC.* VB.* CC.* NN.* NN.*_PM.*_PM.*,LM RBT_CCP DTC NNC CCP VBTS CCB NNP NNP_PMC_PMS
VB.* DT.* NN.*_PM.*,VBS DTP NNP_PMP
DT.* NN.* CC.* NN.* CC.* NN.* CC.* DT.* NN.* NN.* LM VB.* CC.* VB.* RB.* RB.* DT.* PR.* NN.* CC.* NN.*_PM.* JJ.* CC.*,DTC NNP CCP NNC CCT NNC CCP DTP NNP NNP LM VBTS CCP VBTF RBK RBQ DTC PRSP_CCP NNC CCT NNP_PMS JJD CCP
CC.* NN.*_PM.*_PM.*,CCB NNC_PMP_PMS
CC.* NN.* CC.* NN.* CC.* CC.* NN.* CC.* VB.* CC.* RB.* VB.* NN.*,CCT NNC CCB NNC CCT CCT NNC CCP VBTR_VBAF CCA RBL VBTR_CCP NNC
CD.* PM.* RB.* CD.* CC.* CC.* DT.* VB.* NN.* CC.* NN.* CC.* CD.* CC.* CD.* RB.* CC.* NN.* NN.* CC.* CC.* CC.* NN.* CC.* NN.* RB.* CD.* RB.*_PM.*,CDB PMS RBW_CCP CDB CCT CCT DTCP VBH NNC CCT NNC CCB CDB CCA CDB RBR CCT NNPA NNPA CCA CCT CCR NNC CCP NNC RBW CDB RBW_PMC
VB.* DT.* NN.* CC.* VB.* CC.* CC.* PM.* NN.* CC.* NN.* CC.* VB.* DT.* DT.* NN.* CC.* NN.* CC.* VB.* PR.* JJ.* JJ.* JJ.* CC.* NN.* CC.* NN.*_PM.*,VBTS DTP NNP CCP VBAF CCT CCR PMS NNC CCB NNC CCA VBTS DTC DTCP NNC CCT NNC CCP VBH PRC_CCP JJCC JJD JJC CCT NNC CCB NNC_PMP
NN.*_PM.* FW PR.* NN.* CC.* VB.*_PM.*,NNP_PMS FW PRI_CCP NNC CCP VBTR_PMC
DT.* CD.* CC.* NN.* CC.* JJ.* CC.* NN.* CC.* PR.* NN.* LM VB.* DT.* NN.* NN.* CC.* PR.* PM.* VB.* CC.* JJ.* CC.* NN.* CC.* NN.* CC.* NN.*_PM.*,DTC CDB CCP NNC CCP JJCS_JJD CCP NNC CCT PRI_CCP NNC LM VBTS DTP NNP NNP CCT PRSP_CCP PMS VBTF CCT JJD CCP NNC CCB NNC CCB NNP_PMP
CC.* DT.* VB.* NN.* DT.* CC.* PM.* JJ.* CC.* NN.* CC.* DT.*_PM.* NN.* PM.* NN.*_PM.* CC.* JJ.* CC.* DT.* NN.* CC.* NN.* LM VB.* PM.* NN.* CC.* RB.* VB.* CC.* NN.* CC.* NN.* CC.* NN.* RB.* PR.* NN.*_PM.*,CCT DTCP VBTS_CCP NNC DTC CCR PMS JJD CCB NNP CCT DTCP_PMS NNC PMS NNC_PMS CCP JJD CCA DTCP NNC CCT NNC LM VBTS PMS NNC CCT RBF VBW CCB NNC CCB NNPA CCT NNC RBW_CCP PRI_CCP NNC_PMP
CC.*_PM.*,CCB_PMC
VB.* RB.* DT.* JJ.* CC.* DT.* NN.* CC.* NN.* CC.* JJ.* NN.* NN.* CC.* JJ.* CC.* NN.* RB.* PR.* LM VB.* CC.* VB.* PM.* NN.* DT.* NN.* CC.* DT.* NN.* CC.* VB.* RB.* JJ.* JJ.* RB.* CC.* DT.* NN.* CC.* CD.* CC.* NN.* CC.* RB.* VB.* DT.* DT.* JJ.* NN.* CC.* VB.* DT.* DT.* NN.* CC.* NN.* CC.* CC.* DT.* NN.* CC.* NN.* CC.* NN.* JJ.* NN.*_PM.*,VBOF RBW DTC JJC CCB DTCP NNC CCT NNC CCB JJD_CCP NNP_CCP NNC CCB JJD CCB NNP RBW PRS LM VBTR CCP VBTF PMS NNC DTC NNC CCT DTCP NNC CCP VBTS RBW JJCC JJD RBI CCB DTCP NNC CCB CDB CCP NNC CCA RBD_CCP VBOF DTC DTCP JJD_CCP NNC CCB VBOF DTC DTCP NNC CCB NNC CCT CCT DTCP NNC CCT NNC CCB NNC_CCP JJD_CCP NNC_PMP
CC.* RB.* RB.* DT.* VB.* CC.* JJ.* NN.* CC.* NN.* CC.* NN.* PR.* VB.* DT.* NN.* CC.* NN.* CC.* NN.* CC.* NN.* CC.* DT.* NN.* CC.* VB.* CC.* NN.* CC.* NN.* CC.* NN.* CC.* VB.* CC.* CC.* NN.* CC.* NN.* CC.* CC.* PM.* NN.* VB.* DT.* NN.*_PM.*,CCA RBI RBI DTC VBW CCT JJD_CCP NNC CCB NNP CCP NNC PRS_CCP VBOF DTC NNC CCB NNP CCT NNC CCB NNC CCB DTCP NNC CCP VBW CCB NNC CCB NNC CCB NNC CCB VBOF CCT CCT NNC CCB NNC CCT CCR PMS NNC_CCP VBAF DTC NNC_PMP
DT.* NN.* CC.* PR.* NN.* CC.* VB.* CC.* NN.* CC.* DT.* NN.* CC.* NN.* LM RB.* RB.* VB.* RB.* CC.* VB.* CC.* NN.*_PM.*,DTC NNC CCB PRSP_CCP NNC CCA VBAF CCT NNC CCB DTCP NNC CCT NNC LM RBF RBI VBTS RBR CCT VBTS CCT NNC_PMP
NN.* RB.* CC.* NN.* NN.* CC.* DT.* NN.* NN.* LM RB.* CC.* VB.* DT.* PR.* DT.* NN.* CC.*_PM.* NN.* PM.* NN.*_PM.* CC.* DT.* NN.* CC.* NN.* CC.* JJ.* NN.* LM VB.* CC.* VB.* CC.* DT.* JJ.* NN.* CC.* NN.*_PM.*,NNC RBW CCT NNP_CCP NNC CCP DTP NNP NNP LM RBD CCP VBTS DTC PRSP_CCP DTCP NNC CCT_PMS NNC PMS NNC_PMS CCA DTC NNC CCB NNC CCT JJCS_JJD_CCP NNC LM VBAF CCT VBTR_VBAF CCP DTCP JJD_CCP NNC CCT NNC_PMP
PR.* LM VB.* CC.* DT.* NN.* LM VB.* CC.* DT.* JJ.* NN.* LM JJ.* CC.* NN.* CC.* RB.* RB.* DT.* NN.* LM VB.* CC.* NN.*_PM.*,PRS LM VBTS CCP DTC NNP LM VBTR_VBAF CCT DTCP JJD_CCP NNC LM JJCS_JJD CCT NNC CCP RBK RBQ DTC NNC LM VBTR_VBAF CCT NNC_PMP
DT.* NN.* NN.* LM RB.* VB.* CC.* DT.* NN.* CC.* NN.* PR.* NN.* VB.* VB.* DT.* PR.* NN.* CC.* CC.* NN.* CC.* NN.*_PM.*,DTP NNP NNP LM RBW_CCP VBTR CCT DTCP NNC CCB NNC PRI_CCP NNC VBW VBOF DTC PRSP_CCP NNC CCT CCT NNC CCT NNP_PMP
RB.* VB.* CC.* NN.* DT.* NN.* NN.* CC.* NN.* PM.* NN.* CC.* NN.* NN.* CC.* NN.* CC.* RB.*_PM.*,RBD_CCP VBTS CCB NNC DTC NNC_CCP NNC CCB NNP PMS NNP CCT NNP NNP CCB NNP CCB RBW_PMP
PR.* NN.* LM VB.* RB.* CC.* DT.* FW LM VB.* CC.* RB.*_PM.*,PRI_CCP NNC LM VBTS RBD CCA DTC FW LM VBTS CCP RBW_PMP
PR.* DT.* JJ.* CC.* PR.* JJ.* CC.* NN.* CC.* NN.*_PM.*,PRO DTC JJCS_JJD CCT PRI_CCP JJD CCB NNC CCT NNP_PMC
CC.* RB.* RB.* LM RB.* JJ.* CC.* NN.* CC.* NN.*_PM.*,CCP RBK RBQ LM RBL JJD CCP NNC CCB NNC_PMP
DT.* NN.* PM.* NN.* CC.* DT.* NN.* LM VB.* CC.* PR.* NN.* RB.* CC.* PR.* JJ.* NN.* CC.* VB.* CC.* NN.* CC.* NN.* CC.* NN.* CC.* NN.* CC.* NN.*_PM.*,DTC NNC_CCP PMS NNC CCP DTCP NNP LM VBTS CCB PRI_CCP NNC RBR CCT PRI_CCP JJD_CCP NNC CCP VBTS CCT NNC CCB NNP CCB NNP CCB NNP CCT NNP_PMC
DT.* NN.* CC.* NN.*_PM.*,DTC NNC CCB NNP_PMC
CC.* VB.* CC.* JJ.* NN.* CC.* NN.* NN.*_PM.*,CCP VBTF CCT JJD_CCP NNC CCB NNP NNP_PMP
DT.* NN.* LM VB.* DT.* NN.* NN.*_PM.*,DTC NNC LM VBTS DTP NNP NNP_PMC
PR.* CD.* PM.* NN.* PM.* NN.* CC.* NN.* CC.* VB.* PR.*_PM.*,PRI_CCP CDB PMS NNC_CCP PMS NNC CCP NNC CCP VBTS PRL_PMC
RB.* VB.* PR.* CC.* DT.* PR.* NN.* RB.* RB.* CC.* JJ.* PM.* CD.* CC.* NN.* RB.* NN.*_PM.*,RBW_CCP VBTR PRS CCB DTC PRSP_CCP NNC RBW_CCP RBW CCB JJN PMS CDB CCB NNP RBW_CCP NNC_PMP
VB.* PR.* DT.* PR.* NN.*_PM.*,VBTS PRS DTC PRSP_CCP NNC_PMC
VB.* PR.* DT.* DT.* PR.* CC.* NN.* CC.* VB.* CC.* DT.* NN.* CC.* NN.*_PM.*,VBTS PRS DTC DTCP PRO CCT NNC CCA VBAF CCB DTCP NNC CCB NNC_PMC
RB.* RB.* RB.* PR.* VB.*_PM.*,RBW RBI RBI PRO VBAF_PMP
PR.* CC.* DT.* PR.* NN.* LM RB.* CC.* VB.* CC.* NN.* PM.* NN.* CC.* NN.*_PM.*,PRS CCA DTC PRSP_CCP NNC LM RBD CCP VBAF CCT NNP_CCP PMS NNC CCB NNP_PMC
NN.* PR.* LM NN.* RB.* CC.* VB.* CC.* PR.* CC.* VB.* DT.* NN.* CC.* JJ.* JJ.*_PM.*,NNC_CCP PRO LM NNC RBI CCA VBTS CCT PRSP CCP VBOF DTC NNC CCB JJCC JJD_PMP
DT.* NN.* PM.* NN.*_PM.*,DTC NNC_CCP PMS NNC_PMC
CC.*_PM.*,CCB_PMC
LM VB.* NN.* CC.* VB.* NN.*_PM.*,LM VBN_CCP NNC CCT VBTS_CCP NNC_PMC
CC.* VB.* DT.* NN.* RB.* CC.* PR.* DT.* NN.* RB.* CC.* NN.*_PM.*,CCA VBN_CCP DTCP NNC RBL CCT PRI_CCP DTCP NNC RBR CCT NNC_PMP
VB.* PR.*_PM.*,VBW PRO_PMC
DT.* NN.* CC.* NN.* PM.* NN.* LM VB.* CC.* DT.* NN.*_PM.*,DTC NNC CCB NNC_CCP PMS NNC LM VBAF CCT DTCP NNP_PMC
CC.* VB.* CC.* DT.* NN.* CC.* CC.* DT.* NN.* RB.* PM.* JJ.*_PM.*,CCA VBAF CCB DTCP NNC CCT CCT DTCP NNC_CCP RBI_CCP PMS JJD_PMP
VB.* PR.* CC.* NN.* NN.* CC.* DT.* NN.* CC.* JJ.* NN.* NN.* CC.* DT.* NN.* CC.* DT.* JJ.* PM.* NN.* CC.* VB.* VB.* CC.* NN.* CC.* NN.* CC.* JJ.* JJ.* CC.* NN.*_PM.*,VBTR PRP CCB NNC NNP CCT DTCP NNC CCB JJD_CCP NNP NNP CCA DTC NNP CCB DTCP JJD PMS NNP CCP VBTS VBAF CCT NNC CCB NNP CCT JJC_CCP JJD CCP NNC_PMP
CC.* NN.* CC.* NN.* NN.* CC.* NN.*_PM.*,CCT NNC CCT NNP_CCP NNP CCB NNP_PMC
DT.* DT.* PR.* RB.* NN.* CC.* NN.* LM JJ.* RB.* CC.* NN.* JJ.* CC.* NN.* CC.* NN.* CC.* NN.* CC.* NN.*_PM.*,DTC DTCP PRI RBI_CCP NNC CCB NNC LM JJD RBI CCT NNC JJC CCB NNPA CCA NNP CCB NNP CCT NNP_PMP
RB.* DT.* NN.* NN.* CC.* NN.* JJ.*_PM.*,RBR DTP NNP NNP CCP NNC_CCP JJD_PMC
DT.* VB.* CC.* NN.* LM VB.* CC.* PR.* LM VB.* CC.* VB.* CC.* VB.* CC.* NN.* CC.* NN.* CC.* NN.* CC.* JJ.* NN.*_PM.*,DTC VBW CCT NNC LM VBTR CCA PRO LM VBTR CCP VBTF CCA VBTF CCT NNP CCB NNP CCT NNC CCB JJN_CCP NNC_PMP
CC.* PR.* RB.* JJ.* CC.* VB.* CC.* DT.* NN.*_PM.*,CCT PRI_CCP RBF JJD CCP VBW CCT DTCP NNC_PMC
DT.* DT.* NN.* CC.* DT.* NN.* LM VB.* CC.* VB.* PR.* VB.* CC.* PR.* JJ.* NN.* CC.* VB.* CC.* VB.* CC.* NN.* CC.*_PM.* JJ.* CC.* VB.*_PM.* DT.* NN.* CC.* NN.*_PM.*,DTC DTCP NNC CCP DTCP NNP LM VBTS CCP VBH PRP_CCP VBTS CCP PRI_CCP JJD_CCP NNC CCP VBW CCT VBW CCB NNPA CCA_PMS JJD CCP VBW_PMS DTC NNC CCT NNC_PMP
PM.*_ PR.* VB.* CC.* NN.* PR.*_PM.*_PM.*,PMS_ PRI_CCP VBTR CCT NNC_CCP PRO_PMC_PMS
VB.* CC.* NN.* CC.* DT.* NN.* NN.* CC.* NN.* NN.* NN.*_PM.*,VBS CCB NNC CCP DTP NNP NNP CCB NNP NNP NNP_PMP
DT.* NN.* CC.* VB.* CC.* NN.* PM.* CD.*_PM.*,DTC NNC CCP VBTR CCP NNPA PMS CDB_PMC
CC.* RB.* RB.* LM VB.* CC.* NN.* CC.* FW CC.* RB.* CC.* DT.* PR.* NN.* CC.* NN.* RB.* CC.* NN.* CC.* NN.*_PM.*,CCP RBK RBQ LM VBTS CCT NNC CCP FW CCA RBW CCT DTCP PRI_CCP NNC CCB NNC RBL CCT NNC CCB NNC_PMC
LM VB.* CC.* VB.* CC.* NN.* NN.* DT.* NN.* CC.* NN.* CC.* NN.*_PM.*,LM VBS CCA VBTS CCB NNP NNP DTC NNC CCB NNC CCB NNP_PMP
DT.* NN.* LM JJ.* CC.* PR.* FW FW_PM.*,DTC NNC LM JJD CCT PRI_CCP FW FW_PMC
RB.* RB.* LM PR.* JJ.* NN.* CC.* DT.* NN.*_PM.*,RBK RBQ LM PRI_CCP JJD_CCP NNC CCB DTCP NNC_PMP
DT.* NN.* PR.* LM VB.* DT.* JJ.* CC.* NN.* CC.* NN.* CC.* NN.*_PM.*,DTC NNC PRO LM VBW DTC JJD CCP NNC CCT NNC CCB NNPA_PMP
VB.* CC.* NN.* DT.* JJ.* CC.* JJ.* NN.* CC.* NN.* CC.* NN.* CC.* NN.* CC.* NN.* CC.* NN.* CC.* RB.* VB.* NN.* PR.* CC.* NN.* CC.* RB.* VB.* DT.* NN.* PR.* VB.* CC.* VB.* CC.* PR.* RB.* NN.*_PM.*,VBW CCB NNC DTC JJD CCP JJD_CCP NNC CCT NNC CCB NNC CCB NNC CCT NNC CCB NNC CCP RBT_CCP VBTF NNC PRO CCB NNC CCA RBF VBTF DTC NNC PRO_CCP VBW CCT VBTF CCP PRI RBI_CCP NNC_PMP
DT.* NN.* LM VB.* RB.* CC.* VB.* PR.* CC.* DT.* VB.* CC.* NN.* CC.* VB.* CC.* PR.* RB.* DT.* NN.*_PM.*,DTC NNC LM VBTR RBI CCP VBTR_VBAF PRO CCT DTCP VBTR_VBRF CCB NNPA CCP VBTR_VBAF CCT PRI RBI_CCP DTCP NNC_PMP
PM.*_ PR.* LM PR.* JJ.* CC.* JJ.* NN.* CC.* DT.* NN.*_PM.*,PMS_ PRO LM PRI_CCP JJD CCP JJD_CCP NNC CCB DTCP NNC_PMC
