N-Gram_ID,RoughPOS_N-Gram,DetailedPOS_N-Gram,N-Gram,Lemma_N-Gram
000012,VB.* PR.* CC.* NN.* RB.*,VBN PRS CCT NNC RBW,wala ako sa katinuan ngayon,wala ako sa katinuan ngayon
000013,PR.* CC.* NN.* RB.* CC.*,PRS CCT NNC RBW CCR,ako sa katinuan ngayon kasi,ako sa katinuan ngayon kasi
000014,CC.* NN.* RB.* CC.* CC.*,CCT NNC RBW CCR CCT,sa katinuan ngayon kasi para,sa katinuan ngayon kasi para
000015,NN.* RB.* CC.* CC.* PR.*,NNC RBW CCR CCT PRS_CCP,katinuan ngayon kasi para akong,katinuan ngayon kasi para akong
000016,RB.* CC.* CC.* PR.* VB.*,RBW CCR CCT PRS_CCP VBTS,ngayon kasi para akong nakawalang,ngayon kasi para akong nakawalang
000017,CC.* CC.* PR.* VB.* CC.*,CCR CCT PRS_CCP VBTS CCT,kasi para akong nakawalang sa,kasi para akong nakawalang sa
000018,CC.* PR.* VB.* CC.* NN.*_PM.*,CCT PRS_CCP VBTS CCT NNC_PMP,para akong nakawalang sa hawla.,para akong nakawalang sa hawla.
000040,RB.* RB.* DT.* NN.* NN.*,RBK RBQ DTC NNC NNC,Kung ano ang kapaligiran kadahilanan,Kung ano ang kapaligiran kadahilanan
000041,RB.* DT.* NN.* NN.* LM,RBQ DTC NNC NNC LM,ano ang kapaligiran kadahilanan ay,ano ang kapaligiran kadahilanan ay
000042,DT.* NN.* NN.* LM JJ.*,DTC NNC NNC LM JJD,ang kapaligiran kadahilanan ay partikular,ang kapaligiran kadahilanan ay partikular
000043,NN.* NN.* LM JJ.* CC.*,NNC NNC LM JJD CCP,kapaligiran kadahilanan ay partikular na,kapaligiran kadahilanan ay partikular na
000044,NN.* LM JJ.* CC.* JJ.*,NNC LM JJD CCP JJD,kadahilanan ay partikular na mahalaga,kadahilanan ay partikular na mahalaga
000045,LM JJ.* CC.* JJ.* CC.*,LM JJD CCP JJD CCT,ay partikular na mahalaga para,ay partikular na mahalaga para
000046,CC.* JJ.* CC.* CC.* NN.*,CCP JJD CCT CCT NNC,na mahalaga para sa buhay,na mahalaga para sa buhay
000047,JJ.* CC.* CC.* NN.* CC.*,JJD CCT CCT NNC CCB,mahalaga para sa buhay ng,mahalaga para sa buhay ng
000048,CC.* CC.* NN.* CC.* DT.*,CCT CCT NNC CCB DTCP,para sa buhay ng mga,para sa buhay ng mga
000049,CC.* NN.* CC.* DT.* NN.*,CCT NNC CCB DTCP NNC,sa buhay ng mga parasito,sa buhay ng mga parasito
000050,NN.* CC.* DT.* NN.* VB.*,NNC CCB DTCP NNC VBTR,buhay ng mga parasito aalala,buhay ng mga parasito aalala
000051,CC.* DT.* NN.* VB.* RB.*,CCB DTCP NNC VBTR RBR,ng mga parasito aalala tungkol,ng mga parasito aalala tungkol
000052,DT.* NN.* VB.* RB.* CC.*,DTCP NNC VBTR RBR CCT,mga parasito aalala tungkol sa,mga parasito aalala tungkol sa
000053,NN.* VB.* RB.* CC.* DT.*,NNC VBTR RBR CCT DTCP,parasito aalala tungkol sa mga,parasito aalala tungkol sa mga
000054,VB.* RB.* CC.* DT.* NN.*,VBTR RBR CCT DTCP NNC,aalala tungkol sa mga uod,aalala tungkol sa mga uod
000055,RB.* CC.* DT.* NN.* CC.*,RBR CCT DTCP NNC CCT,tungkol sa mga uod sa,tungkol sa mga uod sa
000056,CC.* DT.* NN.* CC.* RB.*_PM.*,CCT DTCP NNC CCT RBW_PMC,"sa mga uod sa gabi,",sa mga uod sa gabi
000099,JJ.* CC.* VB.* DT.* DT.*,JJC CCB VBOF DTC DTCP,kaysa upang dalhin ang mga,kaysa upang dalhin ang mga
000100,CC.* VB.* DT.* DT.* NN.*,CCB VBOF DTC DTCP NNC,upang dalhin ang mga uod,upang dalhin ang mga uod
000101,VB.* DT.* DT.* NN.* CC.*,VBOF DTC DTCP NNC CCT,dalhin ang mga uod sa,dalhin ang mga uod sa
000102,DT.* DT.* NN.* CC.* PR.*,DTC DTCP NNC CCT PRI_CCP,ang mga uod sa isang,ang mga uod sa isang
000103,DT.* NN.* CC.* PR.* NN.*,DTCP NNC CCT PRI_CCP NNC,mga uod sa isang buntis,mga uod sa isang buntis
000104,NN.* CC.* PR.* NN.* CC.*,NNC CCT PRI_CCP NNC CCP,uod sa isang buntis na,uod sa isang buntis na
000105,CC.* PR.* NN.* CC.* NN.*,CCT PRI_CCP NNC CCP NNC,sa isang buntis na babae,sa isang buntis na babae
000133,JJ.* NN.* NN.* CC.* VB.*,JJD NNC NNC CCP VBTR_VBAF,parasito atay sugat na pumapatay,parasito atay sugat na pumapatay
000134,NN.* NN.* CC.* VB.* CC.*,NNC NNC CCP VBTR_VBAF CCB,atay sugat na pumapatay ng,atay sugat na pumapatay ng
000135,NN.* CC.* VB.* CC.* DT.*,NNC CCP VBTR_VBAF CCB DTCP,sugat na pumapatay ng mga,sugat na pumapatay ng mga
000136,CC.* VB.* CC.* DT.* NN.*,CCP VBTR_VBAF CCB DTCP NNC,na pumapatay ng mga parasito,na pumapatay ng mga parasito
000137,VB.* CC.* DT.* NN.* CC.*,VBTR_VBAF CCB DTCP NNC CCT,pumapatay ng mga parasito sa,pumapatay ng mga parasito sa
000138,CC.* DT.* NN.* CC.* NN.*,CCB DTCP NNC CCT NNC,ng mga parasito sa loob,ng mga parasito sa loob
000139,DT.* NN.* CC.* NN.* CC.*,DTCP NNC CCT NNC CCB,mga parasito sa loob ng,mga parasito sa loob ng
000140,NN.* CC.* NN.* CC.* NN.*_PM.*,NNC CCT NNC CCB NNC_PMP,parasito sa loob ng tao.,parasito sa loob ng tao.
000163,RB.* RB.* VB.* DT.* DT.*,RBK RBQ VBW DTC DTCP,Kung paano makilala ang mga,Kung paano makilala ang mga
000164,RB.* VB.* DT.* DT.* NN.*,RBQ VBW DTC DTCP NNC,paano makilala ang mga uod,paano makilala ang mga uod
000165,VB.* DT.* DT.* NN.* CC.*,VBW DTC DTCP NNC CCT,makilala ang mga uod sa,makilala ang mga uod sa
000166,DT.* DT.* NN.* CC.* DT.*,DTC DTCP NNC CCT DTCP,ang mga uod sa mga,ang mga uod sa mga
000167,CC.* CC.* NN.* CC.* DT.*,CCT CCT NNC CCB DTCP,para sa presensiya ng mga,para sa presensiya ng mga
000168,CC.* NN.* CC.* DT.* NN.*_PM.*,CCT NNC CCB DTCP NNC_PMC,"sa presensiya ng mga parasito,",sa presensiya ng mga parasito
000185,JJ.* CC.* PR.* RB.* DT.*,JJCC CCR PRI RBI DTC,lalo pag isa lang ang,lalo pag isa lang ang
000186,CC.* PR.* RB.* DT.* VB.*,CCR PRI RBI DTC VBTR,pag isa lang ang ginagawa,pag isa lang ang ginagawa
000207,RB.* CC.* RB.* VB.* DT.*,RBF CCR RBT VBW DTC,Di kasi talaga matuto ang,Di kasi talaga matuto ang
000208,CC.* RB.* VB.* DT.* PR.*,CCR RBT VBW DTC PRI,kasi talaga matuto ang karamihan,kasi talaga matuto ang karamihan
000209,RB.* VB.* DT.* PR.* CC.*,RBT VBW DTC PRI CCB,talaga matuto ang karamihan ng,talaga matuto ang karamihan ng
000210,VB.* DT.* PR.* CC.* NN.*,VBW DTC PRI CCB NNP,matuto ang karamihan ng Pilipino,matuto ang karamihan ng Pilipino
000211,DT.* PR.* CC.* NN.* CC.*,DTC PRI CCB NNP CCP,ang karamihan ng Pilipino na,ang karamihan ng Pilipino na
000212,PR.* CC.* NN.* CC.* VB.*,PRI CCB NNP CCP VBAF,karamihan ng Pilipino na bumoto,karamihan ng Pilipino na bumoto
000213,CC.* NN.* CC.* VB.* CC.*,CCB NNP CCP VBAF CCB,ng Pilipino na bumoto ng,ng Pilipino na bumoto ng
000214,NN.* CC.* VB.* CC.* JJ.*,NNP CCP VBAF CCB JJN,Pilipino na bumoto ng karapat,Pilipino na bumoto ng karapat
000215,CC.* VB.* CC.* JJ.* VB.*,CCP VBAF CCB JJN VBS,na bumoto ng karapat dapat,na bumoto ng karapat dapat
000216,VB.* CC.* JJ.* VB.* CC.*,VBAF CCB JJN VBS CCP,bumoto ng karapat dapat na,bumoto ng karapat dapat na
000217,CC.* JJ.* VB.* CC.* VB.*,CCB JJN VBS CCP VBW,ng karapat dapat na mamuno,ng karapat dapat na mamuno
000218,JJ.* VB.* CC.* VB.* CC.*,JJN VBS CCP VBW CCT,karapat dapat na mamuno kahit,karapat dapat na mamuno kahit
000219,VB.* CC.* VB.* CC.* RB.*,VBS CCP VBW CCT RBI,dapat na mamuno kahit man,dapat na mamuno kahit man
000220,CC.* VB.* CC.* RB.* RB.*,CCP VBW CCT RBI RBI,na mamuno kahit man lang,na mamuno kahit man lang
000221,CC.* RB.* RB.* CC.* PR.*,CCT RBI RBI CCT PRSP_CCP,kahit man lang sa kanilang,kahit man lang sa kanilang
000222,RB.* RB.* CC.* PR.* NN.*_PM.*,RBI RBI CCT PRSP_CCP NNC_PMP,man lang sa kanilang baranggay.,man lang sa kanilang baranggay.
000260,CC.* DT.* NN.* JJ.* NN.*_PM.*,CCT DTC NNC_CCP JJD_CCP NNC_PMC,"Pero ang kawawang simpleng empleyado,",Pero ang kawawang simpleng empleyado
000266,DT.* CC.* PM.* JJ.* CC.*,DTC CCR PMS JJD CCB,ang pag-kakahiwahiwalay ng mga pulo,ang pag-kakahiwahiwalay ng mga pulo
000267,CC.* PM.* JJ.* CC.* DT.*,CCR PMS JJD CCB DTCP,pag-kakahiwahiwalay ng mga pulo ay,pag-kakahiwahiwalay ng mga pulo ay
000268,PM.* JJ.* CC.* DT.* NN.*,PMS JJD CCB DTCP NNC,ng mga pulo ay ay,ng mga pulo ay ay
000269,JJ.* CC.* DT.* NN.* LM,JJD CCB DTCP NNC LM,mga pulo ay ay nakakapag,mga pulo ay ay nakakapag
000270,CC.* DT.* NN.* LM LM,CCB DTCP NNC LM LM,pulo ay ay nakakapag pahina,pulo ay ay nakakapag pahina
000271,DT.* NN.* LM LM VB.*,DTCP NNC LM LM VBTR,ay ay nakakapag pahina ng,ay ay nakakapag pahina ng
000290,VB.* PR.* VB.* FW FW,VBTF PRP_CCP VBW FW FW,mahihirapan tayong mag tipon tipon,mahihirapan tayong mag tipon tipon
000291,PR.* VB.* FW FW CC.*,PRP_CCP VBW FW FW CCR,tayong mag tipon tipon dahil,tayong mag tipon tipon dahil
000292,VB.* FW FW CC.* VB.*,VBW FW FW CCR VBTR,mag tipon tipon dahil hiwahiwalay,mag tipon tipon dahil hiwahiwalay
000293,FW FW CC.* VB.* RB.*,FW FW CCR VBTR RBI,tipon tipon dahil hiwahiwalay nga,tipon tipon dahil hiwahiwalay nga
000294,FW CC.* VB.* RB.* DT.*,FW CCR VBTR RBI DTC,tipon dahil hiwahiwalay nga ang,tipon dahil hiwahiwalay nga ang
000295,CC.* VB.* RB.* DT.* DT.*,CCR VBTR RBI DTC DTCP,dahil hiwahiwalay nga ang mga,dahil hiwahiwalay nga ang mga
000321,CC.* CC.* VB.* PR.* PR.*,CCR CCR VBN PRO PRP,dahil kapag wala ito tayo,dahil kapag wala ito tayo
000322,CC.* VB.* PR.* PR.* VB.*,CCR VBN PRO PRP VBW,kapag wala ito tayo magkagulo-gulo,kapag wala ito tayo magkagulo-gulo
000323,VB.* PR.* PR.* VB.* PM.*,VBN PRO PRP VBW PMS,wala ito tayo magkagulo-gulo lalo,wala ito tayo magkagulo-gulo lalo
000324,PR.* PR.* VB.* PM.* NN.*,PRO PRP VBW PMS NNC,ito tayo magkagulo-gulo lalo na,ito tayo magkagulo-gulo lalo na
000325,PR.* VB.* PM.* NN.* JJ.*,PRP VBW PMS NNC JJCC,tayo magkagulo-gulo lalo na iyong,tayo magkagulo-gulo lalo na iyong
000326,VB.* PM.* NN.* JJ.* CC.*,VBW PMS NNC JJCC CCP,magkagulo-gulo lalo na iyong mga,magkagulo-gulo lalo na iyong mga
000327,PM.* NN.* JJ.* CC.* PR.*,PMS NNC JJCC CCP PRO_CCP,lalo na iyong mga taong,lalo na iyong mga taong
000328,NN.* JJ.* CC.* PR.* DT.*,NNC JJCC CCP PRO_CCP DTCP,na iyong mga taong salat,na iyong mga taong salat
000329,JJ.* CC.* PR.* DT.* NN.*,JJCC CCP PRO_CCP DTCP NNC_CCP,iyong mga taong salat sa,iyong mga taong salat sa
000330,CC.* PR.* DT.* NN.* JJ.*,CCP PRO_CCP DTCP NNC_CCP JJD,mga taong salat sa edukasyon,mga taong salat sa edukasyon
000331,PR.* DT.* NN.* JJ.* CC.*,PRO_CCP DTCP NNC_CCP JJD CCT,taong salat sa edukasyon para,taong salat sa edukasyon para
000332,DT.* NN.* JJ.* CC.* NN.*,DTCP NNC_CCP JJD CCT NNC,salat sa edukasyon para magsalita,salat sa edukasyon para magsalita
000333,NN.* JJ.* CC.* NN.* CC.*,NNC_CCP JJD CCT NNC CCT,sa edukasyon para magsalita ng,sa edukasyon para magsalita ng
000334,JJ.* CC.* NN.* CC.* VB.*,JJD CCT NNC CCT VBW,edukasyon para magsalita ng salitang,edukasyon para magsalita ng salitang
000335,CC.* NN.* CC.* VB.* CC.*,CCT NNC CCT VBW CCB,para magsalita ng salitang banyaga….,para magsalita ng salitang banyaga….
000369,NN.* DT.* VB.* CC.* NN.*,NNP DTC VBRF CCB NNC_CCP,Tagalog ang pinagbatayan ng wikang,Tagalog ang pinagbatayan ng wikang
000370,DT.* VB.* CC.* NN.* JJ.*_PM.*,DTC VBRF CCB NNC_CCP JJD_PMC,"ang pinagbatayan ng wikang pambansa,",ang pinagbatayan ng wikang pambansa
000379,PR.* LM RB.* VB.* CC.*,PRO LM RBD_CCP VBW CCB,ito ay napakadaling matutunan ng,ito ay napakadaling matutunan ng
000380,LM RB.* VB.* CC.* PR.*_PM.*,LM RBD_CCP VBW CCB PRI_PMP,ay napakadaling matutunan ng sinuman.,ay napakadaling matutunan ng sinuman.
000396,VB.* CC.* CD.* NN.* CC.*,VBAF CCT CDB NNC CCP,kumpara sa 571 krimen na,kumpara sa 571 krimen na
000397,CC.* CD.* NN.* CC.* VB.*,CCT CDB NNC CCP VBTS,sa 571 krimen na naitala,sa 571 krimen na naitala
000398,CD.* NN.* CC.* VB.* RB.*,CDB NNC CCP VBTS RBW_CCP,571 krimen na naitala noong,571 krimen na naitala noong
000399,NN.* CC.* VB.* RB.* NN.*,NNC CCP VBTS RBW_CCP NNP,krimen na naitala noong Hunyo,krimen na naitala noong Hunyo
000400,CC.* VB.* RB.* NN.* CC.*,CCP VBTS RBW_CCP NNP CCB,na naitala noong Hunyo ng,na naitala noong Hunyo ng
000401,VB.* RB.* NN.* CC.* NN.*,VBTS RBW_CCP NNP CCB NNC_CCP,naitala noong Hunyo ng taong,naitala noong Hunyo ng taong
000402,RB.* NN.* CC.* NN.* PR.*_PM.*,RBW_CCP NNP CCB NNC_CCP PRO_PMP,noong Hunyo ng taong ito.,noong Hunyo ng taong ito.
000429,VB.* RB.* DT.* NN.* CC.*,VBAF RBI DTC NNC CCB,Bumaba rin ang krimen ng,Bumaba rin ang krimen ng
000430,RB.* DT.* NN.* CC.* CD.*,RBI DTC NNC CCB CDB,rin ang krimen ng 46,rin ang krimen ng 46
000431,DT.* NN.* CC.* CD.* NN.*,DTC NNC CCB CDB NNC,ang krimen ng 46 porsiyento,ang krimen ng 46 porsiyento
000432,CC.* CD.* NN.* NN.* CC.*,CCB CDB NNC NNC CCT,ng 46 porsiyento kumpara sa,ng 46 porsiyento kumpara sa
000433,CD.* NN.* NN.* CC.* VB.*,CDB NNC NNC CCT VBTS_CCP,46 porsiyento kumpara sa naitalang,46 porsiyento kumpara sa naitalang
000434,NN.* NN.* CC.* VB.* CD.*,NNC NNC CCT VBTS_CCP CDB,porsiyento kumpara sa naitalang 905,porsiyento kumpara sa naitalang 905
000435,NN.* CC.* VB.* CD.* NN.*,NNC CCT VBTS_CCP CDB NNC,kumpara sa naitalang 905 kaso,kumpara sa naitalang 905 kaso
000436,CC.* VB.* CD.* NN.* RB.*,CCT VBTS_CCP CDB NNC RBW_CCP,sa naitalang 905 kaso noong,sa naitalang 905 kaso noong
000437,VB.* CD.* NN.* RB.* NN.*,VBTS_CCP CDB NNC RBW_CCP NNP,naitalang 905 kaso noong Hulyo,naitalang 905 kaso noong Hulyo
000438,CD.* NN.* RB.* NN.* CD.*_PM.*,CDB NNC RBW_CCP NNP CDB_PMC,"905 kaso noong Hulyo 2015,",905 kaso noong Hulyo 2015
000463,LM CC.* RB.* RB.* CC.*,LM CCR RBI RBI CCT,ay dahil na rin sa,ay dahil na rin sa
000464,CC.* RB.* RB.* CC.* NN.*,CCR RBI RBI CCT NNC,dahil na rin sa pina-igting,dahil na rin sa pina-igting
000465,RB.* RB.* CC.* NN.* PM.*,RBI RBI CCT NNC PMS,na rin sa pina-igting na,na rin sa pina-igting na
000466,RB.* CC.* NN.* PM.* FW,RBI CCT NNC PMS FW,rin sa pina-igting na kampanya,rin sa pina-igting na kampanya
000467,CC.* NN.* PM.* FW CC.*,CCT NNC PMS FW CCP,sa pina-igting na kampanya laban,sa pina-igting na kampanya laban
000468,NN.* PM.* FW CC.* NN.*,NNC PMS FW CCP NNC,pina-igting na kampanya laban sa,pina-igting na kampanya laban sa
000469,PM.* FW CC.* NN.* NN.*,PMS FW CCP NNC NNC,"na kampanya laban sa kriminalidad,",na kampanya laban sa kriminalidad
000489,VB.* CC.* CD.* NN.* CC.*,VBAF CCT CDB NNC CCB,Umabot sa 31 kaso ng,Umabot sa 31 kaso ng
000490,CC.* CD.* NN.* CC.* NN.*,CCT CDB NNC CCB NNC,sa 31 kaso ng pagpatay,sa 31 kaso ng pagpatay
000491,CD.* NN.* CC.* NN.* DT.*,CDB NNC CCB NNC DTC,31 kaso ng pagpatay ang,31 kaso ng pagpatay ang
000492,NN.* CC.* NN.* DT.* VB.*,NNC CCB NNC DTC VBTS,kaso ng pagpatay ang naitala,kaso ng pagpatay ang naitala
000493,CC.* NN.* DT.* VB.* PR.*,CCB NNC DTC VBTS PRO_CCP,ng pagpatay ang naitala nitong,ng pagpatay ang naitala nitong
000494,NN.* DT.* VB.* PR.* NN.*_PM.*,NNC DTC VBTS PRO_CCP NNP_PMC,"pagpatay ang naitala nitong Hulyo,",pagpatay ang naitala nitong Hulyo
000510,VB.* CC.* CD.* CC.* NN.*,VBAF CCT CDB CCP NNC,kumpara sa 14 na insidente,kumpara sa 14 na insidente
000511,CC.* CD.* CC.* NN.* RB.*,CCT CDB CCP NNC RBW_CCP,sa 14 na insidente noong,sa 14 na insidente noong
000512,CD.* CC.* NN.* RB.* NN.*_PM.*,CDB CCP NNC RBW_CCP NNP_PMP,14 na insidente noong Hunyo.,14 na insidente noong Hunyo.
000520,VB.* PR.* CC.* JJ.* CC.*,VBTS PRP CCB JJD CCT,Natapos kayo ng matagumpay sa,Natapos kayo ng matagumpay sa
000521,PR.* CC.* JJ.* CC.* NN.*_PM.*,PRP CCB JJD CCT NNP_PMC,"kayo ng matagumpay sa Fukuoka,",kayo ng matagumpay sa Fukuoka
000534,JJ.* NN.* PR.* VB.* CC.*,JJN_CCP NNC PRP_CCP VBTS CCT,unang beses kaming nakapunta sa,unang beses kaming nakapunta sa
000535,NN.* PR.* VB.* CC.* PR.*,NNC PRP_CCP VBTS CCT PRI_CCP,beses kaming nakapunta sa ibang,beses kaming nakapunta sa ibang
000536,PR.* VB.* CC.* PR.* DT.*,PRP_CCP VBTS CCT PRI_CCP DTCP,kaming nakapunta sa ibang mga,kaming nakapunta sa ibang mga
000537,VB.* CC.* PR.* DT.* NN.*_PM.*,VBTS CCT PRI_CCP DTCP NNC_PMC,"nakapunta sa ibang mga lugar,",nakapunta sa ibang mga lugar
000547,DT.* PR.* NN.* LM JJ.*_PM.*,DTC PRI NNC LM JJCS_JJD_PMC,"ang bawat fan ay napakahalaga,",ang bawat fan ay napakahalaga
000552,VB.* PR.* DT.* NN.* CC.*,VBTS PRS DTC NNC CCB,naramdaman ko ang kalakihan ng,naramdaman ko ang kalakihan ng
000553,PR.* DT.* NN.* CC.* NN.*,PRS DTC NNC CCB NNC,ko ang kalakihan ng responsibilidad,ko ang kalakihan ng responsibilidad
000554,DT.* NN.* CC.* NN.* PR.*_PM.*,DTC NNC CCB NNC PRP_PMP,ang kalakihan ng responsibilidad namin.,ang kalakihan ng responsibilidad namin.
000566,VB.* PR.* VB.* DT.* NN.*,VBTS PRP_CCP VBW DTC NNC,Nagawa naming maranasan ang kultura,Nagawa naming maranasan ang kultura
000567,PR.* VB.* DT.* NN.* CC.*,PRP_CCP VBW DTC NNC CCB,naming maranasan ang kultura ng,naming maranasan ang kultura ng
000568,VB.* DT.* NN.* CC.* DT.*,VBW DTC NNC CCB DTCP,maranasan ang kultura ng mga,maranasan ang kultura ng mga
000569,DT.* NN.* CC.* DT.* NN.*_PM.*,DTC NNC CCB DTCP NNP_PMC,"ang kultura ng mga Hapon,",ang kultura ng mga Hapon
000580,CC.* VB.* PR.* RB.* RB.*,CCR VBTF PRP RBK RBQ,Kung sasabihin namin kung bakit,Kung sasabihin namin kung bakit
000581,VB.* PR.* RB.* RB.* PR.*,VBTF PRP RBK RBQ PRP,sasabihin namin kung bakit namin,sasabihin namin kung bakit namin
000582,PR.* RB.* RB.* PR.* VB.*,PRP RBK RBQ PRP VBTS,namin kung bakit namin naalala,namin kung bakit namin naalala
000583,RB.* RB.* PR.* VB.* PR.*_PM.*,RBK RBQ PRP VBTS PRO_PMC,"kung bakit namin naalala iyon,",kung bakit namin naalala iyon
000591,RB.* RB.* RB.* PR.* VB.*_PM.*,RBF RBI RBI PRS VBW_PMC,"hindi pa rin ako makapaniwala,",hindi pa rin ako makapaniwala
000600,VB.* PR.* RB.* RB.* DT.*,VBTR PRP RBK RBQ DTC,nakakalimutan namin kung ano ang,nakakalimutan namin kung ano ang
000601,PR.* RB.* RB.* DT.* VB.*,PRP RBK RBQ DTC VBTR,namin kung ano ang natutunan,namin kung ano ang natutunan
000602,RB.* RB.* DT.* VB.* PR.*_PM.*,RBK RBQ DTC VBTR PRP_PMP,kung ano ang natutunan namin.,kung ano ang natutunan namin.
000613,CC.* CC.* VB.* CC.* JJ.*,CCT CCP VBW CCB JJD_CCP,Imbis na matuto ng bagong,Imbis na matuto ng bagong
000614,CC.* VB.* CC.* JJ.* DT.*,CCP VBW CCB JJD_CCP DTCP,na matuto ng bagong mga,na matuto ng bagong mga
000615,VB.* CC.* JJ.* DT.* NN.*_PM.*,VBW CCB JJD_CCP DTCP NNC_PMC,"matuto ng bagong mga salita,",matuto ng bagong mga salita
000639,CC.* PR.* DT.* CD.* NN.*,CCT PRQ DTC CDB NNC_CCP,pero ano ang una ninyong,pero ano ang una ninyong
000640,PR.* DT.* CD.* NN.* VB.*,PRQ DTC CDB NNC_CCP VBTS,ano ang una ninyong inisip,ano ang una ninyong inisip
000641,DT.* CD.* NN.* VB.* RB.*,DTC CDB NNC_CCP VBTS RBW_CCP,ang una ninyong inisip noong,ang una ninyong inisip noong
000642,CD.* NN.* VB.* RB.* JJ.*,CDB NNC_CCP VBTS RBW_CCP JJN_CCP,una ninyong inisip noong unang,una ninyong inisip noong unang
000643,NN.* VB.* RB.* JJ.* NN.*,NNC_CCP VBTS RBW_CCP JJN_CCP NNC,ninyong inisip noong unang beses,ninyong inisip noong unang beses
000644,VB.* RB.* JJ.* NN.* PR.*,VBTS RBW_CCP JJN_CCP NNC PRP,inisip noong unang beses niyo,inisip noong unang beses niyo
000645,RB.* JJ.* NN.* PR.* VB.*,RBW_CCP JJN_CCP NNC PRP VBTS,noong unang beses niyo narinig,noong unang beses niyo narinig
000646,JJ.* NN.* PR.* VB.* DT.*,JJN_CCP NNC PRP VBTS DTC,unang beses niyo narinig ang,unang beses niyo narinig ang
000647,NN.* PR.* VB.* DT.* NN.*,NNC PRP VBTS DTC NNC_CCP,beses niyo narinig ang kantang,beses niyo narinig ang kantang
000648,PR.* VB.* DT.* NN.* PR.*_PM.*,PRP VBTS DTC NNC_CCP PRO_PMQ,niyo narinig ang kantang ito?,niyo narinig ang kantang ito?
000671,RB.* CD.* PR.* VB.* PR.*_PM.*,RBW_CCP CDB PRS_CCP VBTS PRO_PMC,"Noong una kong napakinggan ito,",Noong una kong napakinggan ito
000678,CC.* NN.* PR.* JJ.* CC.*,CCT NNC PRS JJD CCB,Sa tingin ko perpekto ng,Sa tingin ko perpekto ng
000679,NN.* PR.* JJ.* CC.* NN.*,NNC PRS JJD CCB NNC,tingin ko perpekto ng kanta,tingin ko perpekto ng kanta
000680,PR.* JJ.* CC.* NN.* PR.*,PRS JJD CCB NNC PRO,ko perpekto ng kanta iyon,ko perpekto ng kanta iyon
000681,JJ.* CC.* NN.* PR.* CC.*,JJD CCB NNC PRO CCT,perpekto ng kanta iyon para,perpekto ng kanta iyon para
000682,CC.* NN.* PR.* CC.* CC.*,CCB NNC PRO CCT CCT,ng kanta iyon para sa,ng kanta iyon para sa
000683,NN.* PR.* CC.* CC.* PR.*_PM.*,NNC PRO CCT CCT PRSP_PMP,kanta iyon para sa amin.,kanta iyon para sa amin.
000698,CC.* RB.* RB.* CC.* VB.*_PM.*,CCA RBI RBI CCR VBTR_VBAF_PMC,"pati na rin kapag kumakanta,",pati na rin kapag kumakanta
000704,PR.* DT.* NN.* DT.* JJ.*,PRI_CCP DTCP NNC DTC JJCC,Maraming mga bahagi ang mas,Maraming mga bahagi ang mas
000705,DT.* NN.* DT.* JJ.* VB.*_PM.*,DTCP NNC DTC JJCC VBAF_PMP,mga bahagi ang mas gumanda.,mga bahagi ang mas gumanda.
000714,PR.* DT.* NN.* CC.* NN.*,PRQ DTC NNC CCT NNC,Ano ang pakiramdam sa pagkanta,Ano ang pakiramdam sa pagkanta
000715,DT.* NN.* CC.* NN.* RB.*,DTC NNC CCT NNC RBW,ang pakiramdam sa pagkanta ulit,ang pakiramdam sa pagkanta ulit
000716,NN.* CC.* NN.* RB.* CC.*,NNC CCT NNC RBW CCB,pakiramdam sa pagkanta ulit ng,pakiramdam sa pagkanta ulit ng
000717,CC.* NN.* RB.* CC.* NN.*,CCT NNC RBW CCB NNC_CCP,sa pagkanta ulit ng kantang,sa pagkanta ulit ng kantang
000718,NN.* RB.* CC.* NN.* PR.*_PM.*,NNC RBW CCB NNC_CCP PRO_PMQ,pagkanta ulit ng kantang ito?,pagkanta ulit ng kantang ito?
000733,CC.* PR.* PR.* NN.* CC.*,CCR PRI PRO_CCP NNC CCP,kaya isa itong kanta na,kaya isa itong kanta na
000734,PR.* PR.* NN.* CC.* JJ.*,PRI PRO_CCP NNC CCP JJD,isa itong kanta na pamilyar,isa itong kanta na pamilyar
000735,PR.* NN.* CC.* JJ.* CC.*,PRO_CCP NNC CCP JJD CCP,itong kanta na pamilyar na,itong kanta na pamilyar na
000736,NN.* CC.* JJ.* CC.* PR.*_PM.*,NNC CCP JJD CCP PRP_PMC,"kanta na pamilyar na kami,",kanta na pamilyar na kami
000751,CC.* VB.* PR.* DT.* NN.*,CCT VBW PRP DTC NNC,para mapanatili namin ang pakiramdam,para mapanatili namin ang pakiramdam
000752,VB.* PR.* DT.* NN.* RB.*,VBW PRP DTC NNC RBW,mapanatili namin ang pakiramdam nung,mapanatili namin ang pakiramdam nung
000753,PR.* DT.* NN.* RB.* JJ.*,PRP DTC NNC RBW JJD,namin ang pakiramdam nung orihinal,namin ang pakiramdam nung orihinal
000754,DT.* NN.* RB.* JJ.* CC.*,DTC NNC RBW JJD CCP,ang pakiramdam nung orihinal na,ang pakiramdam nung orihinal na
000755,NN.* RB.* JJ.* CC.* NN.*_PM.*,NNC RBW JJD CCP NNC_PMC,"pakiramdam nung orihinal na bersyon,",pakiramdam nung orihinal na bersyon
000772,VB.* DT.* PR.* NN.* DT.*,VBH_CCP DTCP PRI_CCP NNC DTC,mayroong mga ibang bahagi ang,mayroong mga ibang bahagi ang
000773,DT.* PR.* NN.* DT.* VB.*,DTCP PRI_CCP NNC DTC VBS,mga ibang bahagi ang dapat,mga ibang bahagi ang dapat
000774,PR.* NN.* DT.* VB.* CC.*,PRI_CCP NNC DTC VBS CCP,ibang bahagi ang dapat na,ibang bahagi ang dapat na
000775,NN.* DT.* VB.* CC.* VB.*_PM.*,NNC DTC VBS CCP VBW_PMP,bahagi ang dapat na mapalitan.,bahagi ang dapat na mapalitan.
000789,RB.* PR.* JJ.* CC.* VB.*,RBF PRS JJD CCP VBOF,hindi ako sanay na sabihin,hindi ako sanay na sabihin
000790,PR.* JJ.* CC.* VB.* DT.*,PRS JJD CCP VBOF DTC,ako sanay na sabihin ang,ako sanay na sabihin ang
000791,JJ.* CC.* VB.* DT.* PR.*,JJD CCP VBOF DTC PRI,sanay na sabihin ang karamihan,sanay na sabihin ang karamihan
000792,CC.* VB.* DT.* PR.* CC.*,CCP VBOF DTC PRI CCT,na sabihin ang karamihan sa,na sabihin ang karamihan sa
000793,VB.* DT.* PR.* CC.* DT.*,VBOF DTC PRI CCT DTCP,sabihin ang karamihan sa mga,sabihin ang karamihan sa mga
000794,DT.* PR.* CC.* DT.* NN.*_PM.*,DTC PRI CCT DTCP NNC_PMP,ang karamihan sa mga salita.,ang karamihan sa mga salita.
000806,RB.* RB.* CC.* RB.* JJ.*,RBF RBI CCT RBF JJD,Hindi naman sa hindi mahirap,Hindi naman sa hindi mahirap
000807,RB.* CC.* RB.* JJ.* NN.*,RBI CCT RBF JJD NNPA,naman sa hindi mahirap (tumawa).,naman sa hindi mahirap (tumawa).
000822,VB.* DT.* NN.* CC.* CC.*,VBH_CCP DTCP NNC CCP CCR,Mayroong mga salita na kapag,Mayroong mga salita na kapag
000823,DT.* NN.* CC.* CC.* VB.*,DTCP NNC CCP CCR VBTS,mga salita na kapag namali,mga salita na kapag namali
000824,NN.* CC.* CC.* VB.* PR.*,NNC CCP CCR VBTS PRS,salita na kapag namali ka,salita na kapag namali ka
000825,CC.* CC.* VB.* PR.* CC.*,CCP CCR VBTS PRS CCB,na kapag namali ka ng,na kapag namali ka ng
000826,CC.* VB.* PR.* CC.* NN.*,CCR VBTS PRS CCB NNC,kapag namali ka ng pagsabi,kapag namali ka ng pagsabi
000827,VB.* PR.* CC.* NN.* LM,VBTS PRS CCB NNC LM,namali ka ng pagsabi ay,namali ka ng pagsabi ay
000828,PR.* CC.* NN.* LM VB.*,PRS CCB NNC LM VBW,ka ng pagsabi ay maiiba,ka ng pagsabi ay maiiba
000829,CC.* NN.* LM VB.* DT.*,CCB NNC LM VBW DTC,ng pagsabi ay maiiba ung,ng pagsabi ay maiiba ung
000830,NN.* LM VB.* DT.* VB.*,NNC LM VBW DTC VBS,pagsabi ay maiiba ung ibig,pagsabi ay maiiba ung ibig
000831,LM VB.* DT.* VB.* VB.*_PM.*,LM VBW DTC VBS VBOF_PMC,"ay maiiba ung ibig sabihin,",ay maiiba ung ibig sabihin
000857,NN.* PR.* PR.* RB.* VB.*,NNC PRS_CCP PRI RBW VBW,Mukha siyang iba nang magsuot,Mukha siyang iba nang magsuot
000858,PR.* PR.* RB.* VB.* PR.*,PRS_CCP PRI RBW VBW PRS,siyang iba nang magsuot siya,siyang iba nang magsuot siya
000859,PR.* RB.* VB.* PR.* CC.*,PRI RBW VBW PRS CCB,iba nang magsuot siya ng,iba nang magsuot siya ng
000860,RB.* VB.* PR.* CC.* NN.*_PM.*,RBW VBW PRS CCB NNC_PMC,"nang magsuot siya ng salamin,",nang magsuot siya ng salamin
000873,VB.* PR.* RB.* JJ.* NN.*,VBS PRS RBI JJD_CCP NNC,akala ko nga bagong miyembro,akala ko nga bagong miyembro
000874,PR.* RB.* JJ.* NN.* PR.*,PRS RBI JJD_CCP NNC PRS,ko nga bagong miyembro siya,ko nga bagong miyembro siya
000875,RB.* JJ.* NN.* PR.* NN.*,RBI JJD_CCP NNC PRS NNPA,nga bagong miyembro siya (tumawa).,nga bagong miyembro siya (tumawa).
000883,RB.* PR.* JJ.* CC.* NN.*,RBF PRP JJD CCP NNC,Hindi namin orihinal na intensyon,Hindi namin orihinal na intensyon
000884,PR.* JJ.* CC.* NN.* CC.*,PRP JJD CCP NNC CCP,namin orihinal na intensyon na,namin orihinal na intensyon na
000885,JJ.* CC.* NN.* CC.* VB.*,JJD CCP NNC CCP VBOF,orihinal na intensyon na gawin,orihinal na intensyon na gawin
000886,CC.* NN.* CC.* VB.* PR.*_PM.*,CCP NNC CCP VBOF PRO_PMC,"na intensyon na gawin iyon,",na intensyon na gawin iyon
000900,VB.* RB.* CC.* DT.* NN.*,VBS RBI CCB DTCP NNC,Sabi rin ng mga miyembro,Sabi rin ng mga miyembro
000901,RB.* CC.* DT.* NN.* CC.*_PM.*,RBI CCB DTCP NNC CCP_PMS,rin ng mga miyembro na,rin ng mga miyembro na
000902,CC.* DT.* NN.* CC.*_PM.* JJ.*,CCB DTCP NNC CCP_PMS JJD,ng mga miyembro na Maganda,ng mga miyembro na Maganda
000903,DT.* NN.* CC.*_PM.* JJ.* RB.*_PM.*,DTCP NNC CCP_PMS JJD RBI_PMC,mga miyembro na Maganda naman,mga miyembro na Maganda naman
000920,CC.* NN.* PR.* PR.* PR.*,CCT NNC PRS PRI PRP_CCP,sa tingin ko marami kaming,sa tingin ko marami kaming
000921,NN.* PR.* PR.* PR.* VB.*,NNC PRS PRI PRP_CCP VBTS_CCP,tingin ko marami kaming ipinakitang,tingin ko marami kaming ipinakitang
000922,PR.* PR.* PR.* VB.* NN.*_PM.*,PRS PRI PRP_CCP VBTS_CCP NNC_PMP,ko marami kaming ipinakitang mukha.,ko marami kaming ipinakitang mukha.
