N-Gram_ID,RoughPOS_N-Gram,DetailedPOS_N-Gram,N-Gram,Lemma_N-Gram
001879,DT.* DT.* NN.* LM RB.*,DTC DTCP NNC LM RBM,ang mga lalaki ay maaaring,ang mga lalaki ay maaaring
001880,DT.* NN.* LM RB.* VB.*,DTCP NNC LM RBM VBAF,mga lalaki ay maaaring lumahok,mga lalaki ay maaaring lumahok
001881,NN.* LM RB.* VB.* CC.*,NNC LM RBM VBAF CCT,lalaki ay maaaring lumahok sa,lalaki ay maaaring lumahok sa
001882,LM RB.* VB.* CC.* DT.*,LM RBM VBAF CCT DTCP,ay maaaring lumahok sa mga,ay maaaring lumahok sa mga
001883,RB.* VB.* CC.* DT.* NN.*_PM.*,RBM VBAF CCT DTCP NNC_PMC,"maaaring lumahok sa mga karera,",maaaring lumahok sa mga karera
001895,CC.* DT.* CC.* PM.* CC.*,CCT DTC CCR PMS CCP,"ngunit ang pag-na tumutulo bag,",ngunit ang pag-na tumutulo bag
001905,RB.* PR.* LM VB.* CC.*,RBW PRS LM VBH CCT,Ngayon siya ay may sa,Ngayon siya ay may sa
001906,PR.* LM VB.* CC.* VB.*,PRS LM VBH CCT VBW,siya ay may sa magmadali,siya ay may sa magmadali
001907,LM VB.* CC.* VB.* JJ.*,LM VBH CCT VBW JJD,ay may sa magmadali pabalik,ay may sa magmadali pabalik
001908,VB.* CC.* VB.* JJ.* CC.*,VBH CCT VBW JJD CCB,may sa magmadali pabalik upang,may sa magmadali pabalik upang
001909,CC.* VB.* JJ.* CC.* VB.*,CCT VBW JJD CCB VBW,sa magmadali pabalik upang mangolekta,sa magmadali pabalik upang mangolekta
001910,VB.* JJ.* CC.* VB.* DT.*,VBW JJD CCB VBW DTC,magmadali pabalik upang mangolekta ang,magmadali pabalik upang mangolekta ang
001911,JJ.* CC.* VB.* DT.* DT.*,JJD CCB VBW DTC DTCP,pabalik upang mangolekta ang mga,pabalik upang mangolekta ang mga
001912,CC.* VB.* DT.* DT.* PR.*_PM.*,CCB VBW DTC DTCP PRO_PMC,"upang mangolekta ang mga ito,",upang mangolekta ang mga ito
001932,RB.* CC.* RB.* CC.* VB.*,RBF CCT RBW CCB VBOB,hindi sa huli upang ipagkaloob,hindi sa huli upang ipagkaloob
001933,CC.* RB.* CC.* VB.* DT.*,CCT RBW CCB VBOB DTC,sa huli upang ipagkaloob ang,sa huli upang ipagkaloob ang
001934,RB.* CC.* VB.* DT.* PR.*,RBW CCB VBOB DTC PRI,huli upang ipagkaloob ang lahat,huli upang ipagkaloob ang lahat
001935,CC.* VB.* DT.* PR.* CC.*,CCB VBOB DTC PRI CCB,upang ipagkaloob ang lahat ng,upang ipagkaloob ang lahat ng
001936,VB.* DT.* PR.* CC.* DT.*,VBOB DTC PRI CCB DTCP,ipagkaloob ang lahat ng mga,ipagkaloob ang lahat ng mga
001937,DT.* PR.* CC.* DT.* DT.*,DTC PRI CCB DTCP DTCP,ang lahat ng mga mga,ang lahat ng mga mga
001952,CC.* CC.* DT.* PR.* NN.*,CCB CCB DTCP PRO NNC,kasama ng mga ito lahi,kasama ng mga ito lahi
001953,CC.* DT.* PR.* NN.* LM,CCB DTCP PRO NNC LM,ng mga ito lahi ay,ng mga ito lahi ay
001954,DT.* PR.* NN.* LM RB.*,DTCP PRO NNC LM RBF,mga ito lahi ay hindi,mga ito lahi ay hindi
001955,PR.* NN.* LM RB.* JJ.*,PRO NNC LM RBF JJD_CCP,ito lahi ay hindi huling,ito lahi ay hindi huling
001968,CC.* RB.* RB.* LM VB.*,CCP RBK RBQ LM VBTR,na kung saan ay kinakailangan,na kung saan ay kinakailangan
001969,RB.* RB.* LM VB.* CC.*,RBK RBQ LM VBTR CCB,kung saan ay kinakailangan upang,kung saan ay kinakailangan upang
001970,RB.* LM VB.* CC.* VB.*,RBQ LM VBTR CCB VBW,saan ay kinakailangan upang maiwasan,saan ay kinakailangan upang maiwasan
001971,LM VB.* CC.* VB.* DT.*,LM VBTR CCB VBW DTC,ay kinakailangan upang maiwasan ang,ay kinakailangan upang maiwasan ang
001972,VB.* CC.* VB.* DT.* PR.*,VBTR CCB VBW DTC PRI_CCP,kinakailangan upang maiwasan ang isang,kinakailangan upang maiwasan ang isang
001986,JJ.* PR.* DT.* NN.* CC.*,JJCS_CCP PRI_CCP DTCP NNC CCB,masyadong maraming mga pagkakataon upang,masyadong maraming mga pagkakataon upang
001987,PR.* DT.* NN.* CC.* NN.*,PRI_CCP DTCP NNC CCB NNCA,maraming mga pagkakataon upang i-play,maraming mga pagkakataon upang i-play
001988,DT.* NN.* CC.* NN.* PM.*,DTCP NNC CCB NNCA PMS,mga pagkakataon upang i-play sa,mga pagkakataon upang i-play sa
001999,NN.* PR.* PM.* PR.* CC.*,NNCA PRI PMS PRI CCB,iba - lahat ng ito,iba - lahat ng ito
002000,PR.* PM.* PR.* CC.* PR.*,PRI PMS PRI CCB PRO,- lahat ng ito ay,- lahat ng ito ay
002001,PM.* PR.* CC.* PR.* LM,PMS PRI CCB PRO LM,lahat ng ito ay maaaring,lahat ng ito ay maaaring
002002,PR.* CC.* PR.* LM RB.*,PRI CCB PRO LM RBM,ng ito ay maaaring na,ng ito ay maaaring na
002003,CC.* PR.* LM RB.* CC.*,CCB PRO LM RBM CCP,ito ay maaaring na rin,ito ay maaaring na rin
002004,PR.* LM RB.* CC.* RB.*,PRO LM RBM CCP RBI,ay maaaring na rin ay,ay maaaring na rin ay
002005,LM RB.* CC.* RB.* LM,LM RBM CCP RBI LM,maaaring na rin ay ang,maaaring na rin ay ang
002006,RB.* CC.* RB.* LM DT.*,RBM CCP RBI LM DTC,na rin ay ang karera,na rin ay ang karera
002041,VB.* DT.* PR.* NN.* CC.*,VBOF DTC PRI_CCP NNC CCT,Ayusin ang isang lahi sa,Ayusin ang isang lahi sa
002042,DT.* PR.* NN.* CC.* NN.*,DTC PRI_CCP NNC CCT NNC,ang isang lahi sa pagitan,ang isang lahi sa pagitan
002043,PR.* NN.* CC.* NN.* CC.*,PRI_CCP NNC CCT NNC CCB,isang lahi sa pagitan ng,isang lahi sa pagitan ng
002044,NN.* CC.* NN.* CC.* DT.*,NNC CCT NNC CCB DTCP,lahi sa pagitan ng mga,lahi sa pagitan ng mga
002045,CC.* NN.* CC.* DT.* PR.*,CCT NNC CCB DTCP PRO,sa pagitan ng mga ito,sa pagitan ng mga ito
002046,NN.* CC.* DT.* PR.* PM.*,NNC CCB DTCP PRO PMS,pagitan ng mga ito -,pagitan ng mga ito -
002047,CC.* DT.* PR.* PM.* CC.*,CCB DTCP PRO PMS CCP,ng mga ito - na,ng mga ito - na
002048,DT.* PR.* PM.* CC.* RB.*,DTCP PRO PMS CCP RBK,mga ito - na kung,mga ito - na kung
002049,PR.* PM.* CC.* RB.* RB.*,PRO PMS CCP RBK RBQ,ito - na kung saan,ito - na kung saan
002050,PM.* CC.* RB.* RB.* DT.*,PMS CCP RBK RBQ DTC,- na kung saan ang,- na kung saan ang
002051,CC.* RB.* RB.* DT.* VB.*,CCP RBK RBQ DTC VBS,na kung saan ang kailangan,na kung saan ang kailangan
002052,RB.* RB.* DT.* VB.* NN.*,RBK RBQ DTC VBS NNC,kung saan ang kailangan ugat,kung saan ang kailangan ugat
002053,RB.* DT.* VB.* NN.* CC.*,RBQ DTC VBS NNC CCB,saan ang kailangan ugat ng,saan ang kailangan ugat ng
002083,VB.* PR.* VB.* DT.* CC.*,VBS PRS_CCP VBOF DTC CCB,Maaari mong patakbuhin ang ng,Maaari mong patakbuhin ang ng
002084,PR.* VB.* DT.* CC.* NN.*_PM.*,PRS_CCP VBOF DTC CCB NNC_PMC,"mong patakbuhin ang ng taxi,",mong patakbuhin ang ng taxi
002089,VB.* CC.* DT.* NN.* CC.*,VBTR CCT DTCP NNC CCB,naglalakbay sa mga lansangan ng,naglalakbay sa mga lansangan ng
002090,CC.* DT.* NN.* CC.* NN.*_PM.*,CCT DTCP NNC CCB NNC_PMC,"sa mga lansangan ng siyudad,",sa mga lansangan ng siyudad
002096,DT.* JJ.* CC.* NN.* PR.*_PM.*,DTC JJD CCP NNC PRI_CCP_PMC,"ang tunay na layunin ibang,",ang tunay na layunin ibang
002103,CC.* DT.* NN.* LM VB.*,CCT DTC NNC LM VBTR,ngunit ang proseso ay nangangailangan,ngunit ang proseso ay nangangailangan
002104,DT.* NN.* LM VB.* CC.*,DTC NNC LM VBTR CCB,ang proseso ay nangangailangan ng,ang proseso ay nangangailangan ng
002105,NN.* LM VB.* CC.* NN.*,NNC LM VBTR CCB NNC,proseso ay nangangailangan ng kasanayan,proseso ay nangangailangan ng kasanayan
002106,LM VB.* CC.* NN.* JJ.*,LM VBTR CCB NNC JJD,ay nangangailangan ng kasanayan mataas,ay nangangailangan ng kasanayan mataas
002107,VB.* CC.* NN.* JJ.* CC.*,VBTR CCB NNC JJD CCP,nangangailangan ng kasanayan mataas na,nangangailangan ng kasanayan mataas na
002117,PR.* RB.* RB.* DT.* VB.*,PRS RBI RBI DTC VBTR,Siya lang naman ang hinihintay,Siya lang naman ang hinihintay
002118,RB.* RB.* DT.* VB.* PR.*_PM.*,RBI RBI DTC VBTR PRS_PMC,"lang naman ang hinihintay ko,",lang naman ang hinihintay ko
002124,VB.* VB.* PR.* CC.* VB.*,VBS_CCP VBS PRS CCP VBAF,gustong gusto ko na bumisita,gustong gusto ko na bumisita
002125,VB.* PR.* CC.* VB.* CC.*,VBS PRS CCP VBAF CCT,gusto ko na bumisita sa,gusto ko na bumisita sa
002126,PR.* CC.* VB.* CC.* NN.*_PM.*,PRS CCP VBAF CCT NNP_PMC,"ko na bumisita sa Japan,",ko na bumisita sa Japan
002135,NN.* VB.* CC.* NN.* CC.*,NNP VBOF CCB NNC CCT,Lalaki tinubuuan ng talbos sa,Lalaki tinubuuan ng talbos sa
002136,VB.* CC.* NN.* CC.* NN.*,VBOF CCB NNC CCT NNC,tinubuuan ng talbos sa ngipin,tinubuuan ng talbos sa ngipin
002137,CC.* NN.* CC.* NN.* CC.*,CCB NNC CCT NNC CCR,ng talbos sa ngipin dahil,ng talbos sa ngipin dahil
002138,NN.* CC.* NN.* CC.* RB.*,NNC CCT NNC CCR RBF,talbos sa ngipin dahil hindi,talbos sa ngipin dahil hindi
002139,CC.* NN.* CC.* RB.* VB.*,CCT NNC CCR RBF VBTS,sa ngipin dahil hindi nag,sa ngipin dahil hindi nag
002140,NN.* CC.* RB.* VB.* NN.*,NNC CCR RBF VBTS NNC,ngipin dahil hindi nag sisipilyo,ngipin dahil hindi nag sisipilyo
002170,VB.* RB.* CC.* PR.* RB.*,VBS RBI CCB PRI RBK,Alam naman ng marami kung,Alam naman ng marami kung
002171,RB.* CC.* PR.* RB.* RB.*,RBI CCB PRI RBK RBQ,naman ng marami kung gaano,naman ng marami kung gaano
002172,CC.* PR.* RB.* RB.* NN.*,CCB PRI RBK RBQ NNC_CCP,ng marami kung gaano kagaling,ng marami kung gaano kagaling
002173,PR.* RB.* RB.* NN.* DT.*,PRI RBK RBQ NNC_CCP DTP,marami kung gaano kagaling si,marami kung gaano kagaling si
002174,RB.* RB.* NN.* DT.* NN.*,RBK RBQ NNC_CCP DTP NNP,kung gaano kagaling si Coco,kung gaano kagaling si Coco
002175,RB.* NN.* DT.* NN.* NN.*,RBQ NNC_CCP DTP NNP NNP,gaano kagaling si Coco Martin,gaano kagaling si Coco Martin
002176,NN.* DT.* NN.* NN.* VB.*,NNC_CCP DTP NNP NNP VBW,kagaling si Coco Martin pagdating,kagaling si Coco Martin pagdating
002177,DT.* NN.* NN.* VB.* CC.*,DTP NNP NNP VBW CCT,si Coco Martin pagdating sa,si Coco Martin pagdating sa
002178,NN.* NN.* VB.* CC.* CC.*,NNP NNP VBW CCT CCR,Coco Martin pagdating sa pag-arte,Coco Martin pagdating sa pag-arte
002179,NN.* VB.* CC.* CC.* PM.*,NNP VBW CCT CCR PMS,Martin pagdating sa pag-arte kahit,Martin pagdating sa pag-arte kahit
002180,VB.* CC.* CC.* PM.* NN.*,VBW CCT CCR PMS NNC,pagdating sa pag-arte kahit na,pagdating sa pag-arte kahit na
002181,CC.* CC.* PM.* NN.* CC.*,CCT CCR PMS NNC CCT,sa pag-arte kahit na noon,sa pag-arte kahit na noon
002182,CC.* PM.* NN.* CC.* CC.*,CCR PMS NNC CCT CCP,pag-arte kahit na noon pa,pag-arte kahit na noon pa
002183,PM.* NN.* CC.* CC.* RB.*,PMS NNC CCT CCP RBW,kahit na noon pa man,kahit na noon pa man
002184,NN.* CC.* CC.* RB.* RB.*,NNC CCT CCP RBW RBI,na noon pa man na,na noon pa man na
002185,CC.* CC.* RB.* RB.* RB.*,CCT CCP RBW RBI RBI,noon pa man na nagsisimula,noon pa man na nagsisimula
002186,RB.* RB.* RB.* CC.* VB.*,RBW RBI RBI CCP VBTR,man na nagsisimula ito ay,man na nagsisimula ito ay
002187,RB.* RB.* CC.* VB.* PR.*,RBI RBI CCP VBTR PRO,na nagsisimula ito ay nakitaan,na nagsisimula ito ay nakitaan
002188,RB.* CC.* VB.* PR.* LM,RBI CCP VBTR PRO LM,nagsisimula ito ay nakitaan na,nagsisimula ito ay nakitaan na
002235,RB.* CC.* DT.* NN.* CC.*,RBR CCT DTCP NNP CCB,Tungkol sa mga Larawan ng,Tungkol sa mga Larawan ng
002236,CC.* DT.* NN.* CC.* DT.*,CCT DTCP NNP CCB DTCP,sa mga Larawan ng mga,sa mga Larawan ng mga
002237,DT.* NN.* CC.* DT.* NN.*,DTCP NNP CCB DTCP NNP_CCP,mga Larawan ng mga Lumang,mga Larawan ng mga Lumang
002238,NN.* CC.* DT.* NN.* NN.*_PM.*,NNP CCB DTCP NNP_CCP NNP_PMC,"Larawan ng mga Lumang Bulalakaw,",Larawan ng mga Lumang Bulalakaw
002267,CC.* NN.* PM.* NN.* LM,CCB NNC_CCP PMS NNC LM,Kuko halamang-singaw ay nakakaapekto direkta,Kuko halamang-singaw ay nakakaapekto direkta
002268,NN.* PM.* NN.* LM VB.*,NNC_CCP PMS NNC LM VBTR,halamang-singaw ay nakakaapekto direkta ang,halamang-singaw ay nakakaapekto direkta ang
002269,PM.* NN.* LM VB.* JJ.*,PMS NNC LM VBTR JJD,ay nakakaapekto direkta ang buong,ay nakakaapekto direkta ang buong
002270,NN.* LM VB.* JJ.* DT.*,NNC LM VBTR JJD DTC,nakakaapekto direkta ang buong kuko,nakakaapekto direkta ang buong kuko
002271,LM VB.* JJ.* DT.* PR.*,LM VBTR JJD DTC PRI_CCP,direkta ang buong kuko -,direkta ang buong kuko -
002272,VB.* JJ.* DT.* PR.* NN.*,VBTR JJD DTC PRI_CCP NNC,ang buong kuko - Kung,ang buong kuko - Kung
002273,JJ.* DT.* PR.* NN.* PM.*,JJD DTC PRI_CCP NNC PMS,buong kuko - Kung paano,buong kuko - Kung paano
002274,DT.* PR.* NN.* PM.* RB.*,DTC PRI_CCP NNC PMS RBK,kuko - Kung paano gamutin,kuko - Kung paano gamutin
002275,PR.* NN.* PM.* RB.* RB.*,PRI_CCP NNC PMS RBK RBQ,- Kung paano gamutin ang,- Kung paano gamutin ang
002276,NN.* PM.* RB.* RB.* VB.*,NNC PMS RBK RBQ VBOF,Kung paano gamutin ang isang,Kung paano gamutin ang isang
002277,PM.* RB.* RB.* VB.* DT.*,PMS RBK RBQ VBOF DTC,paano gamutin ang isang balat,paano gamutin ang isang balat
002278,RB.* RB.* VB.* DT.* PR.*,RBK RBQ VBOF DTC PRI_CCP,gamutin ang isang balat ng,gamutin ang isang balat ng
002279,RB.* VB.* DT.* PR.* NN.*,RBQ VBOF DTC PRI_CCP NNC,ang isang balat ng halamang-singaw,ang isang balat ng halamang-singaw
002318,VB.* CC.* NN.* RB.* CC.*,VBW CCB NNC RBL CCT,paggamot ng kuko mula sa,paggamot ng kuko mula sa
002319,CC.* NN.* RB.* CC.* NN.*,CCB NNC RBL CCT NNC,ng kuko mula sa pagbabalat,ng kuko mula sa pagbabalat
002320,NN.* RB.* CC.* NN.* RB.*,NNC RBL CCT NNC RBK,kuko mula sa pagbabalat kung,kuko mula sa pagbabalat kung
002321,RB.* CC.* NN.* RB.* RB.*,RBL CCT NNC RBK RBQ,mula sa pagbabalat kung paano,mula sa pagbabalat kung paano
002322,CC.* NN.* RB.* RB.* VB.*,CCT NNC RBK RBQ VBOF,sa pagbabalat kung paano ituring,sa pagbabalat kung paano ituring
002323,NN.* RB.* RB.* VB.* DT.*,NNC RBK RBQ VBOF DTC,pagbabalat kung paano ituring ang,pagbabalat kung paano ituring ang
002324,RB.* RB.* VB.* DT.* DT.*,RBK RBQ VBOF DTC DTCP,kung paano ituring ang mga,kung paano ituring ang mga
002325,RB.* VB.* DT.* DT.* NN.*,RBQ VBOF DTC DTCP NNC_CCP,paano ituring ang mga halamang-singaw,paano ituring ang mga halamang-singaw
002326,VB.* DT.* DT.* NN.* PM.*,VBOF DTC DTCP NNC_CCP PMS,ituring ang mga halamang-singaw sa,ituring ang mga halamang-singaw sa
002327,DT.* DT.* NN.* PM.* NN.*,DTC DTCP NNC_CCP PMS NNC,ang mga halamang-singaw sa mga,ang mga halamang-singaw sa mga
002328,DT.* NN.* PM.* NN.* CC.*,DTCP NNC_CCP PMS NNC CCT,mga halamang-singaw sa mga paa,mga halamang-singaw sa mga paa
002329,NN.* PM.* NN.* CC.* DT.*,NNC_CCP PMS NNC CCT DTCP,halamang-singaw sa mga paa ng,halamang-singaw sa mga paa ng
002330,PM.* NN.* CC.* DT.* NN.*,PMS NNC CCT DTCP NNC,sa mga paa ng mga,sa mga paa ng mga
002331,NN.* CC.* DT.* NN.* CC.*,NNC CCT DTCP NNC CCB,mga paa ng mga doktor,mga paa ng mga doktor
002332,CC.* DT.* NN.* CC.* DT.*,CCT DTCP NNC CCB DTCP,paa ng mga doktor ng,paa ng mga doktor ng
002378,RB.* RB.* CC.* NN.* DT.*,RBK RBQ CCT NNC DTC,kung paano sa singaw ang,kung paano sa singaw ang
002379,RB.* CC.* NN.* DT.* NN.*,RBQ CCT NNC DTC NNC,paano sa singaw ang kuko,paano sa singaw ang kuko
002380,DT.* NN.* CC.* NN.* NN.*,DTC NNC CCT NNC NNC_CCP,ang kuko sa paa halamang-singaw,ang kuko sa paa halamang-singaw
002381,NN.* CC.* NN.* NN.* PM.*,NNC CCT NNC NNC_CCP PMS,kuko sa paa halamang-singaw ang,kuko sa paa halamang-singaw ang
002382,CC.* NN.* NN.* PM.* NN.*,CCT NNC NNC_CCP PMS NNC,sa paa halamang-singaw ang pinakamahusay,sa paa halamang-singaw ang pinakamahusay
002383,NN.* NN.* PM.* NN.* DT.*,NNC NNC_CCP PMS NNC DTC,paa halamang-singaw ang pinakamahusay na,paa halamang-singaw ang pinakamahusay na
002384,NN.* PM.* NN.* DT.* JJ.*,NNC_CCP PMS NNC DTC JJCS_JJD,halamang-singaw ang pinakamahusay na paraan,halamang-singaw ang pinakamahusay na paraan
002385,PM.* NN.* DT.* JJ.* CC.*,PMS NNC DTC JJCS_JJD CCP,ang pinakamahusay na paraan upang,ang pinakamahusay na paraan upang
002386,NN.* DT.* JJ.* CC.* NN.*,NNC DTC JJCS_JJD CCP NNC,pinakamahusay na paraan upang gamutin,pinakamahusay na paraan upang gamutin
002387,DT.* JJ.* CC.* NN.* CC.*,DTC JJCS_JJD CCP NNC CCB,na paraan upang gamutin ang,na paraan upang gamutin ang
002388,JJ.* CC.* NN.* CC.* VB.*,JJCS_JJD CCP NNC CCB VBOF,paraan upang gamutin ang kuko,paraan upang gamutin ang kuko
002389,CC.* NN.* CC.* VB.* DT.*,CCP NNC CCB VBOF DTC,upang gamutin ang kuko halamang-singaw,upang gamutin ang kuko halamang-singaw
002390,NN.* CC.* VB.* DT.* NN.*,NNC CCB VBOF DTC NNC,gamutin ang kuko halamang-singaw sa,gamutin ang kuko halamang-singaw sa
002391,CC.* VB.* DT.* NN.* NN.*,CCB VBOF DTC NNC NNC_CCP,ang kuko halamang-singaw sa aking,ang kuko halamang-singaw sa aking
002392,VB.* DT.* NN.* NN.* PM.*,VBOF DTC NNC NNC_CCP PMS,kuko halamang-singaw sa aking mga,kuko halamang-singaw sa aking mga
002393,DT.* NN.* NN.* PM.* NN.*,DTC NNC NNC_CCP PMS NNC,halamang-singaw sa aking mga paa.,halamang-singaw sa aking mga paa.
002430,RB.* RB.* DT.* VB.* CC.*,RBK RBQ DTC VBTR CCB,kung sino ang itinuturing ng,kung sino ang itinuturing ng
002431,RB.* DT.* VB.* CC.* FW,RBQ DTC VBTR CCB FW,sino ang itinuturing ng fungus,sino ang itinuturing ng fungus
002432,DT.* VB.* CC.* FW NN.*,DTC VBTR CCB FW NNC,ang itinuturing ng fungus bibig,ang itinuturing ng fungus bibig
002433,VB.* CC.* FW NN.* NN.*,VBTR CCB FW NNC NNC,itinuturing ng fungus bibig diyagnosis,itinuturing ng fungus bibig diyagnosis
002443,NN.* CC.* NN.* NN.* PM.*,NNC CCT NNC NNC_CCP PMS,paggamot sa kuko halamang-singaw kit,paggamot sa kuko halamang-singaw kit
002444,CC.* NN.* NN.* PM.* NN.*,CCT NNC NNC_CCP PMS NNC,sa kuko halamang-singaw kit para,sa kuko halamang-singaw kit para
002445,NN.* PM.* NN.* NN.* CC.*,NNC_CCP PMS NNC NNC CCT,halamang-singaw kit para sa paggamot,halamang-singaw kit para sa paggamot
002472,DT.* JJ.* CC.* NN.* CC.*,DTC JJCS_JJD CCP NNC CCT,ang pinakamahusay na lunas para,ang pinakamahusay na lunas para
002473,JJ.* CC.* NN.* CC.* CC.*,JJCS_JJD CCP NNC CCT CCT,pinakamahusay na lunas para sa,pinakamahusay na lunas para sa
002474,CC.* NN.* CC.* CC.* DT.*,CCP NNC CCT CCT DTCP,na lunas para sa mga,na lunas para sa mga
002475,NN.* CC.* CC.* DT.* NN.*,NNC CCT CCT DTCP NNC_CCP,lunas para sa mga halamang-singaw,lunas para sa mga halamang-singaw
002476,CC.* CC.* DT.* NN.* PM.*,CCT CCT DTCP NNC_CCP PMS,para sa mga halamang-singaw sa,para sa mga halamang-singaw sa
002477,CC.* DT.* NN.* PM.* NN.*,CCT DTCP NNC_CCP PMS NNC,sa mga halamang-singaw sa pagitan,sa mga halamang-singaw sa pagitan
002478,DT.* NN.* PM.* NN.* CC.*,DTCP NNC_CCP PMS NNC CCT,mga halamang-singaw sa pagitan ng,mga halamang-singaw sa pagitan ng
002479,NN.* PM.* NN.* CC.* NN.*,NNC_CCP PMS NNC CCT NNC,halamang-singaw sa pagitan ng mga,halamang-singaw sa pagitan ng mga
002480,PM.* NN.* CC.* NN.* CC.*,PMS NNC CCT NNC CCB,sa pagitan ng mga daliri,sa pagitan ng mga daliri
002481,NN.* CC.* NN.* CC.* DT.*,NNC CCT NNC CCB DTCP,pagitan ng mga daliri sa,pagitan ng mga daliri sa
002482,CC.* NN.* CC.* DT.* NN.*,CCT NNC CCB DTCP NNC,ng mga daliri sa kamay,ng mga daliri sa kamay
002483,NN.* CC.* DT.* NN.* CC.*,NNC CCB DTCP NNC CCT,mga daliri sa kamay paano,mga daliri sa kamay paano
002484,CC.* DT.* NN.* CC.* NN.*,CCB DTCP NNC CCT NNC,daliri sa kamay paano mag-apply,daliri sa kamay paano mag-apply
002485,DT.* NN.* CC.* NN.* PR.*,DTCP NNC CCT NNC PRQ,sa kamay paano mag-apply pamahid,sa kamay paano mag-apply pamahid
002486,NN.* CC.* NN.* PR.* VB.*,NNC CCT NNC PRQ VBW,kamay paano mag-apply pamahid ekzoderil.,kamay paano mag-apply pamahid ekzoderil.
002519,NN.* NN.* PM.* NN.* VB.*,NNC NNC_CCP PMS NNC VBW,kuko halamang-singaw paggamot sa mga,kuko halamang-singaw paggamot sa mga
002520,NN.* PM.* NN.* VB.* CC.*,NNC_CCP PMS NNC VBW CCT,halamang-singaw paggamot sa mga bata,halamang-singaw paggamot sa mga bata
002521,PM.* NN.* VB.* CC.* DT.*,PMS NNC VBW CCT DTCP,paggamot sa mga bata 7,paggamot sa mga bata 7
002522,NN.* VB.* CC.* DT.* NN.*,NNC VBW CCT DTCP NNC,sa mga bata 7 taon,sa mga bata 7 taon
002523,VB.* CC.* DT.* NN.* CD.*,VBW CCT DTCP NNC CDB,mga bata 7 taon paa,mga bata 7 taon paa
002524,CC.* DT.* NN.* CD.* NN.*,CCT DTCP NNC CDB NNC,bata 7 taon paa halamang-singaw,bata 7 taon paa halamang-singaw
002564,PR.* DT.* VB.* CC.* VB.*,PRQ DTC VBTF CCR VBH,ano ang gagawin kung mayroon,ano ang gagawin kung mayroon
002565,DT.* VB.* CC.* VB.* PR.*,DTC VBTF CCR VBH PRS_CCP,ang gagawin kung mayroon kang,ang gagawin kung mayroon kang
002566,VB.* CC.* VB.* PR.* PR.*,VBTF CCR VBH PRS_CCP PRI_CCP,gagawin kung mayroon kang isang,gagawin kung mayroon kang isang
002567,CC.* VB.* PR.* PR.* NN.*,CCR VBH PRS_CCP PRI_CCP NNC,kung mayroon kang isang kuko,kung mayroon kang isang kuko
002568,VB.* PR.* PR.* NN.* NN.*,VBH PRS_CCP PRI_CCP NNC NNC_CCP,mayroon kang isang kuko halamang-singaw,mayroon kang isang kuko halamang-singaw
002569,PR.* PR.* NN.* NN.* PM.*,PRS_CCP PRI_CCP NNC NNC_CCP PMS,kang isang kuko halamang-singaw sa,kang isang kuko halamang-singaw sa
002570,PR.* NN.* NN.* PM.* NN.*,PRI_CCP NNC NNC_CCP PMS NNC,isang kuko halamang-singaw sa aking,isang kuko halamang-singaw sa aking
002571,NN.* NN.* PM.* NN.* CC.*,NNC NNC_CCP PMS NNC CCT,kuko halamang-singaw sa aking mga,kuko halamang-singaw sa aking mga
002572,NN.* PM.* NN.* CC.* PR.*,NNC_CCP PMS NNC CCT PRSP_CCP,halamang-singaw sa aking mga paa,halamang-singaw sa aking mga paa
002573,PM.* NN.* CC.* PR.* DT.*,PMS NNC CCT PRSP_CCP DTCP,sa aking mga paa Mayroon,sa aking mga paa Mayroon
002574,NN.* CC.* PR.* DT.* NN.*,NNC CCT PRSP_CCP DTCP NNC,aking mga paa Mayroon akong,aking mga paa Mayroon akong
002575,CC.* PR.* DT.* NN.* VB.*,CCT PRSP_CCP DTCP NNC VBH,mga paa Mayroon akong isang,mga paa Mayroon akong isang
002576,PR.* DT.* NN.* VB.* PR.*,PRSP_CCP DTCP NNC VBH PRS_CCP,paa Mayroon akong isang kuko,paa Mayroon akong isang kuko
002577,DT.* NN.* VB.* PR.* PR.*,DTCP NNC VBH PRS_CCP PRI_CCP,Mayroon akong isang kuko halamang-singaw,Mayroon akong isang kuko halamang-singaw
002578,NN.* VB.* PR.* PR.* NN.*,NNC VBH PRS_CCP PRI_CCP NNC,akong isang kuko halamang-singaw ay,akong isang kuko halamang-singaw ay
002579,VB.* PR.* PR.* NN.* NN.*,VBH PRS_CCP PRI_CCP NNC NNC_CCP,isang kuko halamang-singaw ay para,isang kuko halamang-singaw ay para
002580,PR.* PR.* NN.* NN.* PM.*,PRS_CCP PRI_CCP NNC NNC_CCP PMS,kuko halamang-singaw ay para lamang,kuko halamang-singaw ay para lamang
002581,PR.* NN.* NN.* PM.* NN.*,PRI_CCP NNC NNC_CCP PMS NNC,halamang-singaw ay para lamang sa,halamang-singaw ay para lamang sa
002582,NN.* NN.* PM.* NN.* LM,NNC NNC_CCP PMS NNC LM,ay para lamang sa kaliwang,ay para lamang sa kaliwang
002583,NN.* PM.* NN.* LM CC.*,NNC_CCP PMS NNC LM CCT,para lamang sa kaliwang braso.,para lamang sa kaliwang braso.
002635,NN.* CC.* NN.* PM.* NN.*,NNC CCB NNC_CCP PMS NNC,alak ng halamang-singaw sa mga,alak ng halamang-singaw sa mga
002636,CC.* NN.* PM.* NN.* CC.*,CCB NNC_CCP PMS NNC CCT,ng halamang-singaw sa mga kuko,ng halamang-singaw sa mga kuko
002637,NN.* PM.* NN.* CC.* DT.*,NNC_CCP PMS NNC CCT DTCP,halamang-singaw sa mga kuko ng,halamang-singaw sa mga kuko ng
002638,PM.* NN.* CC.* DT.* NN.*,PMS NNC CCT DTCP NNC,sa mga kuko ng mga,sa mga kuko ng mga
002639,NN.* CC.* DT.* NN.* CC.*,NNC CCT DTCP NNC CCB,mga kuko ng mga kamay,mga kuko ng mga kamay
002640,CC.* DT.* NN.* CC.* DT.*,CCT DTCP NNC CCB DTCP,kuko ng mga kamay kuko,kuko ng mga kamay kuko
002641,CC.* DT.* NN.* NN.* NN.*,CCB DTCP NNC NNC NNC_CCP,kamay kuko halamang-singaw sa iyong,kamay kuko halamang-singaw sa iyong
002642,DT.* NN.* NN.* NN.* PM.*,DTCP NNC NNC NNC_CCP PMS,kuko halamang-singaw sa iyong mga,kuko halamang-singaw sa iyong mga
002643,NN.* NN.* PM.* NN.* CC.*,NNC NNC_CCP PMS NNC CCT,sa iyong mga paa kaysa,sa iyong mga paa kaysa
002644,NN.* PM.* NN.* CC.* PR.*,NNC_CCP PMS NNC CCT PRSP_CCP,iyong mga paa kaysa sa,iyong mga paa kaysa sa
002645,PM.* NN.* CC.* PR.* DT.*,PMS NNC CCT PRSP_CCP DTCP,mga paa kaysa sa paggamot,mga paa kaysa sa paggamot
002646,NN.* CC.* PR.* DT.* NN.*,NNC CCT PRSP_CCP DTCP NNC,paa kaysa sa paggamot sa,paa kaysa sa paggamot sa
002647,CC.* PR.* DT.* NN.* JJ.*,CCT PRSP_CCP DTCP NNC JJC,kaysa sa paggamot sa murang.,kaysa sa paggamot sa murang.
002687,RB.* VB.* NN.* NN.* PM.*,RBD VBW NNC NNC_CCP PMS,balakubak paggamot kuko halamang-singaw halamang-singaw,balakubak paggamot kuko halamang-singaw halamang-singaw
002688,VB.* NN.* NN.* PM.* NN.*,VBW NNC NNC_CCP PMS NNC,paggamot kuko halamang-singaw halamang-singaw sa,paggamot kuko halamang-singaw halamang-singaw sa
002689,NN.* NN.* PM.* NN.* CC.*,NNC NNC_CCP PMS NNC CCT,sa papa sa isang matanda,sa papa sa isang matanda
002690,NN.* PM.* NN.* CC.* NN.*,NNC_CCP PMS NNC CCT NNC,papa sa isang matanda sa,papa sa isang matanda sa
002691,NN.* CC.* NN.* CC.* PR.*,NNC CCT NNC CCT PRI_CCP,isang matanda sa pagitan ng,isang matanda sa pagitan ng
002692,CC.* NN.* CC.* PR.* JJ.*,CCT NNC CCT PRI_CCP JJD,matanda sa pagitan ng puwit,matanda sa pagitan ng puwit
002693,NN.* CC.* PR.* JJ.* CC.*,NNC CCT PRI_CCP JJD CCT,sa pagitan ng puwit bilang,sa pagitan ng puwit bilang
002694,CC.* PR.* JJ.* CC.* NN.*,CCT PRI_CCP JJD CCT NNC,pagitan ng puwit bilang isang,pagitan ng puwit bilang isang
002695,PR.* JJ.* CC.* NN.* CC.*,PRI_CCP JJD CCT NNC CCB,ng puwit bilang isang gamutin.,ng puwit bilang isang gamutin.
002727,RB.* RB.* VB.* DT.* FW,RBK RBQ VBW DTC FW,Kung paano mapupuksa ang forum,Kung paano mapupuksa ang forum
002728,RB.* VB.* DT.* FW NN.*,RBQ VBW DTC FW NNC_CCP,paano mapupuksa ang forum halamang-singaw,paano mapupuksa ang forum halamang-singaw
002729,VB.* DT.* FW NN.* PM.*,VBW DTC FW NNC_CCP PMS,mapupuksa ang forum halamang-singaw ng,mapupuksa ang forum halamang-singaw ng
002730,DT.* FW NN.* PM.* NN.*,DTC FW NNC_CCP PMS NNC,ang forum halamang-singaw ng kuko,ang forum halamang-singaw ng kuko
002731,FW NN.* PM.* NN.* CC.*,FW NNC_CCP PMS NNC CCB,forum halamang-singaw ng kuko Gawin,forum halamang-singaw ng kuko Gawin
002732,NN.* PM.* NN.* CC.* NN.*,NNC_CCP PMS NNC CCB NNC,halamang-singaw ng kuko Gawin ang,halamang-singaw ng kuko Gawin ang
002733,PM.* NN.* CC.* NN.* NN.*,PMS NNC CCB NNC NNP,ng kuko Gawin ang kuko,ng kuko Gawin ang kuko
002734,NN.* CC.* NN.* NN.* DT.*,NNC CCB NNC NNP DTC,kuko Gawin ang kuko halamang-singaw,kuko Gawin ang kuko halamang-singaw
002735,CC.* NN.* NN.* DT.* NN.*,CCB NNC NNP DTC NNC,Gawin ang kuko halamang-singaw na,Gawin ang kuko halamang-singaw na
002736,NN.* NN.* DT.* NN.* NN.*,NNC NNP DTC NNC NNC_CCP,ang kuko halamang-singaw na nanggagaling,ang kuko halamang-singaw na nanggagaling
002737,NN.* DT.* NN.* NN.* PM.*,NNP DTC NNC NNC_CCP PMS,"kuko halamang-singaw na nanggagaling kapag,",kuko halamang-singaw na nanggagaling kapag
002765,DT.* JJ.* CC.* NN.* CC.*,DTCP JJD CCP NNC CCT,mga bawal na gamot para,mga bawal na gamot para
002766,JJ.* CC.* NN.* CC.* CC.*,JJD CCP NNC CCT CCT,bawal na gamot para sa,bawal na gamot para sa
002767,CC.* CC.* NN.* CC.* NN.*,CCT CCT NNC CCB NNC_CCP,para sa paggamot ng halamang-singaw,para sa paggamot ng halamang-singaw
002768,CC.* NN.* CC.* NN.* PM.*,CCT NNC CCB NNC_CCP PMS,sa paggamot ng halamang-singaw sa,sa paggamot ng halamang-singaw sa
