N-Gram_ID,RoughPOS_N-Gram,DetailedPOS_N-Gram,N-Gram,Lemma_N-Gram
001852,CC.* NN.* CC.* CC.* RB.*,CCT NNC CCT CCP RBW,sa pag-arte kahit na noon,sa arte kahit na noon
001853,NN.* CC.* CC.* RB.* RB.*,NNC CCT CCP RBW RBI,pag-arte kahit na noon pa,arte kahit na noon pa
001854,CC.* CC.* RB.* RB.* RB.*,CCT CCP RBW RBI RBI,kahit na noon pa man,kahit na noon pa man
001855,RB.* RB.* RB.* CC.* VB.*,RBW RBI RBI CCP VBTR,noon pa man na nagsisimula,noon pa man na simula
001856,RB.* RB.* CC.* VB.* PR.*,RBI RBI CCP VBTR PRO,pa man na nagsisimula ito,pa man na simula ito
001857,RB.* CC.* VB.* PR.* LM,RBI CCP VBTR PRO LM,man na nagsisimula ito ay,man na simula ito ay
001858,CC.* VB.* PR.* LM VB.*,CCP VBTR PRO LM VBTS,na nagsisimula ito ay nakitaan,na simula ito ay kita
001859,VB.* PR.* LM VB.* CC.*,VBTR PRO LM VBTS CCP,nagsisimula ito ay nakitaan na,simula ito ay kita na
001903,RB.* CC.* DT.* NN.* CC.*,RBR CCT DTCP NNP CCB,Tungkol sa mga Larawan ng,tungkol sa mga Larawan ng
001904,CC.* DT.* NN.* CC.* DT.*,CCT DTCP NNP CCB DTCP,sa mga Larawan ng mga,sa mga Larawan ng mga
001905,DT.* NN.* CC.* DT.* NN.*,DTCP NNP CCB DTCP NNP_CCP,mga Larawan ng mga Lumang,mga Larawan ng mga Lumang
001906,NN.* CC.* DT.* NN.* NN.*,NNP CCB DTCP NNP_CCP NNP,Larawan ng mga Lumang Bulalakaw,Larawan ng mga Lumang Bulalakaw
001924,VB.* CC.* NN.* RB.* CC.*,VBW CCB NNC RBL CCT,paggamot ng kuko mula sa,gamott ng kuko mula sa
001925,CC.* NN.* RB.* CC.* NN.*,CCB NNC RBL CCT NNC,ng kuko mula sa pagbabalat,ng kuko mula sa balat
001926,NN.* RB.* CC.* NN.* RB.*,NNC RBL CCT NNC RBK,kuko mula sa pagbabalat kung,kuko mula sa balat kung
001927,RB.* CC.* NN.* RB.* RB.*,RBL CCT NNC RBK RBQ,mula sa pagbabalat kung paano,mula sa balat kung paano
001928,CC.* NN.* RB.* RB.* VB.*,CCT NNC RBK RBQ VBOF,sa pagbabalat kung paano ituring,sa balat kung paano turing
001929,NN.* RB.* RB.* VB.* DT.*,NNC RBK RBQ VBOF DTC,pagbabalat kung paano ituring ang,balat kung paano turing ang
001930,RB.* RB.* VB.* DT.* DT.*,RBK RBQ VBOF DTC DTCP,kung paano ituring ang mga,kung paano turing ang mga
001931,RB.* VB.* DT.* DT.* NN.*,RBQ VBOF DTC DTCP NNC,paano ituring ang mga halamang-singaw,paano turing ang mga halaman
001932,VB.* DT.* DT.* NN.* CC.*,VBOF DTC DTCP NNC CCT,ituring ang mga halamang-singaw sa,turing ang mga halaman singaw
001933,DT.* DT.* NN.* CC.* DT.*,DTC DTCP NNC CCT DTCP,ang mga halamang-singaw sa mga,ang mga halaman singaw sa
001934,NN.* CC.* DT.* NN.* CC.*,NNC CCT DTCP NNC CCB,halamang-singaw sa mga paa ng,halaman singaw sa mga paa
001935,CC.* DT.* NN.* CC.* DT.*,CCT DTCP NNC CCB DTCP,sa mga paa ng mga,singaw sa mga paa ng
001980,RB.* RB.* CC.* NN.* DT.*,RBK RBQ CCT NNC DTC,kung paano sa singaw ang,kung paano sa singaw ang
001981,RB.* CC.* NN.* DT.* NN.*,RBQ CCT NNC DTC NNC,paano sa singaw ang kuko,paano sa singaw ang kuko
001982,CC.* NN.* NN.* DT.* JJ.*,CCT NNC NNC DTC JJCS_JJD,sa paa halamang-singaw ang pinakamahusay,sa paa halamangsingaw ang husay
001983,NN.* NN.* DT.* JJ.* CC.*,NNC NNC DTC JJCS_JJD CCP,paa halamang-singaw ang pinakamahusay na,paa halamangsingaw ang husay na
001984,NN.* DT.* JJ.* CC.* NN.*,NNC DTC JJCS_JJD CCP NNC,halamang-singaw ang pinakamahusay na paraan,halamangsingaw ang husay na paraan
001985,DT.* JJ.* CC.* NN.* CC.*,DTC JJCS_JJD CCP NNC CCB,ang pinakamahusay na paraan upang,ang husay na paraan upa
001986,JJ.* CC.* NN.* CC.* VB.*,JJCS_JJD CCP NNC CCB VBOF,pinakamahusay na paraan upang gamutin,husay na paraan upa gamot
001987,CC.* NN.* CC.* VB.* DT.*,CCP NNC CCB VBOF DTC,na paraan upang gamutin ang,na paraan upa gamot ang
001988,NN.* CC.* VB.* DT.* NN.*,NNC CCB VBOF DTC NNC,paraan upang gamutin ang kuko,paraan upa gamot ang kuko
001989,CC.* VB.* DT.* NN.* NN.*,CCB VBOF DTC NNC NNC,upang gamutin ang kuko halamang-singaw,upa gamot ang kuko halamangsingaw
001990,VB.* DT.* NN.* NN.* CC.*,VBOF DTC NNC NNC CCT,gamutin ang kuko halamang-singaw sa,gamot ang kuko halamangsingaw sa
001991,DT.* NN.* NN.* CC.* PR.*,DTC NNC NNC CCT PRSP_CCP,ang kuko halamang-singaw sa aking,ang kuko halamangsingaw sa akin
001992,NN.* NN.* CC.* PR.* DT.*,NNC NNC CCT PRSP_CCP DTCP,kuko halamang-singaw sa aking mga,kuko halamangsingaw sa akin mga
001993,NN.* CC.* PR.* DT.* NN.*,NNC CCT PRSP_CCP DTCP NNC,halamang-singaw sa aking mga paa.,halamangsingaw sa akin mga paa
002029,DT.* JJ.* CC.* NN.* CC.*,DTC JJCS_JJD CCP NNC CCT,ang pinakamahusay na lunas para,ang husay na lunas para
002030,JJ.* CC.* NN.* CC.* CC.*,JJCS_JJD CCP NNC CCT CCT,pinakamahusay na lunas para sa,husay na lunas para sa
002031,CC.* NN.* CC.* CC.* DT.*,CCP NNC CCT CCT DTCP,na lunas para sa mga,na lunas para sa mga
002032,DT.* NN.* CC.* NN.* CC.*,DTCP NNC CCT NNC CCB,mga halamang-singaw sa pagitan ng,mga halamangsingaw sa pagitan ng
002033,NN.* CC.* NN.* CC.* DT.*,NNC CCT NNC CCB DTCP,halamang-singaw sa pagitan ng mga,halamangsingaw sa pagitan ng mga
002034,CC.* NN.* CC.* DT.* NN.*,CCT NNC CCB DTCP NNC,sa pagitan ng mga daliri,sa pagitan ng mga daliri
002035,NN.* CC.* DT.* NN.* CC.*,NNC CCB DTCP NNC CCT,pagitan ng mga daliri sa,pagitan ng mga daliri sa
002036,CC.* DT.* NN.* CC.* NN.*,CCB DTCP NNC CCT NNC,ng mga daliri sa kamay,ng mga daliri sa kamay
002037,DT.* NN.* CC.* NN.* PR.*,DTCP NNC CCT NNC PRQ,mga daliri sa kamay paano,mga daliri sa kamay paano
002038,NN.* CC.* NN.* PR.* VB.*,NNC CCT NNC PRQ VBW,daliri sa kamay paano mag-apply,daliri sa kamay paano magapply
002039,CC.* NN.* PR.* VB.* NN.*,CCT NNC PRQ VBW NNC,sa kamay paano mag-apply pamahid,sa kamay paano magapply ahid
002077,NN.* CC.* NN.* CC.* DT.*,NNC CCB NNC CCT DTCP,alak ng halamang-singaw sa mga,alak ng halamangsingaw sa mga
002078,CC.* NN.* CC.* DT.* NN.*,CCB NNC CCT DTCP NNC,ng halamang-singaw sa mga kuko,ng halamangsingaw sa mga kuko
002079,NN.* CC.* DT.* NN.* CC.*,NNC CCT DTCP NNC CCB,halamang-singaw sa mga kuko ng,halamangsingaw sa mga kuko ng
002080,CC.* DT.* NN.* CC.* DT.*,CCT DTCP NNC CCB DTCP,sa mga kuko ng mga,sa mga kuko ng mga
002081,NN.* NN.* NN.* CC.* PR.*,NNC NNC NNC CCT PRSP_CCP,kamay kuko halamang-singaw sa iyong,kamay kuko halamangsingaw sa iyo
002082,NN.* NN.* CC.* PR.* DT.*,NNC NNC CCT PRSP_CCP DTCP,kuko halamang-singaw sa iyong mga,kuko halamangsingaw sa iyo mga
002083,NN.* CC.* PR.* DT.* NN.*,NNC CCT PRSP_CCP DTCP NNC,halamang-singaw sa iyong mga paa,halamangsingaw sa iyo mga paa
002084,CC.* PR.* DT.* NN.* JJ.*,CCT PRSP_CCP DTCP NNC JJC,sa iyong mga paa kaysa,sa iyo mga paa kaysa
002085,PR.* DT.* NN.* JJ.* CC.*,PRSP_CCP DTCP NNC JJC CCT,iyong mga paa kaysa sa,iyo mga paa kaysa sa
002086,DT.* NN.* JJ.* CC.* VB.*,DTCP NNC JJC CCT VBW,mga paa kaysa sa paggamot,mga paa kaysa sa gamot
002087,NN.* JJ.* CC.* VB.* CC.*,NNC JJC CCT VBW CCT,paa kaysa sa paggamot sa,paa kaysa sa gamot sa
002088,JJ.* CC.* VB.* CC.* JJ.*,JJC CCT VBW CCT JJD_CCP,kaysa sa paggamot sa murang.,kaysa sa gamot sa mura
002127,NN.* CC.* NN.* CC.* PR.*,NNC CCT NNC CCT PRI_CCP,halamang-singaw sa papa sa isang,halamangsingaw sa papa sa isa
002128,CC.* NN.* CC.* PR.* JJ.*,CCT NNC CCT PRI_CCP JJD,sa papa sa isang matanda,sa papa sa isa tanda
002129,NN.* CC.* PR.* JJ.* CC.*,NNC CCT PRI_CCP JJD CCT,papa sa isang matanda sa,papa sa isa tanda sa
002130,CC.* PR.* JJ.* CC.* NN.*,CCT PRI_CCP JJD CCT NNC,sa isang matanda sa pagitan,sa isa tanda sa pagitan
002131,PR.* JJ.* CC.* NN.* CC.*,PRI_CCP JJD CCT NNC CCB,isang matanda sa pagitan ng,isa tanda sa pagitan ng
002132,JJ.* CC.* NN.* CC.* NN.*,JJD CCT NNC CCB NNC,matanda sa pagitan ng puwit,tanda sa pagitan ng puwit
002133,NN.* CC.* NN.* CC.* PR.*,NNC CCB NNC CCT PRI_CCP,pagitan ng puwit bilang isang,pagitan ng puwit bilang isa
002134,CC.* NN.* CC.* PR.* VB.*,CCB NNC CCT PRI_CCP VBOF,ng puwit bilang isang gamutin.,ng puwit bilang isa gamot
002161,RB.* RB.* VB.* DT.* FW,RBK RBQ VBW DTC FW,Kung paano mapupuksa ang forum,kung paano puksa ang forom
002162,RB.* VB.* DT.* FW NN.*,RBQ VBW DTC FW NNC,paano mapupuksa ang forum halamang-singaw,paano puksa ang forom halamangsingaw
002163,VB.* DT.* FW NN.* CC.*,VBW DTC FW NNC CCB,mapupuksa ang forum halamang-singaw ng,puksa ang forom halamangsingaw ng
002164,DT.* FW NN.* CC.* NN.*,DTC FW NNC CCB NNC,ang forum halamang-singaw ng kuko,ang forom halamangsingaw ng kuko
002165,FW NN.* CC.* NN.* NN.*,FW NNC CCB NNC NNP,forum halamang-singaw ng kuko Gawin,forom halamangsingaw ng kuko Gawin
002166,NN.* CC.* NN.* NN.* DT.*,NNC CCB NNC NNP DTC,halamang-singaw ng kuko Gawin ang,halamangsingaw ng kuko Gawin ang
002167,CC.* NN.* NN.* DT.* NN.*,CCB NNC NNP DTC NNC,ng kuko Gawin ang kuko,ng kuko Gawin ang kuko
002168,NN.* DT.* NN.* NN.* CC.*,NNP DTC NNC NNC CCP,Gawin ang kuko halamang-singaw na,Gawin ang kuko halamangsingaw na
002169,DT.* NN.* NN.* CC.* VB.*,DTC NNC NNC CCP VBTR,ang kuko halamang-singaw na nanggagaling,ang kuko halamangsingaw na galing
002170,NN.* NN.* CC.* VB.* CC.*,NNC NNC CCP VBTR CCR,kuko halamang-singaw na nanggagaling kapag,kuko halamangsingaw na galing kapa
002193,DT.* JJ.* CC.* NN.* CC.*,DTCP JJD CCP NNC CCT,mga bawal na gamot para,mga bawal na gamot para
002194,JJ.* CC.* NN.* CC.* CC.*,JJD CCP NNC CCT CCT,bawal na gamot para sa,bawal na gamot para sa
002195,NN.* CC.* NN.* CC.* DT.*,NNC CCB NNC CCT DTCP,paggamot ng halamang-singaw sa mga,gamot ng halamangsingaw sa mga
002196,CC.* NN.* CC.* DT.* NN.*,CCB NNC CCT DTCP NNC,ng halamang-singaw sa mga kamay,ng halamangsingaw sa mga kamay
002219,JJ.* DT.* DT.* NN.* NN.*,JJD DTC DTCP NNC NNC,Sigurado ang mga paa halamang-singaw,sigurado ang mga paa halamangsingaw
002220,DT.* DT.* NN.* NN.* LM,DTC DTCP NNC NNC LM,ang mga paa halamang-singaw ay,ang mga paa halamangsingaw ay
002221,DT.* NN.* NN.* LM RB.*,DTCP NNC NNC LM RBM,mga paa halamang-singaw ay maaaring,mga paa halamangsingaw ay ari
002222,NN.* NN.* LM RB.* VB.*,NNC NNC LM RBM VBAF,paa halamang-singaw ay maaaring humantong,paa halamangsingaw ay ari hantong
002223,NN.* LM RB.* VB.* CC.*,NNC LM RBM VBAF CCT,halamang-singaw ay maaaring humantong sa,halamangsingaw ay ari hantong sa
002224,LM RB.* VB.* CC.* RB.*,LM RBM VBAF CCT RBW,ay maaaring humantong sa kanggrenahin,ay ari hantong sa rena
002225,RB.* VB.* CC.* RB.* VB.*,RBM VBAF CCT RBW VBOF,maaaring humantong sa kanggrenahin alisin,ari hantong sa rena alis
002226,VB.* CC.* RB.* VB.* DT.*,VBAF CCT RBW VBOF DTC,humantong sa kanggrenahin alisin ang,hantong sa rena alis ang
002227,CC.* RB.* VB.* DT.* FW,CCT RBW VBOF DTC FW,sa kanggrenahin alisin ang fungus,sa rena alis ang fungos
002228,RB.* VB.* DT.* FW LM,RBW VBOF DTC FW LM,kanggrenahin alisin ang fungus ay,rena alis ang fungos ay
002229,VB.* DT.* FW LM VB.*,VBOF DTC FW LM VBTR,alisin ang fungus ay nangangahulugan,alis ang fungos ay angahulog
002259,NN.* NN.* LM DT.* NN.*,NNP NNC LM DTC NNC,Kuko halamang-singaw ay ang sanhi,kuko halamangsingaw ay ang sanhi
002260,LM DT.* NN.* DT.* JJ.*,LM DTC NNC DTC JJCS_JJD_CCP,ay ang sanhi ang pinaka-epektibong,ay ang sanhi ang epektibo
002261,DT.* NN.* DT.* JJ.* DT.*,DTC NNC DTC JJCS_JJD_CCP DTCP,ang sanhi ang pinaka-epektibong mga,ang sanhi ang epektibo mga
002262,NN.* DT.* JJ.* DT.* NN.*,NNC DTC JJCS_JJD_CCP DTCP NNC,sanhi ang pinaka-epektibong mga gamot,sanhi ang epektibo mga gamot
002263,DT.* JJ.* DT.* NN.* NN.*,DTC JJCS_JJD_CCP DTCP NNC NNC,ang pinaka-epektibong mga gamot halamang-singaw,ang epektibo mga gamot halamangsingaw
002264,JJ.* DT.* NN.* NN.* NN.*,JJCS_JJD_CCP DTCP NNC NNC NNC,pinaka-epektibong mga gamot halamang-singaw paggamot,epektibo mga gamot halamangsingaw gamot
002290,DT.* JJ.* NN.* CC.* NN.*,DTC JJCS_JJD_CCP NNC CCB NNC,ang pinaka-epektibong paggamot ng halamang-singaw,ang epektibo gamot ng halamangsingaw
002291,JJ.* NN.* CC.* NN.* CC.*,JJCS_JJD_CCP NNC CCB NNC CCT,pinaka-epektibong paggamot ng halamang-singaw sa,epektibo gamot ng halamangsingaw sa
002292,CC.* NN.* CC.* NN.* RB.*,CCB NNC CCT NNC RBK,ng halamang-singaw sa kuko kung,ng halamangsingaw sa kuko kung
002293,NN.* CC.* NN.* RB.* RB.*,NNC CCT NNC RBK RBQ,halamang-singaw sa kuko kung paano,halamangsingaw sa kuko kung paano
002294,CC.* NN.* RB.* RB.* VB.*,CCT NNC RBK RBQ VBOF,sa kuko kung paano gamutin,sa kuko kung paano gamot
002295,NN.* RB.* RB.* VB.* DT.*,NNC RBK RBQ VBOF DTC,kuko kung paano gamutin ang,kuko kung paano gamot ang
002296,RB.* RB.* VB.* DT.* PR.*,RBK RBQ VBOF DTC PRI_CCP,kung paano gamutin ang isang,kung paano gamot ang isa
002297,RB.* VB.* DT.* PR.* NN.*,RBQ VBOF DTC PRI_CCP NNC,paano gamutin ang isang kuba,paano gamot ang isa kuba
002298,VB.* DT.* PR.* NN.* NN.*,VBOF DTC PRI_CCP NNC NNC,gamutin ang isang kuba kuko.,gamot ang isa kuba kuko
002323,VB.* CC.* NN.* CC.* NN.*,VBAF CCB NNC CCT NNC,Unguento ng halamang-singaw sa tainga,unguento ng halamangsingaw sa tainga
002324,CC.* NN.* CC.* NN.* RB.*,CCB NNC CCT NNC RBK,ng halamang-singaw sa tainga kung,ng halamangsingaw sa tainga kung
002325,NN.* CC.* NN.* RB.* RB.*,NNC CCT NNC RBK RBQ,halamang-singaw sa tainga kung paano,halamangsingaw sa tainga kung paano
002326,CC.* NN.* RB.* RB.* VB.*,CCT NNC RBK RBQ VBW,sa tainga kung paano mapupuksa,sa tainga kung paano puksa
002327,NN.* RB.* RB.* VB.* DT.*,NNC RBK RBQ VBW DTC,tainga kung paano mapupuksa ang,tainga kung paano puksa ang
002328,RB.* RB.* VB.* DT.* DT.*,RBK RBQ VBW DTC DTCP,kung paano mapupuksa ang mga,kung paano puksa ang mga
002329,RB.* VB.* DT.* DT.* NN.*,RBQ VBW DTC DTCP NNC,paano mapupuksa ang mga halamang-singaw,paano puksa ang mga halamangsingaw
002330,VB.* DT.* DT.* NN.* CC.*,VBW DTC DTCP NNC CCT,mapupuksa ang mga halamang-singaw sa,puksa ang mga halamangsingaw sa
002331,DT.* DT.* NN.* CC.* NN.*,DTC DTCP NNC CCT NNC,ang mga halamang-singaw sa kuko,ang mga halamangsingaw sa kuko
002332,DT.* NN.* CC.* NN.* FW,DTCP NNC CCT NNC FW,mga halamang-singaw sa kuko forum,mga halamangsingaw sa kuko forom
002355,NN.* RB.* VB.* NN.* NN.*,NNC RBW VBW NNP_CCP NNC,paa halamang-singaw paggamot Paunang paa,paa halamangsingaw gamot Paunang paa
002356,RB.* VB.* NN.* NN.* NN.*,RBW VBW NNP_CCP NNC NNC,halamang-singaw paggamot Paunang paa halamang-singaw.,halamangsingaw gamot Paunang paa halamangsingaw
002368,NN.* NN.* VB.* CC.* PR.*,NNC NNC VBW CCT PRSP_CCP,kuko halamang-singaw paggamot sa kanyang,kuko halamangsingaw gamot sa kanya
002369,NN.* VB.* CC.* PR.* DT.*,NNC VBW CCT PRSP_CCP DTCP,halamang-singaw paggamot sa kanyang mga,halamangsingaw gamot sa kanya mga
002370,VB.* CC.* PR.* DT.* NN.*,VBW CCT PRSP_CCP DTCP NNC,paggamot sa kanyang mga paa,gamot sa kanya mga paa
002371,CC.* PR.* DT.* NN.* NN.*,CCT PRSP_CCP DTCP NNC NNP,sa kanyang mga paa Litrato,sa kanya mga paa Litrato
002394,VB.* DT.* NN.* CC.* PR.*,VBOF DTC NNC CCT PRSP_CCP,Gamutin ang halamang-singaw sa kanyang,gamot ang halamangsingaw sa kanya
002395,DT.* NN.* CC.* PR.* DT.*,DTC NNC CCT PRSP_CCP DTCP,ang halamang-singaw sa kanyang mga,ang halamangsingaw sa kanya mga
002396,NN.* CC.* PR.* DT.* NN.*,NNC CCT PRSP_CCP DTCP NNC,halamang-singaw sa kanyang mga paa,halamangsingaw sa kanya mga paa
002397,CC.* PR.* DT.* NN.* NN.*,CCT PRSP_CCP DTCP NNC NNC,sa kanyang mga paa ekzoderil,sa kanya mga paa ekzoderil
002398,PR.* DT.* NN.* NN.* NN.*,PRSP_CCP DTCP NNC NNC NNC,kanyang mga paa ekzoderil presyo,kanya mga paa ekzoderil presyo
002399,NN.* NN.* RB.* RB.* CC.*,NNC NNC RBK RBQ CCT,ekzoderil presyo kung paano sa,ekzoderil presyo kung paano sa
002400,NN.* RB.* RB.* CC.* VB.*,NNC RBK RBQ CCT VBW,presyo kung paano sa paggamot,presyo kung paano sa gamot
002401,RB.* RB.* CC.* VB.* CC.*,RBK RBQ CCT VBW CCT,kung paano sa paggamot sa,kung paano sa gamot sa
002402,RB.* CC.* VB.* CC.* PR.*,RBQ CCT VBW CCT PRI_CCP,paano sa paggamot sa isang,paano sa gamot sa isa
002403,CC.* VB.* CC.* PR.* JJ.*,CCT VBW CCT PRI_CCP JJD,sa paggamot sa isang lamog,sa gamot sa isa lamo
002404,VB.* CC.* PR.* JJ.* NN.*,VBW CCT PRI_CCP JJD NNC,paggamot sa isang lamog banda,gamot sa isa lamo banda
002405,CC.* PR.* JJ.* NN.* VB.*,CCT PRI_CCP JJD NNC VBTS,sa isang lamog banda nail,sa isa lamo banda nail
002446,RB.* JJ.* CC.* VB.* PR.*,RBF JJD CCP VBW PRP,Hindi malayo na maetsapuwera sila,hindi layo na etsapuwera sila
002447,JJ.* CC.* VB.* PR.* CC.*,JJD CCP VBW PRP CCR,malayo na maetsapuwera sila dahil,layo na etsapuwera sila dahil
002448,CC.* VB.* PR.* CC.* CC.*,CCP VBW PRP CCR CCT,na maetsapuwera sila dahil sa,na etsapuwera sila dahil sa
002449,VB.* PR.* CC.* CC.* VB.*,VBW PRP CCR CCT VBTR,maetsapuwera sila dahil sa ibinibigay,etsapuwera sila dahil sa bigay
002450,PR.* CC.* CC.* VB.* CC.*,PRP CCR CCT VBTR CCP,sila dahil sa ibinibigay na,sila dahil sa bigay na
002451,CC.* CC.* VB.* CC.* NN.*,CCR CCT VBTR CCP NNC,dahil sa ibinibigay na pribilehiyo,dahil sa bigay na ribilehiyo
002452,CC.* VB.* CC.* NN.* CC.*,CCT VBTR CCP NNC CCT,sa ibinibigay na pribilehiyo sa,sa bigay na ribilehiyo sa
002453,VB.* CC.* NN.* CC.* DT.*,VBTR CCP NNC CCT DTCP,ibinibigay na pribilehiyo sa mga,bigay na ribilehiyo sa mga
002454,CC.* NN.* CC.* DT.* NN.*,CCP NNC CCT DTCP NNC,na pribilehiyo sa mga tsekwa,na ribilehiyo sa mga sekwa
002455,NN.* CC.* DT.* NN.* CC.*,NNC CCT DTCP NNC CCP,pribilehiyo sa mga tsekwa na,ribilehiyo sa mga sekwa na
002456,CC.* DT.* NN.* CC.* FW,CCT DTCP NNC CCP FW,sa mga tsekwa na umo­okupa,sa mga sekwa na o\xadokupa
002457,DT.* NN.* CC.* FW FW,DTCP NNC CCP FW FW,mga tsekwa na umo­okupa sa,mga sekwa na o\xadokupa sa
002458,NN.* CC.* FW FW CC.*,NNC CCP FW FW CCT,tsekwa na umo­okupa sa nasabing,sekwa na o\xadokupa sa sabi
002459,CC.* FW FW CC.* VB.*,CCP FW FW CCT VBTS_CCP,na umo­okupa sa nasabing mga,na o\xadokupa sa sabi mga
002460,FW FW CC.* VB.* DT.*,FW FW CCT VBTS_CCP DTCP,umo­okupa sa nasabing mga establisimiyento!,o\xadokupa sa sabi mga establisimiyento
002507,VB.* DT.* NN.* CC.* RB.*,VBTS DTP NNP CCP RBF,siniguro ni Dado na hindi,siniguro ni Dado na hindi
002508,DT.* NN.* CC.* RB.* RB.*,DTP NNP CCP RBF RBI,ni Dado na hindi na,ni Dado na hindi na
002509,NN.* CC.* RB.* RB.* PR.*,NNP CCP RBF RBI PRS,Dado na hindi na siya,Dado na hindi na siya
002510,CC.* RB.* RB.* PR.* VB.*,CCP RBF RBI PRS VBW,na hindi na siya makakapagsalita,na hindi na siya sala
002511,RB.* RB.* PR.* VB.* DT.*,RBF RBI PRS VBW DTP,hindi na siya makakapagsalita kay,hindi na siya sala kay
002512,RB.* PR.* VB.* DT.* PR.*,RBI PRS VBW DTP PRSP_CCP,na siya makakapagsalita kay kanyang,na siya sala kay kanya
002513,PR.* VB.* DT.* PR.* VB.*,PRS VBW DTP PRSP_CCP VBOF,siya makakapagsalita kay kanyang pinatay,siya sala kay kanya patay
002514,VB.* DT.* PR.* VB.* VB.*,VBW DTP PRSP_CCP VBOF VBS,makakapagsalita kay kanyang pinatay gamit,sala kay kanya patay gamit
002515,DT.* PR.* VB.* VB.* DT.*,DTP PRSP_CCP VBOF VBS DTC,kay kanyang pinatay gamit ang,kay kanya patay gamit ang
002516,PR.* VB.* VB.* DT.* PR.*,PRSP_CCP VBOF VBS DTC PRI,kanyang pinatay gamit ang buo,kanya patay gamit ang buo
002517,VB.* VB.* DT.* PR.* PR.*,VBOF VBS DTC PRI PRS_CCP,pinatay gamit ang buo niyang,patay gamit ang buo niya
002518,VB.* DT.* PR.* PR.* NN.*,VBS DTC PRI PRS_CCP NNC,gamit ang buo niyang lakas.,gamit ang buo niya lakas
002546,CC.* NN.* JJ.* CC.* DT.*,CCT NNC_CCP JJD CCP DTC,Sa pag-aakalang tapos na ang,sa akala tapos na ang
002547,NN.* JJ.* CC.* DT.* PR.*,NNC_CCP JJD CCP DTC PRSP_CCP,pag-aakalang tapos na ang kanilang,akala tapos na ang nila
002548,JJ.* CC.* DT.* PR.* NN.*,JJD CCP DTC PRSP_CCP NNC,tapos na ang kanilang kalbaryo,tapos na ang nila baryo
002566,CC.* JJ.* DT.* VB.* NN.*,CCR JJCS DTC VBTS NNC,kaya lubos ang naging galit,kaya lubos ang naging galit
002567,JJ.* DT.* VB.* NN.* PR.*,JJCS DTC VBTS NNC PRS,lubos ang naging galit niya,lubos ang naging galit niya
002568,DT.* VB.* NN.* PR.* CC.*,DTC VBTS NNC PRS CCT,ang naging galit niya sa,ang naging galit niya sa
002569,VB.* NN.* PR.* CC.* JJ.*,VBTS NNC PRS CCT JJD_CCP,naging galit niya sa panlolokong,naging galit niya sa loko
002570,NN.* PR.* CC.* JJ.* VB.*,NNC PRS CCT JJD_CCP VBOF,galit niya sa panlolokong ginawa,galit niya sa loko gawa
002571,PR.* CC.* JJ.* VB.* CC.*,PRS CCT JJD_CCP VBOF CCB,niya sa panlolokong ginawa ng,niya sa loko gawa ng
002572,CC.* JJ.* VB.* CC.* PR.*,CCT JJD_CCP VBOF CCB PRSP_CCP,sa panlolokong ginawa ng kanyang,sa loko gawa ng kanya
002573,JJ.* VB.* CC.* PR.* NN.*,JJD_CCP VBOF CCB PRSP_CCP NNC,panlolokong ginawa ng kanyang ina.,loko gawa ng kanya ina
002591,RB.* PR.* VB.* DT.* NN.*,RBW PRQ VBTF DTP NNP,Hanggang kailan itatatago ni Enzo,hangga ilan tago ni Enzo
002592,PR.* VB.* DT.* NN.* DT.*,PRQ VBTF DTP NNP DTC,kailan itatatago ni Enzo ang,ilan tago ni Enzo ang
002593,VB.* DT.* NN.* DT.* NN.*,VBTF DTP NNP DTC NNC,itatatago ni Enzo ang katotohanan?,tago ni Enzo ang toi
002617,RB.* RB.* CC.* NN.* DT.*,RBI RBI CCT NNC DTP,nga raw sa distrito ni,nga raw sa distrito ni
002618,RB.* CC.* NN.* DT.* NN.*,RBI CCT NNC DTP NNP,raw sa distrito ni Biazon,raw sa distrito ni Biazon
002619,CC.* NN.* DT.* NN.* LM,CCT NNC DTP NNP LM,sa distrito ni Biazon ay,sa distrito ni Biazon ay
002620,NN.* DT.* NN.* LM VB.*,NNC DTP NNP LM VBTS,distrito ni Biazon ay napansin,distrito ni Biazon ay pansin
002621,DT.* NN.* LM VB.* PR.*,DTP NNP LM VBTS PRS,ni Biazon ay napansin niya,ni Biazon ay pansin niya
002622,NN.* LM VB.* PR.* CC.*,NNP LM VBTS PRS CCP,Biazon ay napansin niya na,Biazon ay pansin niya na
002623,LM VB.* PR.* CC.* RB.*,LM VBTS PRS CCP RBD_CCP,ay napansin niya na biglang,ay pansin niya na bigla
002624,VB.* PR.* CC.* RB.* VB.*,VBTS PRS CCP RBD_CCP VBTS,napansin niya na biglang naglipana,pansin niya na bigla lipana
002625,PR.* CC.* RB.* VB.* DT.*,PRS CCP RBD_CCP VBTS DTC,niya na biglang naglipana ang,niya na bigla lipana ang
002626,CC.* RB.* VB.* DT.* DT.*,CCP RBD_CCP VBTS DTC DTCP,na biglang naglipana ang mga,na bigla lipana ang mga
002627,RB.* VB.* DT.* DT.* NN.*,RBD_CCP VBTS DTC DTCP NNC,biglang naglipana ang mga singkit,bigla lipana ang mga singkit
002628,VB.* DT.* DT.* NN.* CC.*,VBTS DTC DTCP NNC CCT,naglipana ang mga singkit sa,lipana ang mga singkit sa
002629,DT.* DT.* NN.* CC.* PR.*,DTC DTCP NNC CCT PRSP_CCP,ang mga singkit sa kanilang,ang mga singkit sa nila
002630,DT.* NN.* CC.* PR.* NN.*,DTCP NNC CCT PRSP_CCP NNC,mga singkit sa kanilang lugar!,mga singkit sa nila lugad
002668,RB.* RB.* JJ.* DT.* NN.*,RBK RBQ JJD DTC NNC,kung gaano katagal ang paggaling,kung gaano tagal ang galing
002669,RB.* JJ.* DT.* NN.* VB.*,RBQ JJD DTC NNC VBW,gaano katagal ang paggaling pagkatapos,gaano tagal ang galing tapos
002670,JJ.* DT.* NN.* VB.* CC.*,JJD DTC NNC VBW CCB,katagal ang paggaling pagkatapos ng,tagal ang galing tapos ng
002671,DT.* NN.* VB.* CC.* NN.*,DTC NNC VBW CCB NNC,ang paggaling pagkatapos ng dibdib,ang galing tapos ng dibdib
002672,VB.* CC.* NN.* VB.* RB.*,VBW CCB NNC VBW RBK,pagkatapos ng dibdib mammoplasty kung,tapos ng dibdib moplasty kung
002673,CC.* NN.* VB.* RB.* RB.*,CCB NNC VBW RBK RBQ,ng dibdib mammoplasty kung paano,ng dibdib moplasty kung paano
002674,NN.* VB.* RB.* RB.* VB.*,NNC VBW RBK RBQ VBTF,dibdib mammoplasty kung paano dagdagan,dibdib moplasty kung paano dagan
002675,VB.* RB.* RB.* VB.* DT.*,VBW RBK RBQ VBTF DTC,mammoplasty kung paano dagdagan ang,moplasty kung paano dagan ang
002676,RB.* RB.* VB.* DT.* NN.*,RBK RBQ VBTF DTC NNC,kung paano dagdagan ang dibdib,kung paano dagan ang dibdib
002677,RB.* VB.* DT.* NN.* VB.*,RBQ VBTF DTC NNC VBS,paano dagdagan ang dibdib gamit,paano dagan ang dibdib gamit
002678,VB.* DT.* NN.* VB.* NN.*,VBTF DTC NNC VBS NNC,dagdagan ang dibdib gamit pagsasanay.,dagan ang dibdib gamit sanay
002705,DT.* NN.* LM RB.* VB.*,DTC NNC LM RBM VBW,Ang kalusugan ay maaaring maging,ang lusog ay ari maging
002706,NN.* LM RB.* VB.* JJ.*,NNC LM RBM VBW JJD,kalusugan ay maaaring maging negatibo,lusog ay ari maging negatibo
002707,LM RB.* VB.* JJ.* DT.*,LM RBM VBW JJD DTC,ay maaaring maging negatibo ang,ay ari maging negatibo ang
002708,RB.* VB.* JJ.* DT.* NN.*,RBM VBW JJD DTC NNC,maaaring maging negatibo ang kahulugan,ari maging negatibo ang hulog
002715,CC.* DT.* NN.* CC.* NN.*,CCT DTC NNC CCB NNC,bilang ang pagkawala ng sakit,bilang ang wala ng sakit
002723,VB.* CC.* DT.* NN.* CC.*,VBTR_VBAF CCT DTC NNC CCP,gumagana bilang ang kakayahan na,gumagana bilang ang kaya na
002724,CC.* DT.* NN.* CC.* VB.*,CCT DTC NNC CCP VBW,bilang ang kakayahan na malabanan,bilang ang kaya na laban
002725,DT.* NN.* CC.* VB.* DT.*,DTC NNC CCP VBW DTC,ang kakayahan na malabanan ang,ang kaya na laban ang
002726,NN.* CC.* VB.* DT.* NN.*,NNC CCP VBW DTC NNC,kakayahan na malabanan ang araw-,kaya na laban ang araw
002727,CC.* VB.* DT.* NN.* PM.*,CCP VBW DTC NNC PMS,na malabanan ang araw- araw.,na laban ang araw araw
002741,JJ.* JJ.* CC.* VB.* CC.*,JJCC JJD CCP VBW CCB,mas mahusay na magdala ng,mas husay na dala ng
002742,JJ.* CC.* VB.* CC.* DT.*,JJD CCP VBW CCB DTCP,mahusay na magdala ng mga,husay na dala ng mga
002743,CC.* VB.* CC.* DT.* NN.*,CCP VBW CCB DTCP NNC,na magdala ng mga parasito,na dala ng mga rasito
002744,VB.* CC.* DT.* NN.* CC.*,VBW CCB DTCP NNC CCB,magdala ng mga parasito Upang,dala ng mga rasito Upang
002745,CC.* DT.* NN.* CC.* VB.*,CCB DTCP NNC CCB VBW,ng mga parasito Upang masuri,ng mga rasito Upang suri
002746,DT.* NN.* CC.* VB.* CC.*,DTCP NNC CCB VBW CCT,mga parasito Upang masuri para,mga rasito Upang suri para
002747,NN.* CC.* VB.* CC.* CC.*,NNC CCB VBW CCT CCT,parasito Upang masuri para sa,rasito Upang suri para sa
002748,CC.* VB.* CC.* CC.* DT.*,CCB VBW CCT CCT DTCP,Upang masuri para sa mga,Upang suri para sa mga
002749,VB.* CC.* CC.* DT.* NN.*,VBW CCT CCT DTCP NNC,masuri para sa mga parasito.,suri para sa mga rasito
002780,RB.* RB.* CC.* NN.* RB.*,RBK RBQ CCP NNC RBW,kung paano na baybayin nang,kung paano na baybayin nang
002781,RB.* CC.* NN.* RB.* PR.*,RBQ CCP NNC RBW PRI_CCP,paano na baybayin nang isang,paano na baybayin nang isa
002782,CC.* NN.* RB.* PR.* NN.*,CCP NNC RBW PRI_CCP NNC,na baybayin nang isang parasito,na baybayin nang isa rasito
002783,NN.* RB.* PR.* NN.* RB.*,NNC RBW PRI_CCP NNC RBK,baybayin nang isang parasito kung,baybayin nang isa rasito kung
002784,RB.* PR.* NN.* RB.* RB.*,RBW PRI_CCP NNC RBK RBQ,nang isang parasito kung ano,nang isa rasito kung ano
002785,PR.* NN.* RB.* RB.* DT.*,PRI_CCP NNC RBK RBQ DTC,isang parasito kung ano ang,isa rasito kung ano ang
002786,NN.* RB.* RB.* DT.* DT.*,NNC RBK RBQ DTC DTCP,parasito kung ano ang mga,rasito kung ano ang mga
