N-Gram_ID,RoughPOS_N-Gram,DetailedPOS_N-Gram,N-Gram,Lemma_N-Gram
001871,CC.* NN.* CC.* CC.* RB.* RB.*,CCT NNC CCT CCP RBW RBI,sa pag-arte kahit na noon pa,sa arte kahit na noon pa
001872,NN.* CC.* CC.* RB.* RB.* RB.*,NNC CCT CCP RBW RBI RBI,pag-arte kahit na noon pa man,arte kahit na noon pa man
001873,CC.* CC.* RB.* RB.* RB.* CC.*,CCT CCP RBW RBI RBI CCP,kahit na noon pa man na,kahit na noon pa man na
001874,CC.* RB.* RB.* RB.* CC.* VB.*,CCP RBW RBI RBI CCP VBTR,na noon pa man na nagsisimula,na noon pa man na simula
001875,RB.* RB.* RB.* CC.* VB.* PR.*,RBW RBI RBI CCP VBTR PRO,noon pa man na nagsisimula ito,noon pa man na simula ito
001876,RB.* RB.* CC.* VB.* PR.* LM,RBI RBI CCP VBTR PRO LM,pa man na nagsisimula ito ay,pa man na simula ito ay
001877,RB.* CC.* VB.* PR.* LM VB.*,RBI CCP VBTR PRO LM VBTS,man na nagsisimula ito ay nakitaan,man na simula ito ay kita
001878,CC.* VB.* PR.* LM VB.* CC.*,CCP VBTR PRO LM VBTS CCP,na nagsisimula ito ay nakitaan na,na simula ito ay kita na
001907,RB.* CC.* DT.* NN.* CC.* DT.*,RBR CCT DTCP NNP CCB DTCP,Tungkol sa mga Larawan ng mga,tungkol sa mga Larawan ng mga
001908,CC.* DT.* NN.* CC.* DT.* NN.*,CCT DTCP NNP CCB DTCP NNP_CCP,sa mga Larawan ng mga Lumang,sa mga Larawan ng mga Lumang
001909,DT.* NN.* CC.* DT.* NN.* NN.*,DTCP NNP CCB DTCP NNP_CCP NNP,mga Larawan ng mga Lumang Bulalakaw,mga Larawan ng mga Lumang Bulalakaw
001936,VB.* CC.* NN.* RB.* CC.* NN.*,VBW CCB NNC RBL CCT NNC,paggamot ng kuko mula sa pagbabalat,gamott ng kuko mula sa balat
001937,CC.* NN.* RB.* CC.* NN.* RB.*,CCB NNC RBL CCT NNC RBK,ng kuko mula sa pagbabalat kung,ng kuko mula sa balat kung
001938,NN.* RB.* CC.* NN.* RB.* RB.*,NNC RBL CCT NNC RBK RBQ,kuko mula sa pagbabalat kung paano,kuko mula sa balat kung paano
001939,RB.* CC.* NN.* RB.* RB.* VB.*,RBL CCT NNC RBK RBQ VBOF,mula sa pagbabalat kung paano ituring,mula sa balat kung paano turing
001940,CC.* NN.* RB.* RB.* VB.* DT.*,CCT NNC RBK RBQ VBOF DTC,sa pagbabalat kung paano ituring ang,sa balat kung paano turing ang
001941,NN.* RB.* RB.* VB.* DT.* DT.*,NNC RBK RBQ VBOF DTC DTCP,pagbabalat kung paano ituring ang mga,balat kung paano turing ang mga
001942,RB.* RB.* VB.* DT.* DT.* NN.*,RBK RBQ VBOF DTC DTCP NNC,kung paano ituring ang mga halamang-singaw,kung paano turing ang mga halaman
001943,RB.* VB.* DT.* DT.* NN.* CC.*,RBQ VBOF DTC DTCP NNC CCT,paano ituring ang mga halamang-singaw sa,paano turing ang mga halaman singaw
001944,VB.* DT.* DT.* NN.* CC.* DT.*,VBOF DTC DTCP NNC CCT DTCP,ituring ang mga halamang-singaw sa mga,turing ang mga halaman singaw sa
001945,DT.* DT.* NN.* CC.* DT.* NN.*,DTC DTCP NNC CCT DTCP NNC,ang mga halamang-singaw sa mga paa,ang mga halaman singaw sa mga
001946,DT.* NN.* CC.* DT.* NN.* CC.*,DTCP NNC CCT DTCP NNC CCB,mga halamang-singaw sa mga paa ng,mga halaman singaw sa mga paa
001947,NN.* CC.* DT.* NN.* CC.* DT.*,NNC CCT DTCP NNC CCB DTCP,halamang-singaw sa mga paa ng mga,halaman singaw sa mga paa ng
001948,CC.* DT.* NN.* CC.* DT.* NN.*,CCT DTCP NNC CCB DTCP NNC,sa mga paa ng mga doktor,singaw sa mga paa ng mga
001994,RB.* RB.* CC.* NN.* DT.* NN.*,RBK RBQ CCT NNC DTC NNC,kung paano sa singaw ang kuko,kung paano sa singaw ang kuko
001995,RB.* CC.* NN.* DT.* NN.* CC.*,RBQ CCT NNC DTC NNC CCT,paano sa singaw ang kuko sa,paano sa singaw ang kuko sa
001996,NN.* CC.* NN.* NN.* DT.* JJ.*,NNC CCT NNC NNC DTC JJCS_JJD,kuko sa paa halamang-singaw ang pinakamahusay,kuko sa paa halamangsingaw ang husay
001997,CC.* NN.* NN.* DT.* JJ.* CC.*,CCT NNC NNC DTC JJCS_JJD CCP,sa paa halamang-singaw ang pinakamahusay na,sa paa halamangsingaw ang husay na
001998,NN.* NN.* DT.* JJ.* CC.* NN.*,NNC NNC DTC JJCS_JJD CCP NNC,paa halamang-singaw ang pinakamahusay na paraan,paa halamangsingaw ang husay na paraan
001999,NN.* DT.* JJ.* CC.* NN.* CC.*,NNC DTC JJCS_JJD CCP NNC CCB,halamang-singaw ang pinakamahusay na paraan upang,halamangsingaw ang husay na paraan upa
002000,DT.* JJ.* CC.* NN.* CC.* VB.*,DTC JJCS_JJD CCP NNC CCB VBOF,ang pinakamahusay na paraan upang gamutin,ang husay na paraan upa gamot
002001,JJ.* CC.* NN.* CC.* VB.* DT.*,JJCS_JJD CCP NNC CCB VBOF DTC,pinakamahusay na paraan upang gamutin ang,husay na paraan upa gamot ang
002002,CC.* NN.* CC.* VB.* DT.* NN.*,CCP NNC CCB VBOF DTC NNC,na paraan upang gamutin ang kuko,na paraan upa gamot ang kuko
002003,NN.* CC.* VB.* DT.* NN.* NN.*,NNC CCB VBOF DTC NNC NNC,paraan upang gamutin ang kuko halamang-singaw,paraan upa gamot ang kuko halamangsingaw
002004,CC.* VB.* DT.* NN.* NN.* CC.*,CCB VBOF DTC NNC NNC CCT,upang gamutin ang kuko halamang-singaw sa,upa gamot ang kuko halamangsingaw sa
002005,VB.* DT.* NN.* NN.* CC.* PR.*,VBOF DTC NNC NNC CCT PRSP_CCP,gamutin ang kuko halamang-singaw sa aking,gamot ang kuko halamangsingaw sa akin
002006,DT.* NN.* NN.* CC.* PR.* DT.*,DTC NNC NNC CCT PRSP_CCP DTCP,ang kuko halamang-singaw sa aking mga,ang kuko halamangsingaw sa akin mga
002007,NN.* NN.* CC.* PR.* DT.* NN.*,NNC NNC CCT PRSP_CCP DTCP NNC,kuko halamang-singaw sa aking mga paa.,kuko halamangsingaw sa akin mga paa
002040,DT.* JJ.* CC.* NN.* CC.* CC.*,DTC JJCS_JJD CCP NNC CCT CCT,ang pinakamahusay na lunas para sa,ang husay na lunas para sa
002041,JJ.* CC.* NN.* CC.* CC.* DT.*,JJCS_JJD CCP NNC CCT CCT DTCP,pinakamahusay na lunas para sa mga,husay na lunas para sa mga
002042,CC.* NN.* CC.* CC.* DT.* NN.*,CCP NNC CCT CCT DTCP NNC,na lunas para sa mga halamang-singaw,na lunas para sa mga halamangsingaw
002043,CC.* DT.* NN.* CC.* NN.* CC.*,CCT DTCP NNC CCT NNC CCB,sa mga halamang-singaw sa pagitan ng,sa mga halamangsingaw sa pagitan ng
002044,DT.* NN.* CC.* NN.* CC.* DT.*,DTCP NNC CCT NNC CCB DTCP,mga halamang-singaw sa pagitan ng mga,mga halamangsingaw sa pagitan ng mga
002045,NN.* CC.* NN.* CC.* DT.* NN.*,NNC CCT NNC CCB DTCP NNC,halamang-singaw sa pagitan ng mga daliri,halamangsingaw sa pagitan ng mga daliri
002046,CC.* NN.* CC.* DT.* NN.* CC.*,CCT NNC CCB DTCP NNC CCT,sa pagitan ng mga daliri sa,sa pagitan ng mga daliri sa
002047,NN.* CC.* DT.* NN.* CC.* NN.*,NNC CCB DTCP NNC CCT NNC,pagitan ng mga daliri sa kamay,pagitan ng mga daliri sa kamay
002048,CC.* DT.* NN.* CC.* NN.* PR.*,CCB DTCP NNC CCT NNC PRQ,ng mga daliri sa kamay paano,ng mga daliri sa kamay paano
002049,DT.* NN.* CC.* NN.* PR.* VB.*,DTCP NNC CCT NNC PRQ VBW,mga daliri sa kamay paano mag-apply,mga daliri sa kamay paano magapply
002050,NN.* CC.* NN.* PR.* VB.* NN.*,NNC CCT NNC PRQ VBW NNC,daliri sa kamay paano mag-apply pamahid,daliri sa kamay paano magapply ahid
002051,CC.* NN.* PR.* VB.* NN.* NN.*,CCT NNC PRQ VBW NNC NNC,sa kamay paano mag-apply pamahid ekzoderil.,sa kamay paano magapply ahid ekzoderil
002089,NN.* CC.* NN.* CC.* DT.* NN.*,NNC CCB NNC CCT DTCP NNC,alak ng halamang-singaw sa mga kuko,alak ng halamangsingaw sa mga kuko
002090,CC.* NN.* CC.* DT.* NN.* CC.*,CCB NNC CCT DTCP NNC CCB,ng halamang-singaw sa mga kuko ng,ng halamangsingaw sa mga kuko ng
002091,NN.* CC.* DT.* NN.* CC.* DT.*,NNC CCT DTCP NNC CCB DTCP,halamang-singaw sa mga kuko ng mga,halamangsingaw sa mga kuko ng mga
002092,CC.* DT.* NN.* CC.* DT.* NN.*,CCT DTCP NNC CCB DTCP NNC,sa mga kuko ng mga kamay,sa mga kuko ng mga kamay
002093,CC.* DT.* NN.* NN.* NN.* CC.*,CCB DTCP NNC NNC NNC CCT,ng mga kamay kuko halamang-singaw sa,ng mga kamay kuko halamangsingaw sa
002094,DT.* NN.* NN.* NN.* CC.* PR.*,DTCP NNC NNC NNC CCT PRSP_CCP,mga kamay kuko halamang-singaw sa iyong,mga kamay kuko halamangsingaw sa iyo
002095,NN.* NN.* NN.* CC.* PR.* DT.*,NNC NNC NNC CCT PRSP_CCP DTCP,kamay kuko halamang-singaw sa iyong mga,kamay kuko halamangsingaw sa iyo mga
002096,NN.* NN.* CC.* PR.* DT.* NN.*,NNC NNC CCT PRSP_CCP DTCP NNC,kuko halamang-singaw sa iyong mga paa,kuko halamangsingaw sa iyo mga paa
002097,NN.* CC.* PR.* DT.* NN.* JJ.*,NNC CCT PRSP_CCP DTCP NNC JJC,halamang-singaw sa iyong mga paa kaysa,halamangsingaw sa iyo mga paa kaysa
002098,CC.* PR.* DT.* NN.* JJ.* CC.*,CCT PRSP_CCP DTCP NNC JJC CCT,sa iyong mga paa kaysa sa,sa iyo mga paa kaysa sa
002099,PR.* DT.* NN.* JJ.* CC.* VB.*,PRSP_CCP DTCP NNC JJC CCT VBW,iyong mga paa kaysa sa paggamot,iyo mga paa kaysa sa gamot
002100,DT.* NN.* JJ.* CC.* VB.* CC.*,DTCP NNC JJC CCT VBW CCT,mga paa kaysa sa paggamot sa,mga paa kaysa sa gamot sa
002101,NN.* JJ.* CC.* VB.* CC.* JJ.*,NNC JJC CCT VBW CCT JJD_CCP,paa kaysa sa paggamot sa murang.,paa kaysa sa gamot sa mura
002135,RB.* VB.* NN.* NN.* NN.* CC.*,RBD VBW NNC NNC NNC CCT,balakubak paggamot kuko halamang-singaw halamang-singaw sa,balakubak gamot kuko halamangsingaw halamangsingaw sa
002136,NN.* NN.* CC.* NN.* CC.* PR.*,NNC NNC CCT NNC CCT PRI_CCP,halamang-singaw halamang-singaw sa papa sa isang,halamangsingaw halamangsingaw sa papa sa isa
002137,NN.* CC.* NN.* CC.* PR.* JJ.*,NNC CCT NNC CCT PRI_CCP JJD,halamang-singaw sa papa sa isang matanda,halamangsingaw sa papa sa isa tanda
002138,CC.* NN.* CC.* PR.* JJ.* CC.*,CCT NNC CCT PRI_CCP JJD CCT,sa papa sa isang matanda sa,sa papa sa isa tanda sa
002139,NN.* CC.* PR.* JJ.* CC.* NN.*,NNC CCT PRI_CCP JJD CCT NNC,papa sa isang matanda sa pagitan,papa sa isa tanda sa pagitan
002140,CC.* PR.* JJ.* CC.* NN.* CC.*,CCT PRI_CCP JJD CCT NNC CCB,sa isang matanda sa pagitan ng,sa isa tanda sa pagitan ng
002141,PR.* JJ.* CC.* NN.* CC.* NN.*,PRI_CCP JJD CCT NNC CCB NNC,isang matanda sa pagitan ng puwit,isa tanda sa pagitan ng puwit
002142,JJ.* CC.* NN.* CC.* NN.* CC.*,JJD CCT NNC CCB NNC CCT,matanda sa pagitan ng puwit bilang,tanda sa pagitan ng puwit bilang
002143,CC.* NN.* CC.* NN.* CC.* PR.*,CCT NNC CCB NNC CCT PRI_CCP,sa pagitan ng puwit bilang isang,sa pagitan ng puwit bilang isa
002144,NN.* CC.* NN.* CC.* PR.* VB.*,NNC CCB NNC CCT PRI_CCP VBOF,pagitan ng puwit bilang isang gamutin.,pagitan ng puwit bilang isa gamot
002171,RB.* RB.* VB.* DT.* FW NN.*,RBK RBQ VBW DTC FW NNC,Kung paano mapupuksa ang forum halamang-singaw,kung paano puksa ang forom halamangsingaw
002172,RB.* VB.* DT.* FW NN.* CC.*,RBQ VBW DTC FW NNC CCB,paano mapupuksa ang forum halamang-singaw ng,paano puksa ang forom halamangsingaw ng
002173,VB.* DT.* FW NN.* CC.* NN.*,VBW DTC FW NNC CCB NNC,mapupuksa ang forum halamang-singaw ng kuko,puksa ang forom halamangsingaw ng kuko
002174,DT.* FW NN.* CC.* NN.* NN.*,DTC FW NNC CCB NNC NNP,ang forum halamang-singaw ng kuko Gawin,ang forom halamangsingaw ng kuko Gawin
002175,FW NN.* CC.* NN.* NN.* DT.*,FW NNC CCB NNC NNP DTC,forum halamang-singaw ng kuko Gawin ang,forom halamangsingaw ng kuko Gawin ang
002176,NN.* CC.* NN.* NN.* DT.* NN.*,NNC CCB NNC NNP DTC NNC,halamang-singaw ng kuko Gawin ang kuko,halamangsingaw ng kuko Gawin ang kuko
002177,CC.* NN.* NN.* DT.* NN.* NN.*,CCB NNC NNP DTC NNC NNC,ng kuko Gawin ang kuko halamang-singaw,ng kuko Gawin ang kuko halamangsingaw
002178,NN.* NN.* DT.* NN.* NN.* CC.*,NNC NNP DTC NNC NNC CCP,kuko Gawin ang kuko halamang-singaw na,kuko Gawin ang kuko halamangsingaw na
002179,NN.* DT.* NN.* NN.* CC.* VB.*,NNP DTC NNC NNC CCP VBTR,Gawin ang kuko halamang-singaw na nanggagaling,Gawin ang kuko halamangsingaw na galing
002180,DT.* NN.* NN.* CC.* VB.* CC.*,DTC NNC NNC CCP VBTR CCR,ang kuko halamang-singaw na nanggagaling kapag,ang kuko halamangsingaw na galing kapa
002197,DT.* JJ.* CC.* NN.* CC.* CC.*,DTCP JJD CCP NNC CCT CCT,mga bawal na gamot para sa,mga bawal na gamot para sa
002198,JJ.* CC.* NN.* CC.* CC.* NN.*,JJD CCP NNC CCT CCT NNC,bawal na gamot para sa paggamot,bawal na gamot para sa gamot
002199,CC.* NN.* CC.* CC.* NN.* CC.*,CCP NNC CCT CCT NNC CCB,na gamot para sa paggamot ng,na gamot para sa gamot ng
002200,CC.* NN.* CC.* NN.* CC.* DT.*,CCT NNC CCB NNC CCT DTCP,sa paggamot ng halamang-singaw sa mga,sa gamot ng halamangsingaw sa mga
002201,NN.* CC.* NN.* CC.* DT.* NN.*,NNC CCB NNC CCT DTCP NNC,paggamot ng halamang-singaw sa mga kamay,gamot ng halamangsingaw sa mga kamay
002202,CC.* NN.* CC.* DT.* NN.* NN.*,CCB NNC CCT DTCP NNC NNC,ng halamang-singaw sa mga kamay kuko,ng halamangsingaw sa mga kamay kuko
002230,JJ.* DT.* DT.* NN.* NN.* LM,JJD DTC DTCP NNC NNC LM,Sigurado ang mga paa halamang-singaw ay,sigurado ang mga paa halamangsingaw ay
002231,DT.* DT.* NN.* NN.* LM RB.*,DTC DTCP NNC NNC LM RBM,ang mga paa halamang-singaw ay maaaring,ang mga paa halamangsingaw ay ari
002232,DT.* NN.* NN.* LM RB.* VB.*,DTCP NNC NNC LM RBM VBAF,mga paa halamang-singaw ay maaaring humantong,mga paa halamangsingaw ay ari hantong
002233,NN.* NN.* LM RB.* VB.* CC.*,NNC NNC LM RBM VBAF CCT,paa halamang-singaw ay maaaring humantong sa,paa halamangsingaw ay ari hantong sa
002234,NN.* LM RB.* VB.* CC.* RB.*,NNC LM RBM VBAF CCT RBW,halamang-singaw ay maaaring humantong sa kanggrenahin,halamangsingaw ay ari hantong sa rena
002235,LM RB.* VB.* CC.* RB.* VB.*,LM RBM VBAF CCT RBW VBOF,ay maaaring humantong sa kanggrenahin alisin,ay ari hantong sa rena alis
002236,RB.* VB.* CC.* RB.* VB.* DT.*,RBM VBAF CCT RBW VBOF DTC,maaaring humantong sa kanggrenahin alisin ang,ari hantong sa rena alis ang
002237,VB.* CC.* RB.* VB.* DT.* FW,VBAF CCT RBW VBOF DTC FW,humantong sa kanggrenahin alisin ang fungus,hantong sa rena alis ang fungos
002238,CC.* RB.* VB.* DT.* FW LM,CCT RBW VBOF DTC FW LM,sa kanggrenahin alisin ang fungus ay,sa rena alis ang fungos ay
002239,RB.* VB.* DT.* FW LM VB.*,RBW VBOF DTC FW LM VBTR,kanggrenahin alisin ang fungus ay nangangahulugan,rena alis ang fungos ay angahulog
002265,NN.* NN.* LM DT.* NN.* DT.*,NNP NNC LM DTC NNC DTC,Kuko halamang-singaw ay ang sanhi ang,kuko halamangsingaw ay ang sanhi ang
002266,NN.* LM DT.* NN.* DT.* JJ.*,NNC LM DTC NNC DTC JJCS_JJD_CCP,halamang-singaw ay ang sanhi ang pinaka-epektibong,halamangsingaw ay ang sanhi ang epektibo
002267,LM DT.* NN.* DT.* JJ.* DT.*,LM DTC NNC DTC JJCS_JJD_CCP DTCP,ay ang sanhi ang pinaka-epektibong mga,ay ang sanhi ang epektibo mga
002268,DT.* NN.* DT.* JJ.* DT.* NN.*,DTC NNC DTC JJCS_JJD_CCP DTCP NNC,ang sanhi ang pinaka-epektibong mga gamot,ang sanhi ang epektibo mga gamot
002269,NN.* DT.* JJ.* DT.* NN.* NN.*,NNC DTC JJCS_JJD_CCP DTCP NNC NNC,sanhi ang pinaka-epektibong mga gamot halamang-singaw,sanhi ang epektibo mga gamot halamangsingaw
002270,DT.* JJ.* DT.* NN.* NN.* NN.*,DTC JJCS_JJD_CCP DTCP NNC NNC NNC,ang pinaka-epektibong mga gamot halamang-singaw paggamot,ang epektibo mga gamot halamangsingaw gamot
002299,DT.* JJ.* NN.* CC.* NN.* CC.*,DTC JJCS_JJD_CCP NNC CCB NNC CCT,ang pinaka-epektibong paggamot ng halamang-singaw sa,ang epektibo gamot ng halamangsingaw sa
002300,JJ.* NN.* CC.* NN.* CC.* NN.*,JJCS_JJD_CCP NNC CCB NNC CCT NNC,pinaka-epektibong paggamot ng halamang-singaw sa kuko,epektibo gamot ng halamangsingaw sa kuko
002301,NN.* CC.* NN.* CC.* NN.* RB.*,NNC CCB NNC CCT NNC RBK,paggamot ng halamang-singaw sa kuko kung,gamot ng halamangsingaw sa kuko kung
002302,CC.* NN.* CC.* NN.* RB.* RB.*,CCB NNC CCT NNC RBK RBQ,ng halamang-singaw sa kuko kung paano,ng halamangsingaw sa kuko kung paano
002303,NN.* CC.* NN.* RB.* RB.* VB.*,NNC CCT NNC RBK RBQ VBOF,halamang-singaw sa kuko kung paano gamutin,halamangsingaw sa kuko kung paano gamot
002304,CC.* NN.* RB.* RB.* VB.* DT.*,CCT NNC RBK RBQ VBOF DTC,sa kuko kung paano gamutin ang,sa kuko kung paano gamot ang
002305,NN.* RB.* RB.* VB.* DT.* PR.*,NNC RBK RBQ VBOF DTC PRI_CCP,kuko kung paano gamutin ang isang,kuko kung paano gamot ang isa
002306,RB.* RB.* VB.* DT.* PR.* NN.*,RBK RBQ VBOF DTC PRI_CCP NNC,kung paano gamutin ang isang kuba,kung paano gamot ang isa kuba
002307,RB.* VB.* DT.* PR.* NN.* NN.*,RBQ VBOF DTC PRI_CCP NNC NNC,paano gamutin ang isang kuba kuko.,paano gamot ang isa kuba kuko
002333,VB.* CC.* NN.* CC.* NN.* RB.*,VBAF CCB NNC CCT NNC RBK,Unguento ng halamang-singaw sa tainga kung,unguento ng halamangsingaw sa tainga kung
002334,CC.* NN.* CC.* NN.* RB.* RB.*,CCB NNC CCT NNC RBK RBQ,ng halamang-singaw sa tainga kung paano,ng halamangsingaw sa tainga kung paano
002335,NN.* CC.* NN.* RB.* RB.* VB.*,NNC CCT NNC RBK RBQ VBW,halamang-singaw sa tainga kung paano mapupuksa,halamangsingaw sa tainga kung paano puksa
002336,CC.* NN.* RB.* RB.* VB.* DT.*,CCT NNC RBK RBQ VBW DTC,sa tainga kung paano mapupuksa ang,sa tainga kung paano puksa ang
002337,NN.* RB.* RB.* VB.* DT.* DT.*,NNC RBK RBQ VBW DTC DTCP,tainga kung paano mapupuksa ang mga,tainga kung paano puksa ang mga
002338,RB.* RB.* VB.* DT.* DT.* NN.*,RBK RBQ VBW DTC DTCP NNC,kung paano mapupuksa ang mga halamang-singaw,kung paano puksa ang mga halamangsingaw
002339,RB.* VB.* DT.* DT.* NN.* CC.*,RBQ VBW DTC DTCP NNC CCT,paano mapupuksa ang mga halamang-singaw sa,paano puksa ang mga halamangsingaw sa
002340,VB.* DT.* DT.* NN.* CC.* NN.*,VBW DTC DTCP NNC CCT NNC,mapupuksa ang mga halamang-singaw sa kuko,puksa ang mga halamangsingaw sa kuko
002341,DT.* DT.* NN.* CC.* NN.* FW,DTC DTCP NNC CCT NNC FW,ang mga halamang-singaw sa kuko forum,ang mga halamangsingaw sa kuko forom
002357,NN.* RB.* VB.* NN.* NN.* NN.*,NNC RBW VBW NNP_CCP NNC NNC,paa halamang-singaw paggamot Paunang paa halamang-singaw.,paa halamangsingaw gamot Paunang paa halamangsingaw
002372,NN.* NN.* VB.* CC.* PR.* DT.*,NNC NNC VBW CCT PRSP_CCP DTCP,kuko halamang-singaw paggamot sa kanyang mga,kuko halamangsingaw gamot sa kanya mga
002373,NN.* VB.* CC.* PR.* DT.* NN.*,NNC VBW CCT PRSP_CCP DTCP NNC,halamang-singaw paggamot sa kanyang mga paa,halamangsingaw gamot sa kanya mga paa
002374,VB.* CC.* PR.* DT.* NN.* NN.*,VBW CCT PRSP_CCP DTCP NNC NNP,paggamot sa kanyang mga paa Litrato,gamot sa kanya mga paa Litrato
002406,VB.* DT.* NN.* CC.* PR.* DT.*,VBOF DTC NNC CCT PRSP_CCP DTCP,Gamutin ang halamang-singaw sa kanyang mga,gamot ang halamangsingaw sa kanya mga
002407,DT.* NN.* CC.* PR.* DT.* NN.*,DTC NNC CCT PRSP_CCP DTCP NNC,ang halamang-singaw sa kanyang mga paa,ang halamangsingaw sa kanya mga paa
002408,NN.* CC.* PR.* DT.* NN.* NN.*,NNC CCT PRSP_CCP DTCP NNC NNC,halamang-singaw sa kanyang mga paa ekzoderil,halamangsingaw sa kanya mga paa ekzoderil
002409,CC.* PR.* DT.* NN.* NN.* NN.*,CCT PRSP_CCP DTCP NNC NNC NNC,sa kanyang mga paa ekzoderil presyo,sa kanya mga paa ekzoderil presyo
002410,PR.* DT.* NN.* NN.* NN.* RB.*,PRSP_CCP DTCP NNC NNC NNC RBK,kanyang mga paa ekzoderil presyo kung,kanya mga paa ekzoderil presyo kung
002411,DT.* NN.* NN.* NN.* RB.* RB.*,DTCP NNC NNC NNC RBK RBQ,mga paa ekzoderil presyo kung paano,mga paa ekzoderil presyo kung paano
002412,NN.* NN.* NN.* RB.* RB.* CC.*,NNC NNC NNC RBK RBQ CCT,paa ekzoderil presyo kung paano sa,paa ekzoderil presyo kung paano sa
002413,NN.* NN.* RB.* RB.* CC.* VB.*,NNC NNC RBK RBQ CCT VBW,ekzoderil presyo kung paano sa paggamot,ekzoderil presyo kung paano sa gamot
002414,NN.* RB.* RB.* CC.* VB.* CC.*,NNC RBK RBQ CCT VBW CCT,presyo kung paano sa paggamot sa,presyo kung paano sa gamot sa
002415,RB.* RB.* CC.* VB.* CC.* PR.*,RBK RBQ CCT VBW CCT PRI_CCP,kung paano sa paggamot sa isang,kung paano sa gamot sa isa
002416,RB.* CC.* VB.* CC.* PR.* JJ.*,RBQ CCT VBW CCT PRI_CCP JJD,paano sa paggamot sa isang lamog,paano sa gamot sa isa lamo
002417,CC.* VB.* CC.* PR.* JJ.* NN.*,CCT VBW CCT PRI_CCP JJD NNC,sa paggamot sa isang lamog banda,sa gamot sa isa lamo banda
002418,VB.* CC.* PR.* JJ.* NN.* VB.*,VBW CCT PRI_CCP JJD NNC VBTS,paggamot sa isang lamog banda nail,gamot sa isa lamo banda nail
002461,RB.* JJ.* CC.* VB.* PR.* CC.*,RBF JJD CCP VBW PRP CCR,Hindi malayo na maetsapuwera sila dahil,hindi layo na etsapuwera sila dahil
002462,JJ.* CC.* VB.* PR.* CC.* CC.*,JJD CCP VBW PRP CCR CCT,malayo na maetsapuwera sila dahil sa,layo na etsapuwera sila dahil sa
002463,CC.* VB.* PR.* CC.* CC.* VB.*,CCP VBW PRP CCR CCT VBTR,na maetsapuwera sila dahil sa ibinibigay,na etsapuwera sila dahil sa bigay
002464,VB.* PR.* CC.* CC.* VB.* CC.*,VBW PRP CCR CCT VBTR CCP,maetsapuwera sila dahil sa ibinibigay na,etsapuwera sila dahil sa bigay na
002465,PR.* CC.* CC.* VB.* CC.* NN.*,PRP CCR CCT VBTR CCP NNC,sila dahil sa ibinibigay na pribilehiyo,sila dahil sa bigay na ribilehiyo
002466,CC.* CC.* VB.* CC.* NN.* CC.*,CCR CCT VBTR CCP NNC CCT,dahil sa ibinibigay na pribilehiyo sa,dahil sa bigay na ribilehiyo sa
002467,CC.* VB.* CC.* NN.* CC.* DT.*,CCT VBTR CCP NNC CCT DTCP,sa ibinibigay na pribilehiyo sa mga,sa bigay na ribilehiyo sa mga
002468,VB.* CC.* NN.* CC.* DT.* NN.*,VBTR CCP NNC CCT DTCP NNC,ibinibigay na pribilehiyo sa mga tsekwa,bigay na ribilehiyo sa mga sekwa
002469,CC.* NN.* CC.* DT.* NN.* CC.*,CCP NNC CCT DTCP NNC CCP,na pribilehiyo sa mga tsekwa na,na ribilehiyo sa mga sekwa na
002470,NN.* CC.* DT.* NN.* CC.* FW,NNC CCT DTCP NNC CCP FW,pribilehiyo sa mga tsekwa na umo­okupa,ribilehiyo sa mga sekwa na o\xadokupa
002471,CC.* DT.* NN.* CC.* FW FW,CCT DTCP NNC CCP FW FW,sa mga tsekwa na umo­okupa sa,sa mga sekwa na o\xadokupa sa
002472,DT.* NN.* CC.* FW FW CC.*,DTCP NNC CCP FW FW CCT,mga tsekwa na umo­okupa sa nasabing,mga sekwa na o\xadokupa sa sabi
002473,NN.* CC.* FW FW CC.* VB.*,NNC CCP FW FW CCT VBTS_CCP,tsekwa na umo­okupa sa nasabing mga,sekwa na o\xadokupa sa sabi mga
002474,CC.* FW FW CC.* VB.* DT.*,CCP FW FW CCT VBTS_CCP DTCP,na umo­okupa sa nasabing mga establisimiyento!,na o\xadokupa sa sabi mga establisimiyento
002519,VB.* DT.* NN.* CC.* RB.* RB.*,VBTS DTP NNP CCP RBF RBI,siniguro ni Dado na hindi na,siniguro ni Dado na hindi na
002520,DT.* NN.* CC.* RB.* RB.* PR.*,DTP NNP CCP RBF RBI PRS,ni Dado na hindi na siya,ni Dado na hindi na siya
002521,NN.* CC.* RB.* RB.* PR.* VB.*,NNP CCP RBF RBI PRS VBW,Dado na hindi na siya makakapagsalita,Dado na hindi na siya sala
002522,CC.* RB.* RB.* PR.* VB.* DT.*,CCP RBF RBI PRS VBW DTP,na hindi na siya makakapagsalita kay,na hindi na siya sala kay
002523,RB.* RB.* PR.* VB.* DT.* PR.*,RBF RBI PRS VBW DTP PRSP_CCP,hindi na siya makakapagsalita kay kanyang,hindi na siya sala kay kanya
002524,RB.* PR.* VB.* DT.* PR.* VB.*,RBI PRS VBW DTP PRSP_CCP VBOF,na siya makakapagsalita kay kanyang pinatay,na siya sala kay kanya patay
002525,PR.* VB.* DT.* PR.* VB.* VB.*,PRS VBW DTP PRSP_CCP VBOF VBS,siya makakapagsalita kay kanyang pinatay gamit,siya sala kay kanya patay gamit
002526,VB.* DT.* PR.* VB.* VB.* DT.*,VBW DTP PRSP_CCP VBOF VBS DTC,makakapagsalita kay kanyang pinatay gamit ang,sala kay kanya patay gamit ang
002527,DT.* PR.* VB.* VB.* DT.* PR.*,DTP PRSP_CCP VBOF VBS DTC PRI,kay kanyang pinatay gamit ang buo,kay kanya patay gamit ang buo
002528,PR.* VB.* VB.* DT.* PR.* PR.*,PRSP_CCP VBOF VBS DTC PRI PRS_CCP,kanyang pinatay gamit ang buo niyang,kanya patay gamit ang buo niya
002529,VB.* VB.* DT.* PR.* PR.* NN.*,VBOF VBS DTC PRI PRS_CCP NNC,pinatay gamit ang buo niyang lakas.,patay gamit ang buo niya lakas
002549,CC.* NN.* JJ.* CC.* DT.* PR.*,CCT NNC_CCP JJD CCP DTC PRSP_CCP,Sa pag-aakalang tapos na ang kanilang,sa akala tapos na ang nila
002550,NN.* JJ.* CC.* DT.* PR.* NN.*,NNC_CCP JJD CCP DTC PRSP_CCP NNC,pag-aakalang tapos na ang kanilang kalbaryo,akala tapos na ang nila baryo
002574,CC.* JJ.* DT.* VB.* NN.* PR.*,CCR JJCS DTC VBTS NNC PRS,kaya lubos ang naging galit niya,kaya lubos ang naging galit niya
002575,JJ.* DT.* VB.* NN.* PR.* CC.*,JJCS DTC VBTS NNC PRS CCT,lubos ang naging galit niya sa,lubos ang naging galit niya sa
002576,DT.* VB.* NN.* PR.* CC.* JJ.*,DTC VBTS NNC PRS CCT JJD_CCP,ang naging galit niya sa panlolokong,ang naging galit niya sa loko
002577,VB.* NN.* PR.* CC.* JJ.* VB.*,VBTS NNC PRS CCT JJD_CCP VBOF,naging galit niya sa panlolokong ginawa,naging galit niya sa loko gawa
002578,NN.* PR.* CC.* JJ.* VB.* CC.*,NNC PRS CCT JJD_CCP VBOF CCB,galit niya sa panlolokong ginawa ng,galit niya sa loko gawa ng
002579,PR.* CC.* JJ.* VB.* CC.* PR.*,PRS CCT JJD_CCP VBOF CCB PRSP_CCP,niya sa panlolokong ginawa ng kanyang,niya sa loko gawa ng kanya
002580,CC.* JJ.* VB.* CC.* PR.* NN.*,CCT JJD_CCP VBOF CCB PRSP_CCP NNC,sa panlolokong ginawa ng kanyang ina.,sa loko gawa ng kanya ina
002594,RB.* PR.* VB.* DT.* NN.* DT.*,RBW PRQ VBTF DTP NNP DTC,Hanggang kailan itatatago ni Enzo ang,hangga ilan tago ni Enzo ang
002595,PR.* VB.* DT.* NN.* DT.* NN.*,PRQ VBTF DTP NNP DTC NNC,kailan itatatago ni Enzo ang katotohanan?,ilan tago ni Enzo ang toi
002631,CC.* RB.* RB.* CC.* NN.* DT.*,CCT RBI RBI CCT NNC DTP,Kahit nga raw sa distrito ni,kahit nga raw sa distrito ni
002632,RB.* RB.* CC.* NN.* DT.* NN.*,RBI RBI CCT NNC DTP NNP,nga raw sa distrito ni Biazon,nga raw sa distrito ni Biazon
002633,RB.* CC.* NN.* DT.* NN.* LM,RBI CCT NNC DTP NNP LM,raw sa distrito ni Biazon ay,raw sa distrito ni Biazon ay
002634,CC.* NN.* DT.* NN.* LM VB.*,CCT NNC DTP NNP LM VBTS,sa distrito ni Biazon ay napansin,sa distrito ni Biazon ay pansin
002635,NN.* DT.* NN.* LM VB.* PR.*,NNC DTP NNP LM VBTS PRS,distrito ni Biazon ay napansin niya,distrito ni Biazon ay pansin niya
002636,DT.* NN.* LM VB.* PR.* CC.*,DTP NNP LM VBTS PRS CCP,ni Biazon ay napansin niya na,ni Biazon ay pansin niya na
002637,NN.* LM VB.* PR.* CC.* RB.*,NNP LM VBTS PRS CCP RBD_CCP,Biazon ay napansin niya na biglang,Biazon ay pansin niya na bigla
002638,LM VB.* PR.* CC.* RB.* VB.*,LM VBTS PRS CCP RBD_CCP VBTS,ay napansin niya na biglang naglipana,ay pansin niya na bigla lipana
002639,VB.* PR.* CC.* RB.* VB.* DT.*,VBTS PRS CCP RBD_CCP VBTS DTC,napansin niya na biglang naglipana ang,pansin niya na bigla lipana ang
002640,PR.* CC.* RB.* VB.* DT.* DT.*,PRS CCP RBD_CCP VBTS DTC DTCP,niya na biglang naglipana ang mga,niya na bigla lipana ang mga
002641,CC.* RB.* VB.* DT.* DT.* NN.*,CCP RBD_CCP VBTS DTC DTCP NNC,na biglang naglipana ang mga singkit,na bigla lipana ang mga singkit
002642,RB.* VB.* DT.* DT.* NN.* CC.*,RBD_CCP VBTS DTC DTCP NNC CCT,biglang naglipana ang mga singkit sa,bigla lipana ang mga singkit sa
002643,VB.* DT.* DT.* NN.* CC.* PR.*,VBTS DTC DTCP NNC CCT PRSP_CCP,naglipana ang mga singkit sa kanilang,lipana ang mga singkit sa nila
002644,DT.* DT.* NN.* CC.* PR.* NN.*,DTC DTCP NNC CCT PRSP_CCP NNC,ang mga singkit sa kanilang lugar!,ang mga singkit sa nila lugad
002679,RB.* RB.* JJ.* DT.* NN.* VB.*,RBK RBQ JJD DTC NNC VBW,kung gaano katagal ang paggaling pagkatapos,kung gaano tagal ang galing tapos
002680,RB.* JJ.* DT.* NN.* VB.* CC.*,RBQ JJD DTC NNC VBW CCB,gaano katagal ang paggaling pagkatapos ng,gaano tagal ang galing tapos ng
