N-Gram_ID,RoughPOS_N-Gram,DetailedPOS_N-Gram,N-Gram,Lemma_N-Gram
000019,VB.* PR.* CC.* NN.* RB.* CC.*,VBN PRS CCT NNC RBW CCR,wala ako sa katinuan ngayon kasi,wala ako sa tino gayon kasi
000020,PR.* CC.* NN.* RB.* CC.* CC.*,PRS CCT NNC RBW CCR CCT,ako sa katinuan ngayon kasi para,ako sa tino gayon kasi para
000021,CC.* NN.* RB.* CC.* CC.* PR.*,CCT NNC RBW CCR CCT PRS_CCP,sa katinuan ngayon kasi para akong,sa tino gayon kasi para ako
000022,NN.* RB.* CC.* CC.* PR.* VB.*,NNC RBW CCR CCT PRS_CCP VBTS,katinuan ngayon kasi para akong nakawalang,tino gayon kasi para ako wala
000023,RB.* CC.* CC.* PR.* VB.* CC.*,RBW CCR CCT PRS_CCP VBTS CCT,ngayon kasi para akong nakawalang sa,gayon kasi para ako wala sa
000024,CC.* CC.* PR.* VB.* CC.* NN.*,CCR CCT PRS_CCP VBTS CCT NNC,kasi para akong nakawalang sa hawla.,kasi para ako wala sa hawla
000056,RB.* RB.* DT.* NN.* NN.* LM,RBK RBQ DTC NNC NNC LM,Kung ano ang kapaligiran kadahilanan ay,kung ano ang ligid dahil ay
000057,RB.* DT.* NN.* NN.* LM JJ.*,RBQ DTC NNC NNC LM JJD,ano ang kapaligiran kadahilanan ay partikular,ano ang ligid dahil ay partikular
000058,DT.* NN.* NN.* LM JJ.* CC.*,DTC NNC NNC LM JJD CCP,ang kapaligiran kadahilanan ay partikular na,ang ligid dahil ay partikular na
000059,NN.* NN.* LM JJ.* CC.* JJ.*,NNC NNC LM JJD CCP JJD,kapaligiran kadahilanan ay partikular na mahalaga,ligid dahil ay partikular na halaga
000060,NN.* LM JJ.* CC.* JJ.* CC.*,NNC LM JJD CCP JJD CCT,kadahilanan ay partikular na mahalaga para,dahil ay partikular na halaga para
000061,LM JJ.* CC.* JJ.* CC.* CC.*,LM JJD CCP JJD CCT CCT,ay partikular na mahalaga para sa,ay partikular na halaga para sa
000062,JJ.* CC.* JJ.* CC.* CC.* NN.*,JJD CCP JJD CCT CCT NNC,partikular na mahalaga para sa buhay,partikular na halaga para sa buhay
000063,CC.* JJ.* CC.* CC.* NN.* CC.*,CCP JJD CCT CCT NNC CCB,na mahalaga para sa buhay ng,na halaga para sa buhay ng
000064,JJ.* CC.* CC.* NN.* CC.* DT.*,JJD CCT CCT NNC CCB DTCP,mahalaga para sa buhay ng mga,halaga para sa buhay ng mga
000065,CC.* CC.* NN.* CC.* DT.* NN.*,CCT CCT NNC CCB DTCP NNC,para sa buhay ng mga parasito,para sa buhay ng mga parasito
000066,CC.* NN.* CC.* DT.* NN.* VB.*,CCT NNC CCB DTCP NNC VBTR,sa buhay ng mga parasito aalala,sa buhay ng mga parasito alala
000067,NN.* CC.* DT.* NN.* VB.* RB.*,NNC CCB DTCP NNC VBTR RBR,buhay ng mga parasito aalala tungkol,buhay ng mga parasito alala tungkol
000068,CC.* DT.* NN.* VB.* RB.* CC.*,CCB DTCP NNC VBTR RBR CCT,ng mga parasito aalala tungkol sa,ng mga parasito alala tungkol sa
000069,DT.* NN.* VB.* RB.* CC.* DT.*,DTCP NNC VBTR RBR CCT DTCP,mga parasito aalala tungkol sa mga,mga parasito alala tungkol sa mga
000070,NN.* VB.* RB.* CC.* DT.* NN.*,NNC VBTR RBR CCT DTCP NNC,parasito aalala tungkol sa mga uod,parasito alala tungkol sa mga uod
000071,VB.* RB.* CC.* DT.* NN.* CC.*,VBTR RBR CCT DTCP NNC CCT,aalala tungkol sa mga uod sa,alala tungkol sa mga uod sa
000072,RB.* CC.* DT.* NN.* CC.* RB.*,RBR CCT DTCP NNC CCT RBW,tungkol sa mga uod sa gabi,tungkol sa mga uod sa gabi
000105,JJ.* CC.* VB.* DT.* DT.* NN.*,JJC CCB VBOF DTC DTCP NNC,kaysa upang dalhin ang mga uod,kaysa upa dalhin ang mga uod
000106,CC.* VB.* DT.* DT.* NN.* CC.*,CCB VBOF DTC DTCP NNC CCT,upang dalhin ang mga uod sa,upa dalhin ang mga uod sa
000107,VB.* DT.* DT.* NN.* CC.* PR.*,VBOF DTC DTCP NNC CCT PRI_CCP,dalhin ang mga uod sa isang,dalhin ang mga uod sa isa
000108,DT.* DT.* NN.* CC.* PR.* NN.*,DTC DTCP NNC CCT PRI_CCP NNC,ang mga uod sa isang buntis,ang mga uod sa isa buntis
000109,DT.* NN.* CC.* PR.* NN.* CC.*,DTCP NNC CCT PRI_CCP NNC CCP,mga uod sa isang buntis na,mga uod sa isa buntis na
000110,NN.* CC.* PR.* NN.* CC.* NN.*,NNC CCT PRI_CCP NNC CCP NNC,uod sa isang buntis na babae,uod sa isa buntis na babae
000111,CC.* PR.* NN.* CC.* NN.* NN.*,CCT PRI_CCP NNC CCP NNC NNC,sa isang buntis na babae gamot,sa isa buntis na babae gamot
000112,PR.* NN.* CC.* NN.* NN.* CC.*,PRI_CCP NNC CCP NNC NNC CCT,isang buntis na babae gamot sa,isa buntis na babae gamot sa
000136,NN.* JJ.* NN.* NN.* CC.* VB.*,NNC_CCP JJD NNC NNC CCP VBTR_VBAF,bulating parasito atay sugat na pumapatay,bulate parasito patay sugat na patay
000137,JJ.* NN.* NN.* CC.* VB.* CC.*,JJD NNC NNC CCP VBTR_VBAF CCB,parasito atay sugat na pumapatay ng,parasito patay sugat na patay ng
000138,NN.* NN.* CC.* VB.* CC.* DT.*,NNC NNC CCP VBTR_VBAF CCB DTCP,atay sugat na pumapatay ng mga,patay sugat na patay ng mga
000139,NN.* CC.* VB.* CC.* DT.* NN.*,NNC CCP VBTR_VBAF CCB DTCP NNC,sugat na pumapatay ng mga parasito,sugat na patay ng mga parasito
000140,CC.* VB.* CC.* DT.* NN.* CC.*,CCP VBTR_VBAF CCB DTCP NNC CCT,na pumapatay ng mga parasito sa,na patay ng mga parasito sa
000141,VB.* CC.* DT.* NN.* CC.* NN.*,VBTR_VBAF CCB DTCP NNC CCT NNC,pumapatay ng mga parasito sa loob,patay ng mga parasito sa loob
000142,CC.* DT.* NN.* CC.* NN.* CC.*,CCB DTCP NNC CCT NNC CCB,ng mga parasito sa loob ng,ng mga parasito sa loob ng
000143,DT.* NN.* CC.* NN.* CC.* NN.*,DTCP NNC CCT NNC CCB NNC,mga parasito sa loob ng tao.,mga parasito sa loob ng tao
000162,RB.* RB.* VB.* DT.* DT.* NN.*,RBK RBQ VBW DTC DTCP NNC,Kung paano makilala ang mga uod,kung paano kilala ang mga uod
000163,RB.* VB.* DT.* DT.* NN.* CC.*,RBQ VBW DTC DTCP NNC CCT,paano makilala ang mga uod sa,paano kilala ang mga uod sa
000164,VB.* DT.* DT.* NN.* CC.* DT.*,VBW DTC DTCP NNC CCT DTCP,makilala ang mga uod sa mga,kilala ang mga uod sa mga
000165,DT.* DT.* NN.* CC.* DT.* NN.*,DTC DTCP NNC CCT DTCP NNC,ang mga uod sa mga matatanda,ang mga uod sa mga tanda
000166,NN.* CC.* CC.* NN.* CC.* DT.*,NNC CCT CCT NNC CCB DTCP,pagsubok para sa presensiya ng mga,subok para sa presensiya ng mga
000167,CC.* CC.* NN.* CC.* DT.* NN.*,CCT CCT NNC CCB DTCP NNC,para sa presensiya ng mga parasito,para sa presensiya ng mga parasito
000180,JJ.* CC.* PR.* RB.* DT.* VB.*,JJCC CCR PRI RBI DTC VBTR,lalo pag isa lang ang ginagawa,lalo pag isa lang ang gawa
000215,RB.* CC.* RB.* VB.* DT.* PR.*,RBF CCR RBT VBW DTC PRI,Di kasi talaga matuto ang karamihan,di kasi talaga tuto ang dami
000216,CC.* RB.* VB.* DT.* PR.* CC.*,CCR RBT VBW DTC PRI CCB,kasi talaga matuto ang karamihan ng,kasi talaga tuto ang dami ng
000217,RB.* VB.* DT.* PR.* CC.* NN.*,RBT VBW DTC PRI CCB NNP,talaga matuto ang karamihan ng Pilipino,talaga tuto ang dami ng Pilipino
000218,VB.* DT.* PR.* CC.* NN.* CC.*,VBW DTC PRI CCB NNP CCP,matuto ang karamihan ng Pilipino na,tuto ang dami ng Pilipino na
000219,DT.* PR.* CC.* NN.* CC.* VB.*,DTC PRI CCB NNP CCP VBAF,ang karamihan ng Pilipino na bumoto,ang dami ng Pilipino na boto
000220,PR.* CC.* NN.* CC.* VB.* CC.*,PRI CCB NNP CCP VBAF CCB,karamihan ng Pilipino na bumoto ng,dami ng Pilipino na boto ng
000221,CC.* NN.* CC.* VB.* CC.* JJ.*,CCB NNP CCP VBAF CCB JJN,ng Pilipino na bumoto ng karapat,ng Pilipino na boto ng dapat
000222,NN.* CC.* VB.* CC.* JJ.* VB.*,NNP CCP VBAF CCB JJN VBS,Pilipino na bumoto ng karapat dapat,Pilipino na boto ng dapat dapat
000223,CC.* VB.* CC.* JJ.* VB.* CC.*,CCP VBAF CCB JJN VBS CCP,na bumoto ng karapat dapat na,na boto ng dapat dapat na
000224,VB.* CC.* JJ.* VB.* CC.* VB.*,VBAF CCB JJN VBS CCP VBW,bumoto ng karapat dapat na mamuno,boto ng dapat dapat na muno
000225,CC.* JJ.* VB.* CC.* VB.* CC.*,CCB JJN VBS CCP VBW CCT,ng karapat dapat na mamuno kahit,ng dapat dapat na muno kahit
000226,JJ.* VB.* CC.* VB.* CC.* RB.*,JJN VBS CCP VBW CCT RBI,karapat dapat na mamuno kahit man,dapat dapat na muno kahit man
000227,VB.* CC.* VB.* CC.* RB.* RB.*,VBS CCP VBW CCT RBI RBI,dapat na mamuno kahit man lang,dapat na muno kahit man lang
000228,CC.* VB.* CC.* RB.* RB.* CC.*,CCP VBW CCT RBI RBI CCT,na mamuno kahit man lang sa,na muno kahit man lang sa
000229,VB.* CC.* RB.* RB.* CC.* PR.*,VBW CCT RBI RBI CCT PRSP_CCP,mamuno kahit man lang sa kanilang,muno kahit man lang sa nila
000230,CC.* RB.* RB.* CC.* PR.* NN.*,CCT RBI RBI CCT PRSP_CCP NNC,kahit man lang sa kanilang baranggay.,kahit man lang sa nila baranggay
000258,DT.* VB.* CC.* DT.* NN.* LM,DTC VBW CCB DTCP NNC LM,ang pag-kakahiwahiwalay ng mga pulo ay,ang hiwalay ng mga pulo ay
000259,VB.* CC.* DT.* NN.* LM LM,VBW CCB DTCP NNC LM LM,pag-kakahiwahiwalay ng mga pulo ay nakakapang,hiwalay ng mga pulo ay hina
000260,CC.* DT.* NN.* LM LM VB.*,CCB DTCP NNC LM LM VBTR,ng mga pulo ay nakakapang pahina,ng mga pulo ay hina ng
000261,DT.* NN.* LM LM VB.* NN.*,DTCP NNC LM LM VBTR NNC,mga pulo ay nakakapang pahina ng,mga pulo ay hina ng atin
000274,VB.* PR.* VB.* FW FW CC.*,VBTF PRP_CCP VBW FW FW CCR,mahihirapan tayong mag tipon tipon dahil,hirap tayo tipon dahil hiwalay nga
000275,PR.* VB.* FW FW CC.* VB.*,PRP_CCP VBW FW FW CCR VBTR,tayong mag tipon tipon dahil hiwahiwalay,tayo tipon dahil hiwalay nga ang
000276,VB.* FW FW CC.* VB.* RB.*,VBW FW FW CCR VBTR RBI,mag tipon tipon dahil hiwahiwalay nga,tipon dahil hiwalay nga ang mga
000311,CC.* CC.* VB.* PR.* PR.* VB.*,CCR CCR VBN PRO PRP VBW,dahil kapag wala ito tayo magkagulo-gulo,dahil kapag wala ito tayo gulo
000312,CC.* VB.* PR.* PR.* VB.* JJ.*,CCR VBN PRO PRP VBW JJCC,kapag wala ito tayo magkagulo-gulo lalo,kapag wala ito tayo gulo lalo
000313,VB.* PR.* PR.* VB.* JJ.* CC.*,VBN PRO PRP VBW JJCC CCP,wala ito tayo magkagulo-gulo lalo na,wala ito tayo gulo lalo na
000314,PR.* PR.* VB.* JJ.* CC.* PR.*,PRO PRP VBW JJCC CCP PRO_CCP,ito tayo magkagulo-gulo lalo na iyong,ito tayo gulo lalo na iyo
000315,PR.* VB.* JJ.* CC.* PR.* DT.*,PRP VBW JJCC CCP PRO_CCP DTCP,tayo magkagulo-gulo lalo na iyong mga,tayo gulo lalo na iyo mga
000316,VB.* JJ.* CC.* PR.* DT.* NN.*,VBW JJCC CCP PRO_CCP DTCP NNC_CCP,magkagulo-gulo lalo na iyong mga taong,gulo lalo na iyo mga tao
000317,JJ.* CC.* PR.* DT.* NN.* JJ.*,JJCC CCP PRO_CCP DTCP NNC_CCP JJD,lalo na iyong mga taong salat,lalo na iyo mga tao salat
000318,CC.* PR.* DT.* NN.* JJ.* CC.*,CCP PRO_CCP DTCP NNC_CCP JJD CCT,na iyong mga taong salat sa,na iyo mga tao salat sa
000319,PR.* DT.* NN.* JJ.* CC.* NN.*,PRO_CCP DTCP NNC_CCP JJD CCT NNC,iyong mga taong salat sa edukasyon,iyo mga tao salat sa edukasyon
000320,DT.* NN.* JJ.* CC.* NN.* CC.*,DTCP NNC_CCP JJD CCT NNC CCT,mga taong salat sa edukasyon para,mga tao salat sa edukasyon para
000321,NN.* JJ.* CC.* NN.* CC.* VB.*,NNC_CCP JJD CCT NNC CCT VBW,taong salat sa edukasyon para magsalita,tao salat sa edukasyon para salita
000322,JJ.* CC.* NN.* CC.* VB.* CC.*,JJD CCT NNC CCT VBW CCB,salat sa edukasyon para magsalita ng,salat sa edukasyon para salita ng
000323,CC.* NN.* CC.* VB.* CC.* NN.*,CCT NNC CCT VBW CCB NNC_CCP,sa edukasyon para magsalita ng salitang,sa edukasyon para salita ng salita
000324,NN.* CC.* VB.* CC.* NN.* NN.*,NNC CCT VBW CCB NNC_CCP NNC,edukasyon para magsalita ng salitang banyaga….,edukasyon para salita ng salita banyaga
000345,NN.* DT.* VB.* CC.* NN.* JJ.*,NNP DTC VBRF CCB NNC_CCP JJD,Tagalog ang pinagbatayan ng wikang pambansa,tagalog ang batay ng wika bansa
000354,PR.* LM RB.* VB.* CC.* PR.*,PRO LM RBD_CCP VBW CCB PRI,ito ay napakadaling matutunan ng sinuman.,ito ay dali tuto ng sino
000374,VB.* CC.* CD.* NN.* CC.* VB.*,VBAF CCT CDB NNC CCP VBTS,kumpara sa 571 krimen na naitala,kumpara sa 570 kirmen na tala
000375,CC.* CD.* NN.* CC.* VB.* RB.*,CCT CDB NNC CCP VBTS RBW_CCP,sa 571 krimen na naitala noong,sa 570 kirmen na tala noon
000376,CD.* NN.* CC.* VB.* RB.* NN.*,CDB NNC CCP VBTS RBW_CCP NNP,571 krimen na naitala noong Hunyo,570 kirmen na tala noon Hunyo
000377,NN.* CC.* VB.* RB.* NN.* CC.*,NNC CCP VBTS RBW_CCP NNP CCB,krimen na naitala noong Hunyo ng,kirmen na tala noon Hunyo ng
000378,CC.* VB.* RB.* NN.* CC.* NN.*,CCP VBTS RBW_CCP NNP CCB NNC_CCP,na naitala noong Hunyo ng taong,na tala noon Hunyo ng taon
000379,VB.* RB.* NN.* CC.* NN.* PR.*,VBTS RBW_CCP NNP CCB NNC_CCP PRO,naitala noong Hunyo ng taong ito.,tala noon Hunyo ng taon ito
000410,VB.* RB.* DT.* NN.* CC.* CD.*,VBAF RBI DTC NNC CCB CDB,Bumaba rin ang krimen ng 46,baba rin ang krimen ng 46
000411,RB.* DT.* NN.* CC.* CD.* NN.*,RBI DTC NNC CCB CDB NNC,rin ang krimen ng 46 porsiyento,rin ang krimen ng 46 porsiyento
000412,DT.* NN.* CC.* CD.* NN.* NN.*,DTC NNC CCB CDB NNC NNC,ang krimen ng 46 porsiyento kumpara,ang krimen ng 46 porsiyento kumpara
000413,NN.* CC.* CD.* NN.* NN.* CC.*,NNC CCB CDB NNC NNC CCT,krimen ng 46 porsiyento kumpara sa,krimen ng 46 porsiyento kumpara sa
000414,CC.* CD.* NN.* NN.* CC.* VB.*,CCB CDB NNC NNC CCT VBTS_CCP,ng 46 porsiyento kumpara sa naitalang,ng 46 porsiyento kumpara sa tala
000415,CD.* NN.* NN.* CC.* VB.* CD.*,CDB NNC NNC CCT VBTS_CCP CDB,46 porsiyento kumpara sa naitalang 905,46 porsiyento kumpara sa tala 905
000416,NN.* NN.* CC.* VB.* CD.* NN.*,NNC NNC CCT VBTS_CCP CDB NNC,porsiyento kumpara sa naitalang 905 kaso,porsiyento kumpara sa tala 905 kaso
000417,NN.* CC.* VB.* CD.* NN.* RB.*,NNC CCT VBTS_CCP CDB NNC RBW_CCP,kumpara sa naitalang 905 kaso noong,kumpara sa tala 905 kaso noon
000418,CC.* VB.* CD.* NN.* RB.* NN.*,CCT VBTS_CCP CDB NNC RBW_CCP NNP,sa naitalang 905 kaso noong Hulyo,sa tala 905 kaso noon Hulyo
000419,VB.* CD.* NN.* RB.* NN.* CD.*,VBTS_CCP CDB NNC RBW_CCP NNP CDB,naitalang 905 kaso noong Hulyo 2015,tala 905 kaso noon Hulyo 2015
000439,LM CC.* RB.* RB.* CC.* JJ.*,LM CCR RBI RBI CCT JJN_CCP,ay dahil na rin sa pina-igting,ay dahil na rin sa igting
000440,CC.* RB.* RB.* CC.* JJ.* CC.*,CCR RBI RBI CCT JJN_CCP CCP,dahil na rin sa pina-igting na,dahil na rin sa igting na
000441,RB.* RB.* CC.* JJ.* CC.* NN.*,RBI RBI CCT JJN_CCP CCP NNC,na rin sa pina-igting na kampanya,na rin sa igting na kampanya
000442,RB.* CC.* JJ.* CC.* NN.* NN.*,RBI CCT JJN_CCP CCP NNC NNC,rin sa pina-igting na kampanya laban,rin sa igting na kampanya laban
000443,CC.* JJ.* CC.* NN.* NN.* CC.*,CCT JJN_CCP CCP NNC NNC CCT,sa pina-igting na kampanya laban sa,sa igting na kampanya laban sa
000444,JJ.* CC.* NN.* NN.* CC.* NN.*,JJN_CCP CCP NNC NNC CCT NNC,"pina-igting na kampanya laban sa kriminalidad,",igting na kampanya laban sa riminalidad
000455,VB.* PR.* CC.* JJ.* CC.* NN.*,VBTS PRP CCB JJD CCT NNP,"Natapos kayo ng matagumpay sa Fukuoka,",tapos kayo ng tagumpay sa Fukuoka
000471,JJ.* NN.* PR.* VB.* CC.* PR.*,JJN_CCP NNC PRP_CCP VBTS CCT PRI_CCP,unang beses kaming nakapunta sa ibang,unang beses kami punta sa iba
000472,NN.* PR.* VB.* CC.* PR.* DT.*,NNC PRP_CCP VBTS CCT PRI_CCP DTCP,beses kaming nakapunta sa ibang mga,beses kami punta sa iba mga
000473,PR.* VB.* CC.* PR.* DT.* NN.*,PRP_CCP VBTS CCT PRI_CCP DTCP NNC,"kaming nakapunta sa ibang mga lugar,",kami punta sa iba mga lugad
000484,VB.* PR.* DT.* NN.* PR.* PM.*,VBTS PRS DTC NNC CCB NNC,naramdaman ko ang kalakihan ng responsibilidad,naramdaman ko ang laki ng responsibilidad
000496,VB.* PR.* VB.* DT.* NN.* CC.*,VBTS PRP_CCP VBW DTC NNC CCB,Nagawa naming maranasan ang kultura ng,awa namin ranas ang kultura ng
000497,PR.* VB.* DT.* NN.* CC.* DT.*,PRP_CCP VBW DTC NNC CCB DTCP,naming maranasan ang kultura ng mga,namin ranas ang kultura ng mga
000498,VB.* DT.* NN.* CC.* DT.* NN.*,VBW DTC NNC CCB DTCP NNP,maranasan ang kultura ng mga Hapon,ranas ang kultura ng mga Hapon
000509,CC.* VB.* PR.* RB.* RB.* PR.*,CCR VBTF PRP RBK RBQ PRP,Kung sasabihin namin kung bakit namin,kung sabi namin kung bakit namin
000510,VB.* PR.* RB.* RB.* PR.* VB.*,VBTF PRP RBK RBQ PRP VBTS,sasabihin namin kung bakit namin naalala,sabi namin kung bakit namin alala
000511,PR.* RB.* RB.* PR.* VB.* PR.*,PRP RBK RBQ PRP VBTS PRO,namin kung bakit namin naalala iyon,namin kung bakit namin alala iyon
000523,VB.* PR.* RB.* RB.* DT.* VB.*,VBTR PRP RBK RBQ DTC VBTR,nakakalimutan namin kung ano ang natutunan,nakakalimutan namin kung ano ang tunan
000524,PR.* RB.* RB.* DT.* VB.* PR.*,PRP RBK RBQ DTC VBTR PRP,namin kung ano ang natutunan namin.,namin kung ano ang tunan namin
000536,CC.* CC.* VB.* CC.* JJ.* DT.*,CCT CCP VBW CCB JJD_CCP DTCP,Imbis na matuto ng bagong mga,imbis na tuto ng bago mga
000537,CC.* VB.* CC.* JJ.* DT.* NN.*,CCP VBW CCB JJD_CCP DTCP NNC,na matuto ng bagong mga salita,na tuto ng bago mga salita
000558,CC.* PR.* DT.* CD.* NN.* VB.*,CCT PRQ DTC CDB NNC_CCP VBTS,pero ano ang una ninyong inisip,pero ano ang una ninyo isip
000559,PR.* DT.* CD.* NN.* VB.* DT.*,PRQ DTC CDB NNC_CCP VBTS RBW_CCP,ano ang una ninyong inisip noong,ano ang una ninyo isip noo
000560,DT.* CD.* NN.* VB.* DT.* NN.*,DTC CDB NNC_CCP VBTS RBW_CCP JJN_CCP,ang una ninyong inisip noong unang,ang una ninyo isip noo una
000561,CD.* NN.* VB.* DT.* NN.* PR.*,CDB NNC_CCP VBTS RBW_CCP JJN_CCP NNC,una ninyong inisip noong unang beses,una ninyo isip noo una beses
000562,NN.* VB.* DT.* NN.* PR.* PM.*,NNC_CCP VBTS RBW_CCP JJN_CCP NNC PRP,ninyong inisip noong unang beses niyo,ninyo isip noo una beses niyo
000584,CC.* NN.* PR.* JJ.* CC.* NN.*,CCT NNC PRS JJD CCB NNC,Sa tingin ko perpekto ng kanta,sa tingin ko perpekto ng kanta
000585,NN.* PR.* JJ.* CC.* NN.* PR.*,NNC PRS JJD CCB NNC PRO,tingin ko perpekto ng kanta iyon,tingin ko perpekto ng kanta iyon
000586,PR.* JJ.* CC.* NN.* PR.* CC.*,PRS JJD CCB NNC PRO CCT,ko perpekto ng kanta iyon para,ko perpekto ng kanta iyon para
000587,JJ.* CC.* NN.* PR.* CC.* CC.*,JJD CCB NNC PRO CCT CCT,perpekto ng kanta iyon para sa,perpekto ng kanta iyon para sa
000588,CC.* NN.* PR.* CC.* CC.* PR.*,CCB NNC PRO CCT CCT PRSP,ng kanta iyon para sa amin.,ng kanta iyon para sa amin
000602,PR.* DT.* NN.* DT.* JJ.* VB.*,PRI_CCP DTCP NNC DTC JJCC VBAF,Maraming mga bahagi ang mas gumanda.,rami mga bahagi ang mas ganda
000614,PR.* DT.* NN.* CC.* NN.* RB.*,PRQ DTC NNC CCT NNC RBW,Ano ang pakiramdam sa pagkanta ulit,ano ang kiramdam sa kanta ulit
000615,DT.* NN.* CC.* NN.* RB.* CC.*,DTC NNC CCT NNC RBW CCB,ang pakiramdam sa pagkanta ulit ng,ang kiramdam sa kanta ulit ng
000616,NN.* CC.* NN.* RB.* CC.* NN.*,NNC CCT NNC RBW CCB NNC_CCP,pakiramdam sa pagkanta ulit ng kantang,kiramdam sa kanta ulit ng kanta
000617,CC.* NN.* RB.* CC.* NN.* PR.*,CCT NNC RBW CCB NNC_CCP PRO,sa pagkanta ulit ng kantang ito?,sa kanta ulit ng kanta ito
000630,CC.* PR.* PR.* NN.* CC.* JJ.*,CCR PRI PRO_CCP NNC CCP JJD,kaya isa itong kanta na pamilyar,kaya isa ito kanta na ilyad
000631,PR.* PR.* NN.* CC.* JJ.* CC.*,PRI PRO_CCP NNC CCP JJD CCP,isa itong kanta na pamilyar na,isa ito kanta na ilyad na
000632,PR.* NN.* CC.* JJ.* CC.* PR.*,PRO_CCP NNC CCP JJD CCP PRP,itong kanta na pamilyar na kami,ito kanta na ilyad na kami
000647,CC.* VB.* PR.* DT.* NN.* RB.*,CCT VBW PRP DTC NNC RBW,para mapanatili namin ang pakiramdam nung,para natili namin ang kiramdam nung
000648,VB.* PR.* DT.* NN.* RB.* JJ.*,VBW PRP DTC NNC RBW JJD,mapanatili namin ang pakiramdam nung orihinal,natili namin ang kiramdam nung orihinal
000649,PR.* DT.* NN.* RB.* JJ.* CC.*,PRP DTC NNC RBW JJD CCP,namin ang pakiramdam nung orihinal na,namin ang kiramdam nung orihinal na
000650,DT.* NN.* RB.* JJ.* CC.* NN.*,DTC NNC RBW JJD CCP NNC,ang pakiramdam nung orihinal na bersyon,ang kiramdam nung orihinal na bersyon
000666,VB.* DT.* PR.* NN.* DT.* VB.*,VBH_CCP DTCP PRI_CCP NNC DTC VBS,mayroong mga ibang bahagi ang dapat,mayroong mga iba bahagi ang dapat
000667,DT.* PR.* NN.* DT.* VB.* CC.*,DTCP PRI_CCP NNC DTC VBS CCP,mga ibang bahagi ang dapat na,mga iba bahagi ang dapat na
000668,PR.* NN.* DT.* VB.* CC.* VB.*,PRI_CCP NNC DTC VBS CCP VBW,ibang bahagi ang dapat na mapalitan.,iba bahagi ang dapat na litan
000684,RB.* PR.* JJ.* CC.* VB.* DT.*,RBF PRS JJD CCP VBOF DTC,hindi ako sanay na sabihin ang,hindi ako sanay na sabi ang
000685,PR.* JJ.* CC.* VB.* DT.* PR.*,PRS JJD CCP VBOF DTC PRI,ako sanay na sabihin ang karamihan,ako sanay na sabi ang rami
000686,JJ.* CC.* VB.* DT.* PR.* CC.*,JJD CCP VBOF DTC PRI CCT,sanay na sabihin ang karamihan sa,sanay na sabi ang rami sa
000687,CC.* VB.* DT.* PR.* CC.* DT.*,CCP VBOF DTC PRI CCT DTCP,na sabihin ang karamihan sa mga,na sabi ang rami sa mga
000688,VB.* DT.* PR.* CC.* DT.* NN.*,VBOF DTC PRI CCT DTCP NNC,sabihin ang karamihan sa mga salita.,sabi ang rami sa mga salita
000697,RB.* RB.* CC.* RB.* JJ.* NN.*,RBF RBI CCT RBF JJD NNPA,Hindi naman sa hindi mahirap (tumawa).,hindi naman sa hindi hirap tawa
000720,VB.* DT.* NN.* CC.* CC.* VB.*,VBH_CCP DTCP NNC CCP CCR VBTS,Mayroong mga salita na kapag namali,roon mga salita na kapa ali
000721,DT.* NN.* CC.* CC.* VB.* PR.*,DTCP NNC CCP CCR VBTS PRS,mga salita na kapag namali ka,mga salita na kapa ali ka
000722,NN.* CC.* CC.* VB.* PR.* CC.*,NNC CCP CCR VBTS PRS CCB,salita na kapag namali ka ng,salita na kapa ali ka ng
000723,CC.* CC.* VB.* PR.* CC.* NN.*,CCP CCR VBTS PRS CCB NNC,na kapag namali ka ng pagsabi,na kapa ali ka ng pagsabi
000724,CC.* VB.* PR.* CC.* NN.* LM,CCR VBTS PRS CCB NNC LM,kapag namali ka ng pagsabi ay,kapa ali ka ng pagsabi ay
000725,VB.* PR.* CC.* NN.* LM VB.*,VBTS PRS CCB NNC LM VBW,namali ka ng pagsabi ay maiiba,ali ka ng pagsabi ay iba
000726,PR.* CC.* NN.* LM VB.* DT.*,PRS CCB NNC LM VBW DTC,ka ng pagsabi ay maiiba ung,ka ng pagsabi ay iba ung
000727,CC.* NN.* LM VB.* DT.* VB.*,CCB NNC LM VBW DTC VBS,ng pagsabi ay maiiba ung ibig,ng pagsabi ay iba ung ibig
000728,NN.* LM VB.* DT.* VB.* VB.*,NNC LM VBW DTC VBS VBOF,pagsabi ay maiiba ung ibig sabihin,pagsabi ay iba ung ibig sabi
000748,NN.* PR.* PR.* RB.* VB.* PR.*,NNC PRS_CCP PRI RBW VBW PRS,Mukha siyang iba nang magsuot siya,mukha siya iba nang suot siya
000749,PR.* PR.* RB.* VB.* PR.* CC.*,PRS_CCP PRI RBW VBW PRS CCB,siyang iba nang magsuot siya ng,siya iba nang suot siya ng
000750,PR.* RB.* VB.* PR.* CC.* NN.*,PRI RBW VBW PRS CCB NNC,iba nang magsuot siya ng salamin,iba nang suot siya ng salam
000763,VB.* PR.* RB.* JJ.* NN.* PR.*,VBS PRS RBI JJD_CCP NNC PRS,akala ko nga bagong miyembro siya,akala ko nga bago miyembro siya
000764,PR.* RB.* JJ.* NN.* PR.* NN.*,PRS RBI JJD_CCP NNC PRS NNPA,ko nga bagong miyembro siya (tumawa).,ko nga bago miyembro siya tawa
000773,RB.* PR.* JJ.* CC.* NN.* CC.*,RBF PRP JJD CCP NNC CCP,Hindi namin orihinal na intensyon na,hindi namin orihinal na tensyon na
000774,PR.* JJ.* CC.* NN.* CC.* VB.*,PRP JJD CCP NNC CCP VBOF,namin orihinal na intensyon na gawin,namin orihinal na tensyon na gawin
000775,JJ.* CC.* NN.* CC.* VB.* PR.*,JJD CCP NNC CCP VBOF PRO,orihinal na intensyon na gawin iyon,orihinal na tensyon na gawin iyon
000787,VB.* RB.* CC.* DT.* NN.* CC.*,VBS RBI CCB DTCP NNC CCP,Sabi rin ng mga miyembro na,sabi rin ng mga miyembro na
000788,RB.* CC.* DT.* NN.* CC.* PM.*,RBI CCB DTCP NNC CCP PMS,"rin ng mga miyembro na ""Maganda",rin ng mga miyembro na Maganda
000789,CC.* DT.* NN.* CC.* PM.* JJ.*,CCB DTCP NNC CCP PMS JJD,"ng mga miyembro na ""Maganda naman",ng mga miyembro na Maganda naman
000803,CC.* NN.* PR.* PR.* PR.* VB.*,CCT NNC PRS PRI PRP_CCP VBTS_CCP,sa tingin ko marami kaming ipinakitang,sa tingin ko rami kami kita
000804,NN.* PR.* PR.* PR.* VB.* NN.*,NNC PRS PRI PRP_CCP VBTS_CCP NNC,tingin ko marami kaming ipinakitang mukha.,tingin ko rami kami kita mukha
000816,PR.* DT.* VB.* PR.* CC.* VB.*,PRQ DTC VBTF PRP CCP VBTF,ano ang masasabi niyo na mararanasan,ano ang sabi niyo na danas
000817,DT.* VB.* PR.* CC.* VB.* PR.*,DTC VBTF PRP CCP VBTF PRP,ang masasabi niyo na mararanasan niyo,ang sabi niyo na danas niyo
000818,VB.* PR.* CC.* VB.* PR.* PR.*,VBTF PRP CCP VBTF PRP PRO,masasabi niyo na mararanasan niyo ito,sabi niyo na danas niyo ito
000819,PR.* CC.* VB.* PR.* PR.* CC.*,PRP CCP VBTF PRP PRO CCT,niyo na mararanasan niyo ito sa,niyo na danas niyo ito sa
000820,CC.* VB.* PR.* PR.* CC.* NN.*,CCP VBTF PRP PRO CCT NNP,na mararanasan niyo ito sa Japan?,na danas niyo ito sa Japan
000839,VB.* PR.* RB.* VB.* PR.* PR.*,VBTS PRS RBW VBW PRS PRO_CCP,nasiyahan ako nang makita ko ung,nasiyahan ako nang kita ko ung
000840,PR.* RB.* VB.* PR.* PR.* NN.*,PRS RBW VBW PRS PRO_CCP NNP,ako nang makita ko ung Gundam,ako nang kita ko ung Gundam
000841,RB.* VB.* PR.* PR.* NN.* CC.*,RBW VBW PRS PRO_CCP NNP CCT,nang makita ko ung Gundam sa,nang kita ko ung Gundam sa
000842,VB.* PR.* PR.* NN.* CC.* NN.*,VBW PRS PRO_CCP NNP CCT NNP,makita ko ung Gundam sa Odaiba.,kita ko ung Gundam sa Odaiba
000857,VB.* PR.* RB.* LM VB.* PR.*,VBS PRS RBT LM VBTF PRO,akala ko talaga ay lilipad ito,akala ko talaga ay lipad ito
000858,PR.* RB.* LM VB.* PR.* CC.*,PRS RBT LM VBTF PRO CCT,ko talaga ay lilipad ito sa,ko talaga ay lipad ito sa
000859,RB.* LM VB.* PR.* CC.* NN.*,RBT LM VBTF PRO CCT NNC,talaga ay lilipad ito sa langit,talaga ay lipad ito sa langit
000860,LM VB.* PR.* CC.* NN.* NN.*,LM VBTF PRO CCT NNC NNPA,ay lilipad ito sa langit (tumawa).,ay lipad ito sa langit tawa
000877,VB.* CC.* PR.* DT.* NN.* CC.*,VBTS CCP PRP DTC NNC CCP,Narinig na namin ang lugar na,rinig na namin ang lugar na
000878,CC.* PR.* DT.* NN.* CC.* PR.*,CCP PRP DTC NNC CCP PRO,na namin ang lugar na ito,na namin ang lugar na ito
000879,PR.* DT.* NN.* CC.* PR.* CC.*,PRP DTC NNC CCP PRO CCT,namin ang lugar na ito sa,namin ang lugar na ito sa
000880,DT.* NN.* CC.* PR.* CC.* DT.*,DTC NNC CCP PRO CCT DTCP,ang lugar na ito sa mga,ang lugar na ito sa mga
000881,NN.* CC.* PR.* CC.* DT.* NN.*,NNC CCP PRO CCT DTCP NNC,lugar na ito sa mga taga-Japan,lugar na ito sa mga Japan
000888,CC.* VB.* JJ.* CC.* VB.* PR.*,CCR VBTF JJD CCR VBTF PRP,kaya magiging maganda kung masisiyahan kayo.,kaya igi ganda kung siya kayo
000904,CC.* VB.* PR.* CC.* VB.* RB.*,CCR VBTF PRP CCR VBTF RBD_CCP,kaya matutuwa kami kung makukuha niyong,kaya tuwa kami kung kuha niyo
000905,VB.* PR.* CC.* VB.* RB.* VB.*,VBTF PRP CCR VBTF RBD_CCP VBW,matutuwa kami kung makukuha niyong mahalin,tuwa kami kung kuha niyo halin
000906,PR.* CC.* VB.* RB.* VB.* DT.*,PRP CCR VBTF RBD_CCP VBW DTC,kami kung makukuha niyong mahalin ang,kami kung kuha niyo halin ang
000907,CC.* VB.* RB.* VB.* DT.* NN.*,CCR VBTF RBD_CCP VBW DTC NNC_CCP,kung makukuha niyong mahalin ang kantang,kung kuha niyo halin ang kanta
000908,VB.* RB.* VB.* DT.* NN.* PR.*,VBTF RBD_CCP VBW DTC NNC_CCP PRO,makukuha niyong mahalin ang kantang ito.,kuha niyo halin ang kanta ito
000932,CC.* VB.* PR.* RB.* CC.* JJ.*,CCT VBS PRP RBI CCP JJCC,pero alam niyo ba na mas,pero alam niyo ba na mas
000933,VB.* PR.* RB.* CC.* JJ.* JJ.*,VBS PRP RBI CCP JJCC JJD_CCP,alam niyo ba na mas masayang,alam niyo ba na mas sayang
000934,PR.* RB.* CC.* JJ.* JJ.* VB.*,PRP RBI CCP JJCC JJD_CCP VBW,niyo ba na mas masayang makita,niyo ba na mas sayang kita
