N-Gram_ID,RoughPOS_N-Gram,DetailedPOS_N-Gram,N-Gram,Lemma_N-Gram
002681,JJ.* DT.* NN.* VB.* CC.* NN.*,JJD DTC NNC VBW CCB NNC,katagal ang paggaling pagkatapos ng dibdib,tagal ang galing tapos ng dibdib
002682,DT.* NN.* VB.* CC.* NN.* VB.*,DTC NNC VBW CCB NNC VBW,ang paggaling pagkatapos ng dibdib mammoplasty,ang galing tapos ng dibdib moplasty
002683,NN.* VB.* CC.* NN.* VB.* RB.*,NNC VBW CCB NNC VBW RBK,paggaling pagkatapos ng dibdib mammoplasty kung,galing tapos ng dibdib moplasty kung
002684,VB.* CC.* NN.* VB.* RB.* RB.*,VBW CCB NNC VBW RBK RBQ,pagkatapos ng dibdib mammoplasty kung paano,tapos ng dibdib moplasty kung paano
002685,CC.* NN.* VB.* RB.* RB.* VB.*,CCB NNC VBW RBK RBQ VBTF,ng dibdib mammoplasty kung paano dagdagan,ng dibdib moplasty kung paano dagan
002686,NN.* VB.* RB.* RB.* VB.* DT.*,NNC VBW RBK RBQ VBTF DTC,dibdib mammoplasty kung paano dagdagan ang,dibdib moplasty kung paano dagan ang
002687,VB.* RB.* RB.* VB.* DT.* NN.*,VBW RBK RBQ VBTF DTC NNC,mammoplasty kung paano dagdagan ang dibdib,moplasty kung paano dagan ang dibdib
002688,RB.* RB.* VB.* DT.* NN.* VB.*,RBK RBQ VBTF DTC NNC VBS,kung paano dagdagan ang dibdib gamit,kung paano dagan ang dibdib gamit
002689,RB.* VB.* DT.* NN.* VB.* NN.*,RBQ VBTF DTC NNC VBS NNC,paano dagdagan ang dibdib gamit pagsasanay.,paano dagan ang dibdib gamit sanay
002709,DT.* NN.* LM RB.* VB.* JJ.*,DTC NNC LM RBM VBW JJD,Ang kalusugan ay maaaring maging negatibo,ang lusog ay ari maging negatibo
002710,NN.* LM RB.* VB.* JJ.* DT.*,NNC LM RBM VBW JJD DTC,kalusugan ay maaaring maging negatibo ang,lusog ay ari maging negatibo ang
002711,LM RB.* VB.* JJ.* DT.* NN.*,LM RBM VBW JJD DTC NNC,ay maaaring maging negatibo ang kahulugan,ay ari maging negatibo ang hulog
002728,VB.* CC.* DT.* NN.* CC.* VB.*,VBTR_VBAF CCT DTC NNC CCP VBW,gumagana bilang ang kakayahan na malabanan,gumagana bilang ang kaya na laban
002729,CC.* DT.* NN.* CC.* VB.* DT.*,CCT DTC NNC CCP VBW DTC,bilang ang kakayahan na malabanan ang,bilang ang kaya na laban ang
002730,DT.* NN.* CC.* VB.* DT.* NN.*,DTC NNC CCP VBW DTC NNC,ang kakayahan na malabanan ang araw-,ang kaya na laban ang araw
002731,NN.* CC.* VB.* DT.* NN.* PM.*,NNC CCP VBW DTC NNC PMS,kakayahan na malabanan ang araw- araw.,kaya na laban ang araw araw
002750,JJ.* JJ.* CC.* VB.* CC.* DT.*,JJCC JJD CCP VBW CCB DTCP,mas mahusay na magdala ng mga,mas husay na dala ng mga
002751,JJ.* CC.* VB.* CC.* DT.* NN.*,JJD CCP VBW CCB DTCP NNC,mahusay na magdala ng mga parasito,husay na dala ng mga rasito
002752,CC.* VB.* CC.* DT.* NN.* CC.*,CCP VBW CCB DTCP NNC CCB,na magdala ng mga parasito Upang,na dala ng mga rasito Upang
002753,VB.* CC.* DT.* NN.* CC.* VB.*,VBW CCB DTCP NNC CCB VBW,magdala ng mga parasito Upang masuri,dala ng mga rasito Upang suri
002754,CC.* DT.* NN.* CC.* VB.* CC.*,CCB DTCP NNC CCB VBW CCT,ng mga parasito Upang masuri para,ng mga rasito Upang suri para
002755,DT.* NN.* CC.* VB.* CC.* CC.*,DTCP NNC CCB VBW CCT CCT,mga parasito Upang masuri para sa,mga rasito Upang suri para sa
002756,NN.* CC.* VB.* CC.* CC.* DT.*,NNC CCB VBW CCT CCT DTCP,parasito Upang masuri para sa mga,rasito Upang suri para sa mga
002757,CC.* VB.* CC.* CC.* DT.* NN.*,CCB VBW CCT CCT DTCP NNC,Upang masuri para sa mga parasito.,Upang suri para sa mga rasito
002791,RB.* RB.* CC.* NN.* RB.* PR.*,RBK RBQ CCP NNC RBW PRI_CCP,kung paano na baybayin nang isang,kung paano na baybayin nang isa
002792,RB.* CC.* NN.* RB.* PR.* NN.*,RBQ CCP NNC RBW PRI_CCP NNC,paano na baybayin nang isang parasito,paano na baybayin nang isa rasito
002793,CC.* NN.* RB.* PR.* NN.* RB.*,CCP NNC RBW PRI_CCP NNC RBK,na baybayin nang isang parasito kung,na baybayin nang isa rasito kung
002794,NN.* RB.* PR.* NN.* RB.* RB.*,NNC RBW PRI_CCP NNC RBK RBQ,baybayin nang isang parasito kung ano,baybayin nang isa rasito kung ano
002795,RB.* PR.* NN.* RB.* RB.* DT.*,RBW PRI_CCP NNC RBK RBQ DTC,nang isang parasito kung ano ang,nang isa rasito kung ano ang
002796,PR.* NN.* RB.* RB.* DT.* DT.*,PRI_CCP NNC RBK RBQ DTC DTCP,isang parasito kung ano ang mga,isa rasito kung ano ang mga
002797,NN.* RB.* RB.* DT.* DT.* NN.*,NNC RBK RBQ DTC DTCP NNC,parasito kung ano ang mga parasito,rasito kung ano ang mga rasito
002798,RB.* RB.* DT.* DT.* NN.* LM,RBK RBQ DTC DTCP NNC LM,kung ano ang mga parasito ay,kung ano ang mga rasito ay
002799,RB.* DT.* DT.* NN.* LM VB.*,RBQ DTC DTCP NNC LM VBS,ano ang mga parasito ay dapat,ano ang mga rasito ay dapat
002800,DT.* DT.* NN.* LM VB.* VB.*,DTC DTCP NNC LM VBS VBAF,ang mga parasito ay dapat magpasuri.,ang mga rasito ay dapat suri
002827,PR.* DT.* VB.* CC.* DT.* NN.*,PRQ DTC VBTF CCB DTCP NNC,Ano ang magagawa ng mga magulang,ano ang agawa ng mga ulan
002828,DT.* VB.* CC.* DT.* NN.* CC.*,DTC VBTF CCB DTCP NNC CCB,ang magagawa ng mga magulang ng,ang agawa ng mga ulan ng
002829,VB.* CC.* DT.* NN.* CC.* JJ.*,VBTF CCB DTCP NNC CCB JJD_CCP,magagawa ng mga magulang ng batang,agawa ng mga ulan ng bata
002830,CC.* DT.* NN.* CC.* JJ.* VB.*,CCB DTCP NNC CCB JJD_CCP VBTR,ng mga magulang ng batang binakunahan,ng mga ulan ng bata bakuna
002831,DT.* NN.* CC.* JJ.* VB.* CC.*,DTCP NNC CCB JJD_CCP VBTR CCB,mga magulang ng batang binakunahan ng,mga ulan ng bata bakuna ng
002832,NN.* CC.* JJ.* VB.* CC.* NN.*,NNC CCB JJD_CCP VBTR CCB NNP,magulang ng batang binakunahan ng Dengvaxia?,ulan ng bata bakuna ng Dengvaxia
002841,FW FW FW DT.* NN.* CC.*,FW FW FW DTC NNC CCB,varicella zoster virus ang dahilan ng,varicella osted viros ang dahil ng
002842,FW FW DT.* NN.* CC.* NN.*,FW FW DTC NNC CCB NNC,zoster virus ang dahilan ng pagkakaroon,osted viros ang dahil ng roon
002843,FW DT.* NN.* CC.* NN.* CC.*,FW DTC NNC CCB NNC CCB,virus ang dahilan ng pagkakaroon ng,viros ang dahil ng roon ng
002876,DT.* DT.* NN.* VB.* RB.* CC.*,DTC DTCP NNC_CCP VBTS RBI CCB,Ang mga taong nakaranas na ng,ang mga tao ranas na ng
002877,DT.* NN.* VB.* RB.* CC.* NN.*,DTCP NNC_CCP VBTS RBI CCB NNC,mga taong nakaranas na ng bulutong,mga tao ranas na ng buluto
002878,NN.* VB.* RB.* CC.* NN.* LM,NNC_CCP VBTS RBI CCB NNC LM,taong nakaranas na ng bulutong ay,tao ranas na ng buluto ay
002879,VB.* RB.* CC.* NN.* LM RB.*,VBTS RBI CCB NNC LM RBW_CCP,nakaranas na ng bulutong ay kadalasang,ranas na ng buluto ay dalasa
002880,RB.* CC.* NN.* LM RB.* RB.*,RBI CCB NNC LM RBW_CCP RBF,na ng bulutong ay kadalasang hindi,na ng buluto ay dalasa hindi
002881,CC.* NN.* LM RB.* RB.* CC.*,CCB NNC LM RBW_CCP RBF CCP,ng bulutong ay kadalasang hindi na,ng buluto ay dalasa hindi na
002882,NN.* LM RB.* RB.* CC.* RB.*,NNC LM RBW_CCP RBF CCP RBW,bulutong ay kadalasang hindi na ulit,buluto ay dalasa hindi na ulit
002883,LM RB.* RB.* CC.* RB.* VB.*,LM RBW_CCP RBF CCP RBW VBTF,ay kadalasang hindi na ulit magkakasakit,ay dalasa hindi na ulit sakit
002884,RB.* RB.* CC.* RB.* VB.* CC.*,RBW_CCP RBF CCP RBW VBTF CCB,kadalasang hindi na ulit magkakasakit ng,dalasa hindi na ulit sakit ng
002885,RB.* CC.* RB.* VB.* CC.* PR.*,RBF CCP RBW VBTF CCB PRC,hindi na ulit magkakasakit ng ganito.,hindi na ulit sakit ng ganito
002904,NN.* PM.* NN.* PR.* LM JJ.*,NNP PMS NNCA PRO LM JJCS_JJD,Bagama't ito ay pinakakaraniwan sa mga,bagamat ito ay karaniwan sa mga
002905,PM.* NN.* PR.* LM JJ.* CC.*,PMS NNCA PRO LM JJCS_JJD CCT,ito ay pinakakaraniwan sa mga kabataan.,ito ay karaniwan sa mga bata
002915,PR.* DT.* JJ.* NN.* CC.* NN.*,PRQ DTC JJD_CCP NNC CCT NNC,Paano ang tamang pag-aalaga sa mukha?,paano ang tama alaga sa mukha
002929,JJ.* CC.* NN.* CC.* VB.* CC.*,JJCS_JJD CCP NNC CCB VBW CCB,pinakamabilis na paraan upang mawalan ng,pinakamabilis na paraan upa walan ng
002930,CC.* NN.* CC.* VB.* CC.* NN.*,CCP NNC CCB VBW CCB NNC,na paraan upang mawalan ng timbang,na paraan upa walan ng timbang
002931,NN.* CC.* VB.* CC.* NN.* CC.*,NNC CCB VBW CCB NNC CCT,paraan upang mawalan ng timbang sa,paraan upa walan ng timbang sa
002932,CC.* VB.* CC.* NN.* CC.* NN.*,CCB VBW CCB NNC CCT NNC,upang mawalan ng timbang sa bahay,upa walan ng timbang sa bahay
002933,VB.* CC.* NN.* CC.* NN.* CC.*,VBW CCB NNC CCT NNC CCT,mawalan ng timbang sa bahay para,walan ng timbang sa bahay para
002934,NN.* CC.* NN.* CC.* CC.* PR.*,NNC CCT NNC CCT CCT PRI_CCP,timbang sa bahay para sa isang,timbang sa bahay para sa isa
002935,CC.* NN.* CC.* CC.* PR.* NN.*,CCT NNC CCT CCT PRI_CCP NNC,sa bahay para sa isang linggo,sa bahay para sa isa linggo
002963,CC.* VB.* RB.* RB.* VB.* DT.*,CCB VBW RBK RBQ VBW DTC,Upang maunawaan kung paano makalkula ang,upa unawa kung paano kula ang
002964,VB.* RB.* RB.* VB.* DT.* NN.*,VBW RBK RBQ VBW DTC NNC,maunawaan kung paano makalkula ang bubong,unawa kung paano kula ang bubo
002965,RB.* RB.* VB.* DT.* NN.* CC.*,RBK RBQ VBW DTC NNC CCB,kung paano makalkula ang bubong ng,kung paano kula ang bubo ng
002966,RB.* VB.* DT.* NN.* CC.* PR.*,RBQ VBW DTC NNC CCB PRI_CCP,paano makalkula ang bubong ng isang,paano kula ang bubo ng isa
002967,VB.* DT.* NN.* CC.* PR.* NN.*,VBW DTC NNC CCB PRI_CCP NNC,makalkula ang bubong ng isang kahoy,kula ang bubo ng isa kahoy
002968,DT.* NN.* CC.* PR.* NN.* CC.*,DTC NNC CCB PRI_CCP NNC CCP,ang bubong ng isang kahoy na,ang bubo ng isa kahoy na
002969,NN.* CC.* PR.* NN.* CC.* NN.*,NNC CCB PRI_CCP NNC CCP NNC,bubong ng isang kahoy na bahay,bubo ng isa kahoy na bahay
002995,VB.* PR.* NN.* DT.* PR.* NN.*,VBS PRS_CCP NNC DTC PRI_CCP NNC,dapat mong pag-aralan ang buong sistema,dapat mong aral ang buo sistema
002996,PR.* NN.* DT.* PR.* NN.* CC.*,PRS_CCP NNC DTC PRI_CCP NNC CCB,mong pag-aralan ang buong sistema ng,mong aral ang buo sistema ng
002997,NN.* DT.* PR.* NN.* CC.* NN.*,NNC DTC PRI_CCP NNC CCB NNC,pag-aralan ang buong sistema ng pagtatayo,aral ang buo sistema ng tayo
002998,DT.* PR.* NN.* CC.* NN.* PR.*,DTC PRI_CCP NNC CCB NNC PRO,ang buong sistema ng pagtatayo nito,ang buo sistema ng tayo nito
002999,PR.* NN.* CC.* NN.* PR.* NN.*,PRI_CCP NNC CCB NNC PRO NNPA,buong sistema ng pagtatayo nito (mas,buo sistema ng tayo nito mas
003000,NN.* CC.* NN.* PR.* NN.* JJ.*,NNC CCB NNC PRO NNPA JJCC,sistema ng pagtatayo nito (mas detalyado:,sistema ng tayo nito mas detalyado
003018,LM RB.* VB.* VB.* CC.* PR.*,LM RBF VBS VBAF CCT PRSP,ay hindi dapat magsama sa kanila,ay hindi dapat sama sa nila
003019,RB.* VB.* VB.* CC.* PR.* CC.*,RBF VBS VBAF CCT PRSP CCT,hindi dapat magsama sa kanila sa,hindi dapat sama sa nila sa
003020,VB.* VB.* CC.* PR.* CC.* PR.*,VBS VBAF CCT PRSP CCT PRI_CCP,dapat magsama sa kanila sa isang,dapat sama sa nila sa isa
003021,VB.* CC.* PR.* CC.* PR.* NN.*,VBAF CCT PRSP CCT PRI_CCP NNC,magsama sa kanila sa isang punto.,sama sa nila sa isa punto
003034,CC.* VB.* RB.* CC.* DT.* JJ.*,CCP VBTS RBR CCT DTCP JJD_CCP,na isinagawa alinsunod sa mga modernong,na sagawa alinsunod sa mga moderno
003035,VB.* RB.* CC.* DT.* JJ.* NN.*,VBTS RBR CCT DTCP JJD_CCP NNC,isinagawa alinsunod sa mga modernong teknolohiya,sagawa alinsunod sa mga moderno teknolohiya
003053,RB.* RB.* DT.* PR.* CC.* DT.*,RBK RBQ DTC PRQ CCT DTCP,kung saan ang ilan sa mga,kung saan ang ilan sa mga
003054,RB.* DT.* PR.* CC.* DT.* NN.*,RBQ DTC PRQ CCT DTCP NNC,saan ang ilan sa mga lugar,saan ang ilan sa mga lugad
003055,DT.* PR.* CC.* DT.* NN.* LM,DTC PRQ CCT DTCP NNC LM,ang ilan sa mga lugar ay,ang ilan sa mga lugad ay
003056,PR.* CC.* DT.* NN.* LM NN.*,PRQ CCT DTCP NNC LM NNC,ilan sa mga lugar ay tirahan.,ilan sa mga lugad ay tirahan
003071,CC.* VB.* DT.* JJ.* CC.* VB.*,CCB VBW DTC JJCS_JJD CCP VBAF,upang makamit ang pinakamataas na magkasanib,upang kamit ang taas na sanib
003072,VB.* DT.* JJ.* CC.* VB.* CC.*,VBW DTC JJCS_JJD CCP VBAF CCP,makamit ang pinakamataas na magkasanib na,kamit ang taas na sanib na
003073,DT.* JJ.* CC.* VB.* CC.* NN.*,DTC JJCS_JJD CCP VBAF CCP NNC,ang pinakamataas na magkasanib na densidad,ang taas na sanib na densidad
003096,CC.* RB.* DT.* NN.* CC.* PR.*,CCR RBW DTC NNC CCP PRO,Kung minsan ang materyal na ito,kung minsan ang teryal na ito
003097,RB.* DT.* NN.* CC.* PR.* LM,RBW DTC NNC CCP PRO LM,minsan ang materyal na ito ay,minsan ang teryal na ito ay
003098,DT.* NN.* CC.* PR.* LM VB.*,DTC NNC CCP PRO LM VBTR,ang materyal na ito ay tinatawag,ang teryal na ito ay tawag
003099,NN.* CC.* PR.* LM VB.* RB.*,NNC CCP PRO LM VBTR RBI_CCP,materyal na ito ay tinatawag ding,teryal na ito ay tawag ding
003100,CC.* PR.* LM VB.* RB.* NN.*,CCP PRO LM VBTR RBI_CCP NNC,na ito ay tinatawag ding kahoy,na ito ay tawag ding kahoy
003101,PR.* LM VB.* RB.* NN.* CC.*,PRO LM VBTR RBI_CCP NNC CCP,ito ay tinatawag ding kahoy na,ito ay tawag ding kahoy na
003102,LM VB.* RB.* NN.* CC.* JJ.*,LM VBTR RBI_CCP NNC CCP JJD_CCP,ay tinatawag ding kahoy na panghaliling,ay tawag ding kahoy na halil
003103,VB.* RB.* NN.* CC.* JJ.* NN.*,VBTR RBI_CCP NNC CCP JJD_CCP NNC,tinatawag ding kahoy na panghaliling daan.,tawag ding kahoy na halil daan
003123,VB.* CC.* PR.* NN.* CC.* CC.*,VBW CCB PRI_CCP NNC CCT CCT,Magpakita ng isang proseso para sa,kita ng isa roseso para sa
003124,CC.* PR.* NN.* CC.* CC.* NN.*,CCB PRI_CCP NNC CCT CCT NNC,ng isang proseso para sa paggawa,ng isa roseso para sa gawa
003125,PR.* NN.* CC.* CC.* NN.* CC.*,PRI_CCP NNC CCT CCT NNC CCB,isang proseso para sa paggawa ng,isa roseso para sa gawa ng
003126,CC.* CC.* NN.* CC.* NN.* RB.*,CCT CCT NNC CCB NNC RBW,para sa paggawa ng produkto hangga’t,para sa gawa ng rodukto hangga’t
003127,CC.* NN.* CC.* NN.* RB.* NN.*,CCT NNC CCB NNC RBW NNCA,sa paggawa ng produkto hangga’t maaari.,sa gawa ng rodukto hangga’t ari
003145,VB.* CC.* DT.* NN.* CC.* VB.*,VBS CCB DTCP NNC CCP VBOF,Gusto ng mga tao na panoorin,gusto ng mga tao na orin
003146,CC.* DT.* NN.* CC.* VB.* DT.*,CCB DTCP NNC CCP VBOF DTC,ng mga tao na panoorin ang,ng mga tao na orin ang
003147,DT.* NN.* CC.* VB.* DT.* NN.*,DTCP NNC CCP VBOF DTC NNC,mga tao na panoorin ang artisan,mga tao na orin ang artis
003148,NN.* CC.* VB.* DT.* NN.* CC.*,NNC CCP VBOF DTC NNC CCT,tao na panoorin ang artisan sa,tao na orin ang artis sa
003149,CC.* VB.* DT.* NN.* CC.* NN.*,CCP VBOF DTC NNC CCT NNC,na panoorin ang artisan sa trabaho.,na orin ang artis sa trabaho
003162,VB.* RB.* RB.* DT.* PR.* VB.*,VBTS_VBOF RBK RBQ DTC PRSP_CCP VBTR,Ipaliwanag kung ano ang iyong ginagawa,liwanag kung ano ang iyo gawa
003187,VB.* CC.* DT.* NN.* CC.* NN.*,VBW CCT DTCP NNC CCT NNC,makipag-ugnay sa mga tao sa pamamagitan,makipagugnay sa mga tao sa amagit
003188,CC.* DT.* NN.* CC.* NN.* CC.*,CCT DTCP NNC CCT NNC CCB,sa mga tao sa pamamagitan ng,sa mga tao sa amagit ng
003189,DT.* NN.* CC.* NN.* CC.* NN.*,DTCP NNC CCT NNC CCB NNC,mga tao sa pamamagitan ng pakikipag-usap,mga tao sa amagit ng usap
003190,CC.* NN.* CC.* NN.* CC.* PR.*,CCT NNC CCB NNC CCT PRSP,sa pamamagitan ng pakikipag-usap sa kanila,sa amagit ng usap sa nila
003191,NN.* CC.* NN.* CC.* PR.* CC.*,NNC CCB NNC CCT PRSP CCB,pamamagitan ng pakikipag-usap sa kanila ng,amagit ng usap sa nila ng
003192,CC.* NN.* CC.* PR.* CC.* DT.*,CCB NNC CCT PRSP CCB DTCP,ng pakikipag-usap sa kanila ng mga,ng usap sa nila ng mga
003193,NN.* CC.* PR.* CC.* DT.* NN.*,NNC CCT PRSP CCB DTCP NNC,pakikipag-usap sa kanila ng mga tanong,usap sa nila ng mga tanong
003194,CC.* PR.* CC.* DT.* NN.* CC.*,CCT PRSP CCB DTCP NNC CCT,sa kanila ng mga tanong sa,sa nila ng mga tanong sa
003195,PR.* CC.* DT.* NN.* CC.* PR.*,PRSP CCB DTCP NNC CCT PRSP_CCP,kanila ng mga tanong sa iyong,nila ng mga tanong sa iyo
003196,CC.* DT.* NN.* CC.* PR.* NN.*,CCB DTCP NNC CCT PRSP_CCP NNC_CCP,ng mga tanong sa iyong sariling,ng mga tanong sa iyo sarili
003197,DT.* NN.* CC.* PR.* NN.* DT.*,DTCP NNC CCT PRSP_CCP NNC_CCP DTCP,mga tanong sa iyong sariling mga,mga tanong sa iyo sarili mga
003198,NN.* CC.* PR.* NN.* DT.* NN.*,NNC CCT PRSP_CCP NNC_CCP DTCP NNC,tanong sa iyong sariling mga tanong,tanong sa iyo sarili mga tanong
003227,CC.* NN.* NN.* PR.* JJ.* NN.*,CCT NNC_CCP NNC PRI_CCP JJD_CCP NNC,sa kasamaang palad isang pangunahing sagabal,sa sama palad isa una sagabal
003228,NN.* NN.* PR.* JJ.* NN.* DT.*,NNC_CCP NNC PRI_CCP JJD_CCP NNC DTC,kasamaang palad isang pangunahing sagabal ang,sama palad isa una sagabal ang
003229,NN.* PR.* JJ.* NN.* DT.* VB.*,NNC PRI_CCP JJD_CCP NNC DTC VBAF,palad isang pangunahing sagabal ang pumigil,palad isa una sagabal ang pigil
003230,PR.* JJ.* NN.* DT.* VB.* CC.*,PRI_CCP JJD_CCP NNC DTC VBAF CCT,isang pangunahing sagabal ang pumigil sa,isa una sagabal ang pigil sa
003231,JJ.* NN.* DT.* VB.* CC.* PR.*,JJD_CCP NNC DTC VBAF CCT PRSP,pangunahing sagabal ang pumigil sa kanila.,una sagabal ang pigil sa nila
003259,DT.* PR.* DT.* NN.* LM RB.*,DTC PRC_CCP DTCP NNC LM RBM,Ang ganitong mga piraso ay maaaring,ang ganito mga piraso ay ari
003260,PR.* DT.* NN.* LM RB.* VB.*,PRC_CCP DTCP NNC LM RBM VBW,ganitong mga piraso ay maaaring magkaroon,ganito mga piraso ay ari roon
003261,DT.* NN.* LM RB.* VB.* CC.*,DTCP NNC LM RBM VBW CCB,mga piraso ay maaaring magkaroon ng,mga piraso ay ari roon ng
003262,NN.* LM RB.* VB.* CC.* PR.*,NNC LM RBM VBW CCB PRI_CCP,piraso ay maaaring magkaroon ng isang,piraso ay ari roon ng isa
003263,LM RB.* VB.* CC.* PR.* JJ.*,LM RBM VBW CCB PRI_CCP JJD,ay maaaring magkaroon ng isang ganap,ay ari roon ng isa ganap
003264,RB.* VB.* CC.* PR.* JJ.* CC.*,RBM VBW CCB PRI_CCP JJD CCP,maaaring magkaroon ng isang ganap na,ari roon ng isa ganap na
003265,VB.* CC.* PR.* JJ.* CC.* VB.*,VBW CCB PRI_CCP JJD CCP VBTR_CCP,magkaroon ng isang ganap na naiibang,roon ng isa ganap na iba
003266,CC.* PR.* JJ.* CC.* VB.* NN.*,CCB PRI_CCP JJD CCP VBTR_CCP NNC,ng isang ganap na naiibang pagsasaayos,ng isa ganap na iba saayos
003287,VB.* PR.* VB.* CC.* DT.* JJ.*,VBS PRP_CCP VBAF CCB DTCP JJCS_JJD_CCP,maaari silang gumawa ng mga pinaka-magkakaibang,maaari sila gawa ng mga kaiba
003288,PR.* VB.* CC.* DT.* JJ.* NN.*,PRP_CCP VBAF CCB DTCP JJCS_JJD_CCP NNC,silang gumawa ng mga pinaka-magkakaibang materyales,sila gawa ng mga kaiba materyales
003295,CC.* CC.* RB.* RB.* CC.* NN.*,CCT CCA RBI RBI CCT NNC,kundi pati na rin sa kumpanya,kundi pati na rin sa kumpanya
003296,CC.* RB.* RB.* CC.* NN.* CC.*,CCA RBI RBI CCT NNC CCP,pati na rin sa kumpanya na,pati na rin sa kumpanya na
003297,RB.* RB.* CC.* NN.* CC.* VB.*,RBI RBI CCT NNC CCP VBTS,na rin sa kumpanya na nakipag-ugnay.,na rin sa kumpanya na ugnay
003325,RB.* DT.* DT.* NN.* VB.* NN.*,RBW DTC DTCP NNC_CCP VBN_CCP NNC,Kadalasan ang mga taong walang karanasan,dalas ang mga tao wala ranas
003326,DT.* DT.* NN.* VB.* NN.* CC.*,DTC DTCP NNC_CCP VBN_CCP NNC CCT,ang mga taong walang karanasan sa,ang mga tao wala ranas sa
003327,DT.* NN.* VB.* NN.* CC.* NN.*,DTCP NNC_CCP VBN_CCP NNC CCT NNC,mga taong walang karanasan sa pagtatayo,mga tao wala ranas sa tayo
003328,NN.* VB.* NN.* CC.* NN.* CC.*,NNC_CCP VBN_CCP NNC CCT NNC CCB,taong walang karanasan sa pagtatayo ng,tao wala ranas sa tayo ng
003329,VB.* NN.* CC.* NN.* CC.* JJ.*,VBN_CCP NNC CCT NNC CCB JJCS,walang karanasan sa pagtatayo ng labis-labis,wala ranas sa tayo ng labislabis
003330,NN.* CC.* NN.* CC.* JJ.* DT.*,NNC CCT NNC CCB JJCS DTC,karanasan sa pagtatayo ng labis-labis ang,ranas sa tayo ng labislabis ang
003331,CC.* NN.* CC.* JJ.* DT.* JJ.*,CCT NNC CCB JJCS DTC JJD,sa pagtatayo ng labis-labis ang tunay,sa tayo ng labislabis ang tunay
003332,NN.* CC.* JJ.* DT.* JJ.* CC.*,NNC CCB JJCS DTC JJD CCP,pagtatayo ng labis-labis ang tunay na,tayo ng labislabis ang tunay na
003333,CC.* JJ.* DT.* JJ.* CC.* JJ.*,CCB JJCS DTC JJD CCP JJD,ng labis-labis ang tunay na kumplikado,ng labislabis ang tunay na kumplikado
003334,JJ.* DT.* JJ.* CC.* JJ.* CC.*,JJCS DTC JJD CCP JJD CCB,labis-labis ang tunay na kumplikado ng,labislabis ang tunay na kumplikado ng
003335,DT.* JJ.* CC.* JJ.* CC.* NN.*,DTC JJD CCP JJD CCB NNC,ang tunay na kumplikado ng gawain.,ang tunay na kumplikado ng gawa
003367,RB.* CC.* RB.* RB.* DT.* NN.*,RBR CCT RBK RBQ DTC NNC,batay sa kung saan ang taga-disenyo,batay sa kung saan ang disenyo
003368,CC.* RB.* RB.* DT.* NN.* LM,CCT RBK RBQ DTC NNC LM,sa kung saan ang taga-disenyo ay,sa kung saan ang disenyo ay
003369,RB.* RB.* DT.* NN.* LM VB.*,RBK RBQ DTC NNC LM VBAF,kung saan ang taga-disenyo ay magpanukala,kung saan ang disenyo ay nukala
003370,RB.* DT.* NN.* LM VB.* RB.*,RBQ DTC NNC LM VBAF RBT_CCP,saan ang taga-disenyo ay magpanukala posibleng,saan ang disenyo ay nukala posible
003371,DT.* NN.* LM VB.* RB.* NN.*,DTC NNC LM VBAF RBT_CCP NNC,ang taga-disenyo ay magpanukala posibleng pagpipilian.,ang disenyo ay nukala posible pili
003382,DT.* VB.* NN.* CC.* DT.* NN.*,DTC VBTR_CCP NNC CCB DTCP NNC,ang tinatayang laki ng mga kuwarto,ang taya laki ng mga kuwarto
003397,CC.* VB.* DT.* JJ.* CC.* VB.*,CCB VBW DTC JJCS_JJD CCP VBAF,upang makamit ang pinakamataas na magkasanib,upang kamit ang taas na sanib
003398,VB.* DT.* JJ.* CC.* VB.* CC.*,VBW DTC JJCS_JJD CCP VBAF CCP,makamit ang pinakamataas na magkasanib na,kamit ang taas na sanib na
003399,DT.* JJ.* CC.* VB.* CC.* NN.*,DTC JJCS_JJD CCP VBAF CCP NNC,ang pinakamataas na magkasanib na densidad,ang taas na sanib na densidad
003409,CC.* DT.* NN.* NN.* CC.* NN.*,CCR DTC NNC NNC CCB NNC,dahil ang merkado presyo ng kahoy,dahil ang merkado presyo ng kahoy
003410,DT.* NN.* NN.* CC.* NN.* LM,DTC NNC NNC CCB NNC LM,ang merkado presyo ng kahoy ay,ang merkado presyo ng kahoy ay
003411,NN.* NN.* CC.* NN.* LM VB.*,NNC NNC CCB NNC LM VBTR,merkado presyo ng kahoy ay nagbabago,merkado presyo ng kahoy ay bago
003412,NN.* CC.* NN.* LM VB.* JJ.*,NNC CCB NNC LM VBTR JJD,presyo ng kahoy ay nagbabago Patuloy,presyo ng kahoy ay bago Patuloy
003427,CC.* CC.* VB.* DT.* NN.* CC.*,CCT CCB VBOF DTC NNC CCP,ngunit upang tukuyin ang pagkakasunod-sunod na,ngunit upa tukoy ang sunodsunod na
003428,CC.* VB.* DT.* NN.* CC.* PR.*,CCB VBOF DTC NNC CCP PRO,upang tukuyin ang pagkakasunod-sunod na iyan,upa tukoy ang sunodsunod na iyan
003429,VB.* DT.* NN.* CC.* PR.* CC.*,VBOF DTC NNC CCP PRO CCT,tukuyin ang pagkakasunod-sunod na iyan sa,tukoy ang sunodsunod na iyan sa
003430,DT.* NN.* CC.* PR.* CC.* NN.*,DTC NNC CCP PRO CCT NNC,ang pagkakasunod-sunod na iyan sa paggasta.,ang sunodsunod na iyan sa gasta
003460,DT.* NN.* LM RB.* VB.* CC.*,DTC NNC LM RBD_CCP VBTR CCP,Ang puno ay palaging itinuturing na,ang puno ay lagi turing na
003461,NN.* LM RB.* VB.* CC.* JJ.*,NNC LM RBD_CCP VBTR CCP JJD,puno ay palaging itinuturing na tradisyunal,puno ay lagi turing na tradisyunal
003462,LM RB.* VB.* CC.* JJ.* CC.*,LM RBD_CCP VBTR CCP JJD CCP,ay palaging itinuturing na tradisyunal na,ay lagi turing na tradisyunal na
003463,RB.* VB.* CC.* JJ.* CC.* NN.*,RBD_CCP VBTR CCP JJD CCP NNC,palaging itinuturing na tradisyunal na materyal,lagi turing na tradisyunal na teryal
003464,VB.* CC.* JJ.* CC.* NN.* CC.*,VBTR CCP JJD CCP NNC CCT,itinuturing na tradisyunal na materyal para,turing na tradisyunal na teryal para
003465,CC.* JJ.* CC.* NN.* CC.* CC.*,CCP JJD CCP NNC CCT CCT,na tradisyunal na materyal para sa,na tradisyunal na teryal para sa
003466,JJ.* CC.* NN.* CC.* CC.* NN.*,JJD CCP NNC CCT CCT NNC,tradisyunal na materyal para sa pagtatayo,tradisyunal na teryal para sa tayo
003467,CC.* NN.* CC.* CC.* NN.* CC.*,CCP NNC CCT CCT NNC CCB,na materyal para sa pagtatayo ng,na teryal para sa tayo ng
003468,NN.* CC.* CC.* NN.* CC.* DT.*,NNC CCT CCT NNC CCB DTCP,materyal para sa pagtatayo ng mga,teryal para sa tayo ng mga
003469,CC.* CC.* NN.* CC.* DT.* NN.*,CCT CCT NNC CCB DTCP NNC,para sa pagtatayo ng mga bahay,para sa tayo ng mga bahay
003470,CC.* NN.* CC.* DT.* NN.* CC.*,CCT NNC CCB DTCP NNC CCB,sa pagtatayo ng mga bahay ng,sa tayo ng mga bahay ng
003471,NN.* CC.* DT.* NN.* CC.* PR.*,NNC CCB DTCP NNC CCB PRI,pagtatayo ng mga bahay ng iba’t,tayo ng mga bahay ng iba’t
003472,CC.* DT.* NN.* CC.* PR.* NN.*,CCB DTCP NNC CCB PRI NNCA,ng mga bahay ng iba’t ibang,ng mga bahay ng iba’t iba
003473,DT.* NN.* CC.* PR.* NN.* PR.*,DTCP NNC CCB PRI NNCA PRI_CCP,mga bahay ng iba’t ibang mga,mga bahay ng iba’t iba mga
003474,NN.* CC.* PR.* NN.* PR.* DT.*,NNC CCB PRI NNCA PRI_CCP DTCP,bahay ng iba’t ibang mga kumpigurasyon.,bahay ng iba’t iba mga kumpigura
003529,DT.* DT.* VB.* CC.* DT.* NN.*,DTC DTCP VBTR_VBAF CCP DTCP NNC,Ang mga sumusunod na mga halimbawa,ang mga sunod na mga halimbawa
003530,DT.* VB.* CC.* DT.* NN.* LM,DTCP VBTR_VBAF CCP DTCP NNC LM,mga sumusunod na mga halimbawa ay,mga sunod na mga halimbawa ay
003531,VB.* CC.* DT.* NN.* LM NN.*,VBTR_VBAF CCP DTCP NNC LM NNC,sumusunod na mga halimbawa ay pag-aralan,sunod na mga halimbawa ay aral
003532,CC.* DT.* NN.* LM NN.* CC.*,CCP DTCP NNC LM NNC CCB,na mga halimbawa ay pag-aralan ng,na mga halimbawa ay aral ng
003533,DT.* NN.* LM NN.* CC.* JJ.*,DTCP NNC LM NNC CCB JJD,mga halimbawa ay pag-aralan ng mabuti,mga halimbawa ay aral ng buti
003534,NN.* LM NN.* CC.* JJ.* PR.*,NNC LM NNC CCB JJD PRI,halimbawa ay pag-aralan ng mabuti lahat,halimbawa ay aral ng buti lahat
003535,LM NN.* CC.* JJ.* PR.* CC.*,LM NNC CCB JJD PRI CCB,ay pag-aralan ng mabuti lahat ng,ay aral ng buti lahat ng
003536,NN.* CC.* JJ.* PR.* CC.* PR.*,NNC CCB JJD PRI CCB PRSP_CCP,pag-aralan ng mabuti lahat ng ating,aral ng buti lahat ng atin
003537,CC.* JJ.* PR.* CC.* PR.* DT.*,CCB JJD PRI CCB PRSP_CCP DTCP,ng mabuti lahat ng ating mga,ng buti lahat ng atin mga
003538,JJ.* PR.* CC.* PR.* DT.* NN.*,JJD PRI CCB PRSP_CCP DTCP NNC,mabuti lahat ng ating mga aksyon,buti lahat ng atin mga aksyon
003539,PR.* CC.* PR.* DT.* NN.* LM,PRI CCB PRSP_CCP DTCP NNC LM,lahat ng ating mga aksyon ay,lahat ng atin mga aksyon ay
003540,CC.* PR.* DT.* NN.* LM CC.*,CCB PRSP_CCP DTCP NNC LM CCT,ng ating mga aksyon ay parang,ng atin mga aksyon ay para
003541,PR.* DT.* NN.* LM CC.* NN.*,PRSP_CCP DTCP NNC LM CCT NNC,ating mga aksyon ay parang bato,atin mga aksyon ay para bato
003542,DT.* NN.* LM CC.* NN.* CC.*,DTCP NNC LM CCT NNC CCP,mga aksyon ay parang bato na,mga aksyon ay para bato na
003543,NN.* LM CC.* NN.* CC.* VB.*,NNC LM CCT NNC CCP VBAF,aksyon ay parang bato na bumagsak,aksyon ay para bato na bagsak
003544,LM CC.* NN.* CC.* VB.* CC.*,LM CCT NNC CCP VBAF CCT,ay parang bato na bumagsak sa,ay para bato na bagsak sa
003545,CC.* NN.* CC.* VB.* CC.* NN.*,CCT NNC CCP VBAF CCT NNC,parang bato na bumagsak sa tubig,para bato na bagsak sa tubig
003575,VB.* PR.* DT.* NN.* CC.* VB.*,VBH PRO_CCP DTCP NNC CCP VBTR,meron itong mga alon na nagdudugtong,meron ito mga alon na dugtong
